	magnitude	country	date	name	site	type	lat	lng	textual_infos	datetime
0	4.9	CHN	29/07/1996	-	Lop Nor	Underground	41.82	88.42	Lop Nor	1996-07-29
1	5.9	CHN	08/06/1996	-	Lop Nor	Underground	41.66	88.69	Lop Nor	1996-08-06
2	6.0	CHN	17/08/1995	-	Lop Nor	Underground	41.56	88.8	Lop Nor	1995-08-17
3	6.1	CHN	15/05/1995	-	Lop Nor	Underground	41.6	88.82	Lop Nor	1995-05-15
4	6.0	CHN	07/10/1994	-	Lop Nor	Underground	41.66	88.75	Lop Nor	1994-07-10
5	5.8	CHN	10/06/1994	-	Lop Nor	Underground	41.53	88.71	Lop Nor	1994-10-06
6	5.9	CHN	05/10/1993	-	Lop Nor	Underground	41.667	88.695	Lop Nor	1993-05-10
7	5.0	CHN	25/09/1992	-	Lop Nor	Underground	41.716	88.336	Lop Nor	1992-09-25
8	6.5	CHN	21/05/1992	-	Lop Nor	Underground	41.513	88.774	Lop Nor	1992-05-21
9	6.2	CHN	16/08/1990	-	Lop Nor	Underground	41.514	88.739	Lop Nor	1990-08-16
10	5.5	CHN	26/05/1990	-	Lop Nor	Underground	41.569	88.701	Lop Nor	1990-05-26
11	4.7	CHN	29/09/1988	-	Lop Nor	Underground	41.768	88.38	Lop Nor	1988-09-29
12	6.3	CHN	05/06/1987	-	Lop Nor	Underground	41.518	88.713	Lop Nor	1987-05-06
13	4.7	CHN	19/12/1984	-	Lop Nor	Underground	41.737	88.425	Lop Nor	1984-12-19
14	5.2	CHN	03/10/1984	-	Lop Nor	Underground	41.57	88.73	Lop Nor	1984-03-10
15	5.47	CHN	06/10/1983	-	Lop Nor	Underground	41.54	88.72	Lop Nor	1983-06-10
16	4.5	CHN	04/05/1983	-	Lop Nor	Underground	41.679	88.368	Lop Nor	1983-04-05
17	5.125568513119533	CHN	05/10/1982	-	Lop Nor	Underground	41.5	88.5	Lop Nor	1982-05-10
18	4.44	CHN	16/10/1980	-	Lop Nor	Atmospheric	40.719	89.651	Lop Nor	1980-10-16
19	5.125568513119533	CHN	13/09/1979	-	Lop Nor	Underground	41.5	88.5	Lop Nor	1979-09-13
20	5.125568513119533	CHN	14/12/1978	-	Lop Nor	Atmospheric	41.5	88.5	Lop Nor	1978-12-14
21	4.9	CHN	14/10/1978	-	Lop Nor	Underground	41.523	88.722	Lop Nor	1978-10-14
22	5.125568513119533	CHN	15/03/1978	-	Lop Nor	Underground	41.5	88.5	Lop Nor	1978-03-15
23	5.125568513119533	CHN	17/09/1977	-	Lop Nor	Atmospheric	41.5	88.5	Lop Nor	1977-09-17
24	4.7	CHN	17/11/1976	-	Lop Nor	Atmospheric	40.696	89.627	Lop Nor	1976-11-17
25	4.9	CHN	17/10/1976	-	Lop Nor	Underground	41.708	88.37	Lop Nor	1976-10-17
26	5.125568513119533	CHN	26/09/1976	-	Lop Nor	Atmospheric	41.5	88.5	Lop Nor	1976-09-26
27	5.125568513119533	CHN	23/01/1976	-	Lop Nor	Atmospheric	41.5	88.5	Lop Nor	1976-01-23
28	5.0	CHN	27/10/1975	-	Lop Nor	Underground	41.375	88.326	Lop Nor	1975-10-27
29	4.5	CHN	17/06/1974	-	Lop Nor	Atmospheric	40.518	89.619	Lop Nor	1974-06-17
30	4.8	CHN	27/06/1973	-	Lop Nor	Atmospheric	40.7985	89.8091	Lop Nor	1973-06-27
31	5.125568513119533	CHN	18/03/1972	-	Lop Nor	Atmospheric	41.5	88.5	Lop Nor	1972-03-18
32	5.125568513119533	CHN	07/01/1972	-	Lop Nor	Atmospheric	41.5	88.5	Lop Nor	1972-07-01
33	5.125568513119533	CHN	18/11/1971	-	Lop Nor	Atmospheric	41.5	88.5	Lop Nor	1971-11-18
34	4.6	CHN	14/10/1970	-	Lop Nor	Atmospheric	40.52	89.779	Lop Nor	1970-10-14
35	4.37	CHN	29/09/1969	-	Lop Nor	Atmospheric	40.722	89.515	Lop Nor	1969-09-29
36	5.2	CHN	22/09/1969	-	Lop Nor	Underground	41.376	88.318	Lop Nor	1969-09-22
37	5.125568513119533	CHN	27/12/1968	-	Lop Nor	Atmospheric	41.5	88.5	Lop Nor	1968-12-27
38	5.125568513119533	CHN	24/12/1967	-	Lop Nor	Atmospheric	41.5	88.5	Lop Nor	1967-12-24
39	4.7	CHN	17/06/1967	-	Lop Nor	Atmospheric	40.744	89.775	Lop Nor	1967-06-17
40	5.125568513119533	CHN	28/12/1966	-	Lop Nor	Atmospheric	41.5	88.5	Lop Nor	1966-12-28
41	5.125568513119533	CHN	27/10/1966	-	Lop Nor	Atmospheric	41.5	88.5	Lop Nor	1966-10-27
42	5.125568513119533	CHN	09/05/1966	-	Lop Nor	Atmospheric	41.5	88.5	Lop Nor	1966-09-05
43	5.125568513119533	CHN	14/05/1965	-	Lop Nor	Atmospheric	41.5	88.5	Lop Nor	1965-05-14
44	5.125568513119533	CHN	16/10/1964	-	Lop Nor	Atmospheric	41.5	88.5	Lop Nor	1964-10-16
45	5.3	FRA	27/01/1996	-	Tuamotu Archipelago	Underground	-19.000000	-142.000000	Tuamotu Archipelago	1996-01-27
46	5.1	FRA	27/12/1995	-	Tuamotu Archipelago	Underground	-19.000000	-142.000000	Tuamotu Archipelago	1995-12-27
47	4.8	FRA	21/11/1995	-	Tuamotu Archipelago	Underground	-19.000000	-142.000000	Tuamotu Archipelago	1995-11-21
48	5.4	FRA	27/10/1995	-	Tuamotu Archipelago	Underground	-19.000000	-142.000000	Tuamotu Archipelago	1995-10-27
49	5.4	FRA	01/10/1995	-	Tuamotu Archipelago	Underground	-19.000000	-142.000000	Tuamotu Archipelago	1995-01-10
50	4.8	FRA	05/09/1995	-	Tuamotu Archipelago	Underground	-19.000000	-142.000000	Tuamotu Archipelago	1995-05-09
51	5.3	FRA	15/07/1991	Lycurgue	Tuamotu Archipelago	Underground	-19.000000	-142.000000	Tuamotu Archipelago	1991-07-15
52	3.8	FRA	05/07/1991	Coronis	Tuamotu Archipelago	Underground	-19.000000	-142.000000	Tuamotu Archipelago	1991-05-07
53	5.2	FRA	14/06/1991	Pitthee	Tuamotu Archipelago	Underground	-19.000000	-142.000000	Tuamotu Archipelago	1991-06-14
54	5.5	FRA	29/05/1991	Periclymentos	Tuamotu Archipelago	Underground	-19.000000	-142.000000	Tuamotu Archipelago	1991-05-29
55	5.1	FRA	18/05/1991	Alcinos	Tuamotu Archipelago	Underground	-19.000000	-142.000000	Tuamotu Archipelago	1991-05-18
56	5.125568513119533	FRA	07/05/1991	MElanippe	Tuamotu Archipelago	Underground	-19.000000	-142.000000	Tuamotu Archipelago	1991-07-05
57	5.4	FRA	21/11/1990	Thoas	Tuamotu Archipelago	Underground	-19.000000	-142.000000	Tuamotu Archipelago	1990-11-21
58	5.5	FRA	14/11/1990	Hyrtacos	Tuamotu Archipelago	Underground	-19.000000	-142.000000	Tuamotu Archipelago	1990-11-14
59	5.1	FRA	04/07/1990	Anticlee	Tuamotu Archipelago	Underground	-19.000000	-142.000000	Tuamotu Archipelago	1990-04-07
60	5.5	FRA	26/06/1990	Cypselos	Tuamotu Archipelago	Underground	-19.000000	-142.000000	Tuamotu Archipelago	1990-06-26
61	4.65	FRA	07/06/1990	Megapentes	Tuamotu Archipelago	Underground	-19.000000	-142.000000	Tuamotu Archipelago	1990-07-06
62	5.3	FRA	02/06/1990	Telephe	Tuamotu Archipelago	Underground	-19.000000	-142.000000	Tuamotu Archipelago	1990-02-06
63	5.59	FRA	27/11/1989	Lycos	Tuamotu Archipelago	Underground	-19.000000	-142.000000	Tuamotu Archipelago	1989-11-27
64	5.19	FRA	20/11/1989	Tros	Tuamotu Archipelago	Underground	-19.000000	-142.000000	Tuamotu Archipelago	1989-11-20
65	5.3	FRA	31/10/1989	Erigone	Tuamotu Archipelago	Underground	-19.000000	-142.000000	Tuamotu Archipelago	1989-10-31
66	5.37	FRA	24/10/1989	Hypsipyle	Tuamotu Archipelago	Underground	-19.000000	-142.000000	Tuamotu Archipelago	1989-10-24
67	5.52	FRA	10/06/1989	Cyzicos	Tuamotu Archipelago	Underground	-19.000000	-142.000000	Tuamotu Archipelago	1989-10-06
68	5.16	FRA	03/06/1989	Nyctee	Tuamotu Archipelago	Underground	-19.000000	-142.000000	Tuamotu Archipelago	1989-03-06
69	5.125568513119533	FRA	20/05/1989	Tecmessa	Tuamotu Archipelago	Underground	-19.000000	-142.000000	Tuamotu Archipelago	1989-05-20
70	5.16	FRA	11/05/1989	Epeios	Tuamotu Archipelago	Underground	-19.000000	-142.000000	Tuamotu Archipelago	1989-11-05
71	5.58	FRA	30/11/1988	Cycnos	Tuamotu Archipelago	Underground	-19.000000	-142.000000	Tuamotu Archipelago	1988-11-30
72	5.29	FRA	23/11/1988	Pheres	Tuamotu Archipelago	Underground	-19.000000	-142.000000	Tuamotu Archipelago	1988-11-23
73	5.3	FRA	05/11/1988	Thrasymedes	Tuamotu Archipelago	Underground	-19.000000	-142.000000	Tuamotu Archipelago	1988-05-11
74	5.125568513119533	FRA	25/10/1988	Acrisios	Tuamotu Archipelago	Underground	-19.000000	-142.000000	Tuamotu Archipelago	1988-10-25
75	5.18	FRA	23/06/1988	Dejanire	Tuamotu Archipelago	Underground	-19.000000	-142.000000	Tuamotu Archipelago	1988-06-23
76	4.8	FRA	16/06/1988	Antigone	Tuamotu Archipelago	Underground	-19.000000	-142.000000	Tuamotu Archipelago	1988-06-16
77	5.5	FRA	25/05/1988	Niobe	Tuamotu Archipelago	Underground	-19.000000	-142.000000	Tuamotu Archipelago	1988-05-25
78	5.27	FRA	11/05/1988	Nelee	Tuamotu Archipelago	Underground	-19.000000	-142.000000	Tuamotu Archipelago	1988-11-05
79	5.125568513119533	FRA	29/11/1987	Danae	Tuamotu Archipelago	Underground	-19.000000	-142.000000	Tuamotu Archipelago	1987-11-29
80	5.74	FRA	19/11/1987	Pelee	Tuamotu Archipelago	Underground	-19.000000	-142.000000	Tuamotu Archipelago	1987-11-19
81	5.36	FRA	05/11/1987	Pasiphae	Tuamotu Archipelago	Underground	-19.000000	-142.000000	Tuamotu Archipelago	1987-05-11
82	5.54	FRA	23/10/1987	Helenos	Tuamotu Archipelago	Underground	-19.000000	-142.000000	Tuamotu Archipelago	1987-10-23
83	5.1	FRA	21/06/1987	Iphpitos	Tuamotu Archipelago	Underground	-19.000000	-142.000000	Tuamotu Archipelago	1987-06-21
84	4.4	FRA	06/06/1987	Dirce	Tuamotu Archipelago	Underground	-19.000000	-142.000000	Tuamotu Archipelago	1987-06-06
85	5.51	FRA	20/05/1987	Lycomede	Tuamotu Archipelago	Underground	-19.000000	-142.000000	Tuamotu Archipelago	1987-05-20
86	4.55	FRA	05/05/1987	Jocaste	Tuamotu Archipelago	Underground	-19.000000	-142.000000	Tuamotu Archipelago	1987-05-05
87	5.23	FRA	10/12/1986	Circe	Tuamotu Archipelago	Underground	-19.000000	-142.000000	Tuamotu Archipelago	1986-10-12
88	5.125568513119533	FRA	06/12/1986	Peneleos	Tuamotu Archipelago	Underground	-19.000000	-142.000000	Tuamotu Archipelago	1986-06-12
89	5.28	FRA	12/11/1986	Naupolis	Tuamotu Archipelago	Underground	-19.000000	-142.000000	Tuamotu Archipelago	1986-12-11
90	5.125568513119533	FRA	10/11/1986	hesione	Tuamotu Archipelago	Underground	-19.000000	-142.000000	Tuamotu Archipelago	1986-10-11
91	5.58	FRA	30/05/1986	Galatee	Tuamotu Archipelago	Underground	-19.000000	-142.000000	Tuamotu Archipelago	1986-05-30
92	5.125568513119533	FRA	27/05/1986	Sthenelos	Tuamotu Archipelago	Underground	-19.000000	-142.000000	Tuamotu Archipelago	1986-05-27
93	5.125568513119533	FRA	06/05/1986	Ceto	Tuamotu Archipelago	Underground	-19.000000	-142.000000	Tuamotu Archipelago	1986-06-05
94	4.45	FRA	26/04/1986	Hyllos	Tuamotu Archipelago	Underground	-19.000000	-142.000000	Tuamotu Archipelago	1986-04-26
95	5.76	FRA	26/11/1985	Megaree	Tuamotu Archipelago	Underground	-19.000000	-142.000000	Tuamotu Archipelago	1985-11-26
96	4.55	FRA	24/11/1985	Zetes	Tuamotu Archipelago	Underground	-19.000000	-142.000000	Tuamotu Archipelago	1985-11-24
97	5.3	FRA	26/10/1985	Codros	Tuamotu Archipelago	Underground	-19.000000	-142.000000	Tuamotu Archipelago	1985-10-26
98	5.125568513119533	FRA	24/10/1985	Hero	Tuamotu Archipelago	Underground	-19.000000	-142.000000	Tuamotu Archipelago	1985-10-24
99	5.125568513119533	FRA	07/06/1985	Erginos	Tuamotu Archipelago	Underground	-19.000000	-142.000000	Tuamotu Archipelago	1985-07-06
100	4.83	FRA	03/06/1985	Talaos	Tuamotu Archipelago	Underground	-19.000000	-142.000000	Tuamotu Archipelago	1985-03-06
101	5.64	FRA	08/05/1985	Nisos	Tuamotu Archipelago	Underground	-19.000000	-142.000000	Tuamotu Archipelago	1985-08-05
102	4.51	FRA	30/04/1985	Cercyon	Tuamotu Archipelago	Underground	-19.000000	-142.000000	Tuamotu Archipelago	1985-04-30
103	5.56	FRA	06/12/1984	Memnon	Tuamotu Archipelago	Underground	-19.000000	-142.000000	Tuamotu Archipelago	1984-06-12
104	5.125568513119533	FRA	01/12/1984	Miletos	Tuamotu Archipelago	Underground	-19.000000	-142.000000	Tuamotu Archipelago	1984-01-12
105	5.64	FRA	02/11/1984	Acaste	Tuamotu Archipelago	Underground	-19.000000	-142.000000	Tuamotu Archipelago	1984-02-11
106	4.49	FRA	27/10/1984	Machaon	Tuamotu Archipelago	Underground	-19.000000	-142.000000	Tuamotu Archipelago	1984-10-27
107	5.28	FRA	16/06/1984	Echemos	Tuamotu Archipelago	Underground	-19.000000	-142.000000	Tuamotu Archipelago	1984-06-16
108	5.125568513119533	FRA	12/06/1984	Aristee	Tuamotu Archipelago	Underground	-19.000000	-142.000000	Tuamotu Archipelago	1984-12-06
109	5.57	FRA	12/05/1984	Midas	Tuamotu Archipelago	Underground	-19.000000	-142.000000	Tuamotu Archipelago	1984-12-05
110	5.125568513119533	FRA	08/05/1984	Demophon	Tuamotu Archipelago	Underground	-19.000000	-142.000000	Tuamotu Archipelago	1984-08-05
111	4.89	FRA	07/12/1983	Gyges	Tuamotu Archipelago	Underground	-19.000000	-142.000000	Tuamotu Archipelago	1983-07-12
112	5.125568513119533	FRA	03/12/1983	Linos	Tuamotu Archipelago	Underground	-19.000000	-142.000000	Tuamotu Archipelago	1983-03-12
113	5.13	FRA	04/08/1983	Carnabon	Tuamotu Archipelago	Underground	-19.000000	-142.000000	Tuamotu Archipelago	1983-04-08
114	5.125568513119533	FRA	20/07/1983	Battos	Tuamotu Archipelago	Underground	-19.000000	-142.000000	Tuamotu Archipelago	1983-07-20
115	5.32	FRA	28/06/1983	Oxylos	Tuamotu Archipelago	Underground	-19.000000	-142.000000	Tuamotu Archipelago	1983-06-28
116	5.125568513119533	FRA	18/06/1983	Burisis	Tuamotu Archipelago	Underground	-19.000000	-142.000000	Tuamotu Archipelago	1983-06-18
117	5.87	FRA	25/05/1983	Cinyras	Tuamotu Archipelago	Underground	-19.000000	-142.000000	Tuamotu Archipelago	1983-05-25
118	5.125568513119533	FRA	25/04/1983	Automedon	Tuamotu Archipelago	Underground	-19.000000	-142.000000	Tuamotu Archipelago	1983-04-25
119	5.7	FRA	19/04/1983	Eurytos	Tuamotu Archipelago	Underground	-19.000000	-142.000000	Tuamotu Archipelago	1983-04-19
120	5.125568513119533	FRA	27/11/1982	Procris	Tuamotu Archipelago	Underground	-19.000000	-142.000000	Tuamotu Archipelago	1982-11-27
121	5.6	FRA	25/07/1982	laios	Tuamotu Archipelago	Underground	-19.000000	-142.000000	Tuamotu Archipelago	1982-07-25
122	5.125568513119533	FRA	21/07/1982	Pitane	Tuamotu Archipelago	Underground	-19.000000	-142.000000	Tuamotu Archipelago	1982-07-21
123	5.08	FRA	01/07/1982	Antilokos	Tuamotu Archipelago	Underground	-19.000000	-142.000000	Tuamotu Archipelago	1982-01-07
124	5.125568513119533	FRA	27/06/1982	Laodice	Tuamotu Archipelago	Underground	-19.000000	-142.000000	Tuamotu Archipelago	1982-06-27
125	5.125568513119533	FRA	23/03/1982	Evevos	Tuamotu Archipelago	Underground	-19.000000	-142.000000	Tuamotu Archipelago	1982-03-23
126	4.96	FRA	20/03/1982	Rhesos	Tuamotu Archipelago	Underground	-19.000000	-142.000000	Tuamotu Archipelago	1982-03-20
127	5.125568513119533	FRA	24/02/1982	Deiphobe	Tuamotu Archipelago	Underground	-19.000000	-142.000000	Tuamotu Archipelago	1982-02-24
128	5.125568513119533	FRA	20/02/1982	Aerope	Tuamotu Archipelago	Underground	-19.000000	-142.000000	Tuamotu Archipelago	1982-02-20
129	5.14	FRA	08/12/1981	Cadmos	Tuamotu Archipelago	Underground	-19.000000	-142.000000	Tuamotu Archipelago	1981-08-12
130	4.68	FRA	05/12/1981	Cilix	Tuamotu Archipelago	Underground	-19.000000	-142.000000	Tuamotu Archipelago	1981-05-12
131	4.71	FRA	11/11/1981	Procles	Tuamotu Archipelago	Underground	-19.000000	-142.000000	Tuamotu Archipelago	1981-11-11
132	5.125568513119533	FRA	06/11/1981	Leto	Tuamotu Archipelago	Underground	-19.000000	-142.000000	Tuamotu Archipelago	1981-06-11
133	5.09	FRA	03/08/1981	Agenor	Tuamotu Archipelago	Underground	-19.000000	-142.000000	Tuamotu Archipelago	1981-03-08
134	5.125568513119533	FRA	18/07/1981	Theras	Tuamotu Archipelago	Underground	-19.000000	-142.000000	Tuamotu Archipelago	1981-07-18
135	5.125568513119533	FRA	11/07/1981	Eryx	Tuamotu Archipelago	Underground	-19.000000	-142.000000	Tuamotu Archipelago	1981-11-07
136	5.14	FRA	08/07/1981	Lyncee	Tuamotu Archipelago	Underground	-19.000000	-142.000000	Tuamotu Archipelago	1981-08-07
137	4.76	FRA	10/04/1981	Clymene	Tuamotu Archipelago	Underground	-19.000000	-142.000000	Tuamotu Archipelago	1981-10-04
138	4.75	FRA	28/03/1981	Iphicles	Tuamotu Archipelago	Underground	-19.000000	-142.000000	Tuamotu Archipelago	1981-03-28
139	5.125568513119533	FRA	06/03/1981	Tyro	Tuamotu Archipelago	Underground	-19.000000	-142.000000	Tuamotu Archipelago	1981-06-03
140	5.125568513119533	FRA	27/02/1981	Broteas	Tuamotu Archipelago	Underground	-19.000000	-142.000000	Tuamotu Archipelago	1981-02-27
141	5.58	FRA	03/12/1980	Diomede	Tuamotu Archipelago	Underground	-19.000000	-142.000000	Tuamotu Archipelago	1980-03-12
142	5.125568513119533	FRA	25/11/1980	Laerte	Tuamotu Archipelago	Underground	-19.000000	-142.000000	Tuamotu Archipelago	1980-11-25
143	5.73	FRA	19/07/1980	Asios	Tuamotu Archipelago	Underground	-19.000000	-142.000000	Tuamotu Archipelago	1980-07-19
144	4.54	FRA	06/07/1980	Chryses	Tuamotu Archipelago	Underground	-19.000000	-142.000000	Tuamotu Archipelago	1980-06-07
145	5.125568513119533	FRA	21/06/1980	Ilus	Tuamotu Archipelago	Underground	-19.000000	-142.000000	Tuamotu Archipelago	1980-06-21
146	5.3	FRA	16/06/1980	Eurypyle	Tuamotu Archipelago	Underground	-19.000000	-142.000000	Tuamotu Archipelago	1980-06-16
147	4.3	FRA	04/04/1980	Pelpos	Tuamotu Archipelago	Underground	-19.000000	-142.000000	Tuamotu Archipelago	1980-04-04
148	5.05	FRA	01/04/1980	Boros	Tuamotu Archipelago	Underground	-19.000000	-142.000000	Tuamotu Archipelago	1980-01-04
149	5.63	FRA	23/03/1980	Thesee	Tuamotu Archipelago	Underground	-19.000000	-142.000000	Tuamotu Archipelago	1980-03-23
150	5.125568513119533	FRA	03/03/1980	Adraste	Tuamotu Archipelago	Underground	-19.000000	-142.000000	Tuamotu Archipelago	1980-03-03
151	5.125568513119533	FRA	23/02/1980	Thysets	Tuamotu Archipelago	Underground	-19.000000	-142.000000	Tuamotu Archipelago	1980-02-23
152	5.125568513119533	FRA	22/11/1979	Atree	Tuamotu Archipelago	Underground	-19.000000	-142.000000	Tuamotu Archipelago	1979-11-22
153	5.125568513119533	FRA	19/11/1979	Chrysotemis	Tuamotu Archipelago	Underground	-19.000000	-142.000000	Tuamotu Archipelago	1979-11-19
154	4.73	FRA	28/07/1979	Palamede	Tuamotu Archipelago	Underground	-19.000000	-142.000000	Tuamotu Archipelago	1979-07-28
155	6.11	FRA	25/07/1979	Tydee	Tuamotu Archipelago	Underground	-19.000000	-142.000000	Tuamotu Archipelago	1979-07-25
156	5.21	FRA	29/06/1979	Egisthe	Tuamotu Archipelago	Underground	-19.000000	-142.000000	Tuamotu Archipelago	1979-06-29
157	4.71	FRA	18/06/1979	Pyrrhos	Tuamotu Archipelago	Underground	-19.000000	-142.000000	Tuamotu Archipelago	1979-06-18
158	4.69	FRA	04/04/1979	Polydore	Tuamotu Archipelago	Underground	-19.000000	-142.000000	Tuamotu Archipelago	1979-04-04
159	4.93	FRA	24/03/1979	Agapenor	Tuamotu Archipelago	Underground	-19.000000	-142.000000	Tuamotu Archipelago	1979-03-24
160	5.125568513119533	FRA	09/03/1979	Philoctete	Tuamotu Archipelago	Underground	-19.000000	-142.000000	Tuamotu Archipelago	1979-09-03
161	5.125568513119533	FRA	01/03/1979	Penthesilee	Tuamotu Archipelago	Underground	-19.000000	-142.000000	Tuamotu Archipelago	1979-01-03
162	5.01	FRA	19/12/1978	Eumee	Tuamotu Archipelago	Underground	-19.000000	-142.000000	Tuamotu Archipelago	1978-12-19
163	5.125568513119533	FRA	17/12/1978	Eteocle	Tuamotu Archipelago	Underground	-19.000000	-142.000000	Tuamotu Archipelago	1978-12-17
164	5.86	FRA	30/11/1978	Priam	Tuamotu Archipelago	Underground	-19.000000	-142.000000	Tuamotu Archipelago	1978-11-30
165	5.125568513119533	FRA	02/11/1978	Schedios	Tuamotu Archipelago	Underground	-19.000000	-142.000000	Tuamotu Archipelago	1978-02-11
166	5.125568513119533	FRA	26/07/1978	Idomenee	Tuamotu Archipelago	Underground	-19.000000	-142.000000	Tuamotu Archipelago	1978-07-26
167	5.125568513119533	FRA	19/07/1978	Ares	Tuamotu Archipelago	Underground	-19.000000	-142.000000	Tuamotu Archipelago	1978-07-19
168	5.125568513119533	FRA	01/07/1978	Xanthois	Tuamotu Archipelago	Underground	-19.000000	-142.000000	Tuamotu Archipelago	1978-01-07
169	5.125568513119533	FRA	25/03/1978	Hecube	Tuamotu Archipelago	Underground	-19.000000	-142.000000	Tuamotu Archipelago	1978-03-25
170	4.73	FRA	22/03/1978	Pylade	Tuamotu Archipelago	Underground	-19.000000	-142.000000	Tuamotu Archipelago	1978-03-22
171	5.125568513119533	FRA	27/02/1978	Polypheme	Tuamotu Archipelago	Underground	-19.000000	-142.000000	Tuamotu Archipelago	1978-02-27
172	5.125568513119533	FRA	17/12/1977	Laocoon	Tuamotu Archipelago	Underground	-19.000000	-142.000000	Tuamotu Archipelago	1977-12-17
173	5.86	FRA	24/11/1977	Enee	Tuamotu Archipelago	Underground	-19.000000	-142.000000	Tuamotu Archipelago	1977-11-24
174	5.125568513119533	FRA	12/11/1977	Oreste	Tuamotu Archipelago	Underground	-19.000000	-142.000000	Tuamotu Archipelago	1977-12-11
175	4.81	FRA	06/07/1977	Ajax	Tuamotu Archipelago	Underground	-19.000000	-142.000000	Tuamotu Archipelago	1977-06-07
176	5.125568513119533	FRA	02/04/1977	0	Tuamotu Archipelago	Underground	-19.000000	-142.000000	Tuamotu Archipelago	1977-02-04
177	5.92	FRA	19/03/1977	Nestor	Tuamotu Archipelago	Underground	-19.000000	-142.000000	Tuamotu Archipelago	1977-03-19
178	5.02	FRA	19/02/1977	Ulysse_B	Tuamotu Archipelago	Underground	-19.000000	-142.000000	Tuamotu Archipelago	1977-02-19
179	5.125568513119533	FRA	05/12/1976	Astanax	Tuamotu Archipelago	Underground	-19.000000	-142.000000	Tuamotu Archipelago	1976-05-12
180	5.125568513119533	FRA	30/10/1976	Ulysse_A	Tuamotu Archipelago	Underground	-19.000000	-142.000000	Tuamotu Archipelago	1976-10-30
181	4.93	FRA	11/07/1976	Menelas	Tuamotu Archipelago	Underground	-19.000000	-142.000000	Tuamotu Archipelago	1976-11-07
182	5.125568513119533	FRA	03/04/1976	Patrocle	Tuamotu Archipelago	Underground	-19.000000	-142.000000	Tuamotu Archipelago	1976-03-04
183	5.125568513119533	FRA	26/11/1975	Hector	Tuamotu Archipelago	Underground	-19.000000	-142.000000	Tuamotu Archipelago	1975-11-26
184	5.125568513119533	FRA	05/06/1975	Achille	Tuamotu Archipelago	Underground	-19.000000	-142.000000	Tuamotu Archipelago	1975-05-06
185	5.125568513119533	FRA	14/09/1974	Verseau	Tuamotu Archipelago	Atmospheric	-19.000000	-142.000000	Tuamotu Archipelago	1974-09-14
186	5.125568513119533	FRA	24/08/1974	Taurue	Tuamotu Archipelago	Atmospheric	-19.000000	-142.000000	Tuamotu Archipelago	1974-08-24
187	5.125568513119533	FRA	15/08/1974	Scorpion	Tuamotu Archipelago	Atmospheric	-19.000000	-142.000000	Tuamotu Archipelago	1974-08-15
188	5.125568513119533	FRA	25/07/1974	Maquis	Tuamotu Archipelago	Atmospheric	-19.000000	-142.000000	Tuamotu Archipelago	1974-07-25
189	5.125568513119533	FRA	17/07/1974	Centaure	Tuamotu Archipelago	Atmospheric	-19.000000	-142.000000	Tuamotu Archipelago	1974-07-17
190	5.125568513119533	FRA	07/07/1974	Gemeaux	Tuamotu Archipelago	Atmospheric	-19.000000	-142.000000	Tuamotu Archipelago	1974-07-07
191	5.125568513119533	FRA	16/06/1974	Capricorne	Tuamotu Archipelago	Atmospheric	-19.000000	-142.000000	Tuamotu Archipelago	1974-06-16
192	5.125568513119533	FRA	28/08/1973	Tamara	Tuamotu Archipelago	Atmospheric	-19.000000	-142.000000	Tuamotu Archipelago	1973-08-28
193	5.125568513119533	FRA	24/08/1973	Parthenope	Tuamotu Archipelago	Atmospheric	-19.000000	-142.000000	Tuamotu Archipelago	1973-08-24
194	5.125568513119533	FRA	18/08/1973	Pallas	Tuamotu Archipelago	Atmospheric	-19.000000	-142.000000	Tuamotu Archipelago	1973-08-18
195	5.125568513119533	FRA	28/07/1973	Melpomene	Tuamotu Archipelago	Atmospheric	-19.000000	-142.000000	Tuamotu Archipelago	1973-07-28
196	5.125568513119533	FRA	21/07/1973	Euterpe	Tuamotu Archipelago	Atmospheric	-19.000000	-142.000000	Tuamotu Archipelago	1973-07-21
197	5.125568513119533	FRA	27/07/1972	Oberon	Tuamotu Archipelago	Atmospheric	-19.000000	-142.000000	Tuamotu Archipelago	1972-07-27
198	5.125568513119533	FRA	30/06/1972	Titania	Tuamotu Archipelago	Atmospheric	-19.000000	-142.000000	Tuamotu Archipelago	1972-06-30
199	5.125568513119533	FRA	25/06/1972	Umbriel	Tuamotu Archipelago	Atmospheric	-19.000000	-142.000000	Tuamotu Archipelago	1972-06-25
200	4.65	FRA	14/08/1971	Rhea	Tuamotu Archipelago	Atmospheric	-19.000000	-142.000000	Tuamotu Archipelago	1971-08-14
201	5.125568513119533	FRA	08/08/1971	Phoebe	Tuamotu Archipelago	Atmospheric	-19.000000	-142.000000	Tuamotu Archipelago	1971-08-08
202	5.125568513119533	FRA	04/07/1971	Japet	Tuamotu Archipelago	Atmospheric	-19.000000	-142.000000	Tuamotu Archipelago	1971-04-07
203	5.125568513119533	FRA	12/06/1971	Encelade	Tuamotu Archipelago	Atmospheric	-19.000000	-142.000000	Tuamotu Archipelago	1971-12-06
204	5.125568513119533	FRA	05/06/1971	Dione	Tuamotu Archipelago	Atmospheric	-19.000000	-142.000000	Tuamotu Archipelago	1971-05-06
205	5.125568513119533	FRA	06/08/1970	Toucan	Tuamotu Archipelago	Atmospheric	-19.000000	-142.000000	Tuamotu Archipelago	1970-06-08
206	5.125568513119533	FRA	02/08/1970	Orion	Tuamotu Archipelago	Atmospheric	-19.000000	-142.000000	Tuamotu Archipelago	1970-02-08
207	5.125568513119533	FRA	27/07/1970	Pegase	Tuamotu Archipelago	Atmospheric	-19.000000	-142.000000	Tuamotu Archipelago	1970-07-27
208	4.65	FRA	03/07/1970	Licorne	Tuamotu Archipelago	Atmospheric	-19.000000	-142.000000	Tuamotu Archipelago	1970-03-07
209	5.125568513119533	FRA	24/06/1970	Eridan	Tuamotu Archipelago	Atmospheric	-19.000000	-142.000000	Tuamotu Archipelago	1970-06-24
210	4.44	FRA	30/05/1970	Dragon	Tuamotu Archipelago	Atmospheric	-19.000000	-142.000000	Tuamotu Archipelago	1970-05-30
211	5.125568513119533	FRA	22/05/1970	Cassiopee	Tuamotu Archipelago	Atmospheric	-19.000000	-142.000000	Tuamotu Archipelago	1970-05-22
212	5.125568513119533	FRA	15/05/1970	Andromede	Tuamotu Archipelago	Atmospheric	-19.000000	-142.000000	Tuamotu Archipelago	1970-05-15
213	4.91	FRA	08/09/1968	Procyon	Tuamotu Archipelago	Atmospheric	-19.000000	-142.000000	Tuamotu Archipelago	1968-08-09
214	4.95	FRA	24/08/1968	Canopus	Tuamotu Archipelago	Atmospheric	-19.000000	-142.000000	Tuamotu Archipelago	1968-08-24
215	5.125568513119533	FRA	03/08/1968	Pollux	Tuamotu Archipelago	Atmospheric	-19.000000	-142.000000	Tuamotu Archipelago	1968-03-08
216	5.125568513119533	FRA	15/07/1968	Castor	Tuamotu Archipelago	Atmospheric	-19.000000	-142.000000	Tuamotu Archipelago	1968-07-15
217	5.125568513119533	FRA	07/07/1968	Capella	Tuamotu Archipelago	Atmospheric	-19.000000	-142.000000	Tuamotu Archipelago	1968-07-07
218	5.125568513119533	FRA	02/07/1967	Arcturus	Tuamotu Archipelago	Atmospheric	-19.000000	-142.000000	Tuamotu Archipelago	1967-02-07
219	5.125568513119533	FRA	27/06/1967	Antares	Tuamotu Archipelago	Atmospheric	-19.000000	-142.000000	Tuamotu Archipelago	1967-06-27
220	5.125568513119533	FRA	05/06/1967	Altair	Tuamotu Archipelago	Atmospheric	-19.000000	-142.000000	Tuamotu Archipelago	1967-05-06
221	5.125568513119533	FRA	04/10/1966	Sirus	Tuamotu Archipelago	Atmospheric	-19.000000	-142.000000	Tuamotu Archipelago	1966-04-10
222	5.125568513119533	FRA	24/09/1966	Rigel	Tuamotu Archipelago	Atmospheric	-19.000000	-142.000000	Tuamotu Archipelago	1966-09-24
223	5.125568513119533	FRA	11/09/1966	Betelguese	Tuamotu Archipelago	Atmospheric	-19.000000	-142.000000	Tuamotu Archipelago	1966-11-09
224	5.125568513119533	FRA	19/07/1966	Tamore	Tuamotu Archipelago	Atmospheric	-19.000000	-142.000000	Tuamotu Archipelago	1966-07-19
225	5.125568513119533	FRA	02/07/1966	Aldebaron	Tuamotu Archipelago	Atmospheric	-19.000000	-142.000000	Tuamotu Archipelago	1966-02-07
226	4.94	FRA	16/02/1966	grenat	Ekker, Algeria	Underground	24.0441	5.0412	Ekker, Algeria	1966-02-16
227	5.1	FRA	01/12/1965	tourmaline	Ekker, Algeria	Underground	24.0437	5.0469	Ekker, Algeria	1965-01-12
228	5.125568513119533	FRA	01/10/1965	corindon	Ekker, Algeria	Underground	24.0649	5.034	Ekker, Algeria	1965-01-10
229	5.125568513119533	FRA	30/05/1965	jade	Ekker, Algeria	Underground	24.055	5.0508	Ekker, Algeria	1965-05-30
230	5.8	FRA	27/02/1965	saphir	Ekker, Algeria	Underground	24.0587	5.0311	Ekker, Algeria	1965-02-27
231	5.125568513119533	FRA	28/11/1964	turquoise	Ekker, Algeria	Underground	24.0418	5.0416	Ekker, Algeria	1964-11-28
232	5.125568513119533	FRA	15/06/1964	topaze	Ekker, Algeria	Underground	24.0666	5.0345	Ekker, Algeria	1964-06-15
233	4.52	FRA	14/02/1964	opale	Ekker, Algeria	Underground	24.0536	5.0523	Ekker, Algeria	1964-02-14
234	5.6	FRA	20/10/1963	rubis	Ekker, Algeria	Underground	24.0355	5.0386	Ekker, Algeria	1963-10-20
235	5.125568513119533	FRA	30/03/1963	amethyste	Ekker, Algeria	Underground	24.0433	5.057	Ekker, Algeria	1963-03-30
236	4.86	FRA	18/03/1963	emeraude	Ekker, Algeria	Underground	24.0413	5.0521	Ekker, Algeria	1963-03-18
237	5.125568513119533	FRA	01/05/1962	beryl	Ekker, Algeria	Underground	24.063	5.0418	Ekker, Algeria	1962-01-05
238	5.125568513119533	FRA	07/11/1961	agate	Ekker, Algeria	Underground	24.0571	5.0521	Ekker, Algeria	1961-07-11
239	5.125568513119533	FRA	25/04/1961	-	Reggan,Algeria	Atmospheric	25.275963	-1.520862	Reggan,Algeria	1961-04-25
240	5.125568513119533	FRA	27/12/1960	gerb._rouge	Reggan,Algeria	Atmospheric	25.275963	-1.520862	Reggan,Algeria	1960-12-27
241	5.125568513119533	FRA	01/04/1960	gerb._blanche	Reggan,Algeria	Atmospheric	25.275963	-1.520862	Reggan,Algeria	1960-01-04
242	5.125568513119533	FRA	13/02/1960	gerb._bleue	Reggan,Algeria	Atmospheric	25.275963	-1.520862	Reggan,Algeria	1960-02-13
243	5.2	IND	11/05/1998	Shakti-1	Pokharan	Underground	27.078	71.719	Pokharan	1998-11-05
244	5.0	IND	18/05/1974	-	Pokharan	Underground	27.095	71.752	Pokharan	1974-05-18
245	4.6	PAK	30/05/1998	Chagai-II	Kharan	Underground	28.49	63.73	Kharan	1998-05-30
246	4.87	PAK	28/05/1998	Chagai-I	Ras Koh Mountains	Underground	28.83	64.95	Ras Koh Mountains	1998-05-28
247	3.9	NK	09/10/2006		Punggye	Underground	41.3	129.2	Punggye	2006-09-10
248	5.7	SOV	24/10/1990	715 S	Novaya Zemlya Test Site	Underground	73.331	54.757	Novaya Zemlya Test Site	1990-10-24
249	5.86	SOV	19/10/1989	714 S	Semipalatinsk	Underground	49.9222	78.9083	Semipalatinsk	1989-10-19
250	4.6	SOV	04/10/1989		Semipalatinsk	Underground	49.7498	78.0117	Semipalatinsk	1989-04-10
251	4.94	SOV	02/09/1989	712 S	Semipalatinsk	Underground	50.0058	78.9856	Semipalatinsk	1989-02-09
252	5.55	SOV	08/07/1989		Semipalatinsk	Underground	49.8678	78.7803	Semipalatinsk	1989-08-07
253	5.0	SOV	17/02/1989		Semipalatinsk	Underground	49.8278	78.0597	Semipalatinsk	1989-02-17
254	5.86	SOV	12/02/1989		Semipalatinsk	Underground	49.9186	78.7111	Semipalatinsk	1989-12-02
255	6.1	SOV	22/01/1989	708 S	Semipalatinsk	Underground	49.9394	78.8194	Semipalatinsk	1989-01-22
256	3.74	SOV	28/12/1988	707 S	Semipalatinsk	Underground	49.8011	78.0686	Semipalatinsk	1988-12-28
257	5.83	SOV	17/12/1988	706 S	Semipalatinsk	Underground	49.8819	78.9247	Semipalatinsk	1988-12-17
258	5.9	SOV	04/12/1988	705 S	Novaya Zemlya Test Site	Underground	73.366	55.001	Novaya Zemlya Test Site	1988-04-12
259	5.4	SOV	23/11/1988	704 S	Semipalatinsk	Underground	49.7794	78.0372	Semipalatinsk	1988-11-23
260	5.24	SOV	12/11/1988		Semipalatinsk	Underground	50.0431	78.9689	Semipalatinsk	1988-12-11
261	4.9	SOV	18/10/1988		Semipalatinsk	Underground	49.78	78.0172	Semipalatinsk	1988-10-18
262	6.03	SOV	14/09/1988	701 Shagan	Semipalatinsk	Underground	49.8778	78.8231	Semipalatinsk	1988-09-14
263	4.8	SOV	06/09/1988	700 Rubin-1		Underground	61.361	48.092	700 Rubin-1, ????????? ???????? ?????????, ??????????? ?????, ????????????? ???????, ??????-???????? ??????????? ?????, ??	1988-06-09
264	5.3	SOV	22/08/1988	699 Rubin-2		Underground	66.28	78.491	699 Rubin-2, ????????? ?????, ?????-???????? ?????????? ?????, ????????? ??????????? ?????, ??	1988-08-22
265	4.8	SOV	14/06/1988	698	Semipalatinsk	Underground	50.0189	78.9606	Semipalatinsk	1988-06-14
266	5.6	SOV	07/05/1988	697 S	Novaya Zemlya Test Site	Underground	73.314	54.553	Novaya Zemlya Test Site	1988-07-05
267	6.09	SOV	04/05/1988		Semipalatinsk	Underground	49.9494	78.7503	Semipalatinsk	1988-04-05
268	4.9	SOV	22/04/1988		Semipalatinsk	Underground	49.7903	78.1069	Semipalatinsk	1988-04-22
269	5.99	SOV	03/04/1988		Semipalatinsk	Underground	49.9083	78.9083	Semipalatinsk	1988-03-04
270	5.98	SOV	13/02/1988	693 S	Semipalatinsk	Underground	49.9367	78.8639	Semipalatinsk	1988-02-13
271	4.7	SOV	06/02/1988	692 S	Semipalatinsk	Underground	49.7758	78.0197	Semipalatinsk	1988-06-02
272	6.0	SOV	27/12/1987	691 S	Semipalatinsk	Underground	49.8794	78.725	Semipalatinsk	1987-12-27
273	4.8	SOV	20/12/1987		Semipalatinsk	Underground	49.7758	78.0122	Semipalatinsk	1987-12-20
274	6.06	SOV	13/12/1987	689 S	Semipalatinsk	Underground	49.9631	78.7931	Semipalatinsk	1987-12-13
275	5.98	SOV	15/11/1987	688 S	Semipalatinsk	Underground	49.8986	78.7581	Semipalatinsk	1987-11-15
276	6.1	SOV	16/10/1987	687	Semipalatinsk	Underground	49.7297	78.0867	Semipalatinsk	1987-10-16
277	5.3	SOV	03/10/1987	686 Batolit-2		Underground	47.6	56.2	686 Batolit-2, ???????????? ?????, ??????????? ???????, ?????????	1987-03-10
278	4.3	SOV	18/09/1987	685 S	Semipalatinsk	Underground	49.8044	78.0875	Semipalatinsk	1987-09-18
279	5.0	SOV	12/08/1987	684 Neva 2-3		Underground	61.45	112.8	681 Neva 2-2, ??????, ?????????????? ??????, ?????????? ????, ?????????? ???? (??????), ???, ??	1987-12-08
280	5.82	SOV	02/08/1987	682 S	Novaya Zemlya Test Site	Underground	73.326	54.602	Novaya Zemlya Test Site	1987-02-08
281	5.83	SOV	02/08/1987	683 S	Semipalatinsk	Underground	49.8806	78.8747	Semipalatinsk	1987-02-08
282	5.1	SOV	24/07/1987	681 Neva 2-2		Underground	61.45	112.8	681 Neva 2-2, ??????, ?????????????? ??????, ?????????? ????, ?????????? ???? (??????), ???, ??	1987-07-24
283	5.8	SOV	17/07/1987		Semipalatinsk	Underground	49.7758	78.0197	Semipalatinsk	1987-07-17
284	5.1	SOV	07/07/1987	679 Neva 2-1		Underground	61.5	112.85	679 Neva 2-1, ??????, ?????????????? ??????, ?????????? ????, ?????????? ???? (??????), ???, ??	1987-07-07
285	6.03	SOV	20/06/1987	678 S	Semipalatinsk	Underground	49.9353	78.7442	Semipalatinsk	1987-06-20
286	5.4	SOV	06/06/1987		Semipalatinsk	Underground	49.8367	78.0617	Semipalatinsk	1987-06-06
287	5.6	SOV	06/05/1987		Semipalatinsk	Underground	49.7758	78.0122	Semipalatinsk	1987-06-05
288	4.5	SOV	19/04/1987	675 Geliy		Underground	60.8	57.5	675 Geliy, ????? ??????????, ????????? ????????? ?????????, ?????????? ?????, ???????? ????, ??????????? ??????????? ?????, ??	1987-04-19
289	4.5	SOV	19/04/1987	674 Geliy		Underground	60.6	57.2	674 Geliy, ??????????????? ?????, ???????? ????, ??????????? ??????????? ?????, ??	1987-04-19
290	5.92	SOV	17/04/1987	673 S	Semipalatinsk	Underground	49.8778	78.6689	Semipalatinsk	1987-04-17
291	5.125568513119533	SOV	03/04/1987	672 S	Semipalatinsk	Underground	49.7539	78.1144	Semipalatinsk	1987-03-04
292	6.12	SOV	03/04/1987		Semipalatinsk	Underground	49.9181	78.7803	Semipalatinsk	1987-03-04
293	5.31	SOV	12/03/1987	670 S	Semipalatinsk	Underground	49.9353	78.8289	Semipalatinsk	1987-12-03
294	5.4	SOV	26/02/1987		Semipalatinsk	Underground	49.8342	78.0811	Semipalatinsk	1987-02-26
295	4.82	SOV	25/07/1985	668 S	Semipalatinsk	Underground	49.8186	78.0164	Semipalatinsk	1985-07-25
296	5.89	SOV	20/07/1985		Semipalatinsk	Underground	49.9497	78.7839	Semipalatinsk	1985-07-20
297	2.5	SOV	19/07/1985		Semipalatinsk	Underground	49.8011	78.0686	Semipalatinsk	1985-07-19
298	5.1	SOV	18/07/1985	666 Agat		Underground	65.994	41.038	666 Agat, ?????????? ???????? ?????????, ????????? ?????, ????????????? ???????, ??????-???????? ??????????? ?????, ??	1985-07-18
299	4.05	SOV	11/07/1985		Semipalatinsk	Underground	49.7506	78.0492	Semipalatinsk	1985-11-07
300	5.92	SOV	30/06/1985	663 S	Semipalatinsk	Underground	49.8644	78.6686	Semipalatinsk	1985-06-30
301	5.125568513119533	SOV	18/06/1985	662 benzol		Underground	60.6	72.7	662 Benzol, ????????????? ?????, ?????-?????????? ?????????? ????? - ????, ????????? ??????????? ?????, ??	1985-06-18
302	6.05	SOV	15/06/1985	661 S	Semipalatinsk	Underground	49.9086	78.8428	Semipalatinsk	1985-06-15
303	5.84	SOV	25/04/1985	660 S	Semipalatinsk	Underground	49.9267	78.8808	Semipalatinsk	1985-04-25
304	5.83	SOV	10/02/1985	659 S	Semipalatinsk	Underground	49.8992	78.7806	Semipalatinsk	1985-10-02
305	6.0	SOV	28/12/1984	658 S	Semipalatinsk	Underground	49.8803	78.7039	Semipalatinsk	1984-12-28
306	6.12	SOV	16/12/1984	657 S	Semipalatinsk	Underground	49.9458	78.8086	Semipalatinsk	1984-12-16
307	5.77	SOV	02/12/1984	656 S	Semipalatinsk	Underground	50.0061	79.0089	Semipalatinsk	1984-02-12
308	4.38	SOV	23/11/1984	655 S	Semipalatinsk	Underground	49.8125	78.0594	Semipalatinsk	1984-11-23
309	5.0	SOV	27/10/1984	653 Vega		Underground	46.95	48.1	653 Vega, ??????????? ?????????, ???????????? ?????, ???????????? ???????, ???, ??	1984-10-27
310	5.0	SOV	27/10/1984	652 Vega		Underground	46.9	48.15	652 Vega, ??????????? ?????????, ???????????? ?????, ???????????? ???????, ???, ??	1984-10-27
311	6.19	SOV	27/10/1984		Semipalatinsk	Underground	49.9347	78.9281	Semipalatinsk	1984-10-27
312	5.9	SOV	25/10/1984	651 S	Novaya Zemlya Test Site	Underground	73.355	54.99	Novaya Zemlya Test Site	1984-10-25
313	4.25	SOV	18/10/1984		Semipalatinsk	Underground	49.7294	78.0864	Semipalatinsk	1984-10-18
314	5.0	SOV	17/09/1984	649 Kvarts-4		Underground	55.834	87.526	649 Kvarts-4, ????????? ???????? ?????????, ??????????? ?????, ??????????? ???????, ???, ??	1984-09-17
315	4.89	SOV	09/09/1984	648 S	Semipalatinsk	Underground	49.8044	78.0875	Semipalatinsk	1984-09-09
316	4.4	SOV	28/08/1984	647 Geliy		Underground	60.7	57.5	647 Geliy, ??????????????? ?????, ???????? ????, ??????????? ??????????? ?????, ??	1984-08-28
317	4.4	SOV	28/08/1984	646 Geliy		Underground	60.3	57.1	646 Geliy, ??????????????? ?????, ???????? ????, ??????????? ??????????? ?????, ??	1984-08-28
318	4.7	SOV	27/08/1984	645 Dnepr-2 S		Underground	67.75	33	645 Dnepr-2, ????????? ????? ??????????, ?????????? ???????, ??????-???????? ??????????? ?????, ??	1984-08-27
319	3.8	SOV	26/08/1984	644 Dynamika	Novaya Zemlya Test Site	Underground	73.4	54.8	Novaya Zemlya Test Site	1984-08-26
320	5.3	SOV	25/08/1984	643 Kvarts-3		Underground	61.9	72.1	?????? - ???????????????, ?????????? ?????, ?????-?????????? ?????????? ????? - ????, ????????? ??????????? ?????, ??	1984-08-25
321	5.3	SOV	11/08/1984	642 Kvarts-2		Underground	65.05	55.1	642 Kvarts-2, ???????? ????????? ????????, ????? ??????, ?????????? ????, ??????-???????? ??????????? ?????, ??	1984-11-08
322	5.4	SOV	21/07/1984	641 Lira		Underground	51.391	53.351	641 Lira, ?????????? ?????, ???????-????????????? ???????, ?????????	1984-07-21
323	5.3	SOV	21/07/1984	640 Lira		Underground	51.371	53.337	640 Lira, ?????????? ?????, ???????-????????????? ???????, ?????????	1984-07-21
324	5.4	SOV	21/07/1984	639 Lira		Underground	51.358	53.319	639 Lira, ?????????? ?????, ???????-????????????? ???????, ?????????	1984-07-21
325	6.1	SOV	14/07/1984	638 S	Semipalatinsk	Underground	49.9094	78.8772	Semipalatinsk	1984-07-14
326	6.01	SOV	26/05/1984	637 S	Semipalatinsk	Underground	49.9789	79.0056	Semipalatinsk	1984-05-26
327	5.9	SOV	25/04/1984	636 S	Semipalatinsk	Underground	49.9358	78.8506	Semipalatinsk	1984-04-25
328	5.72	SOV	15/04/1984	635 S	Semipalatinsk	Underground	49.7606	78.0892	Semipalatinsk	1984-04-15
329	5.86	SOV	29/03/1984		Semipalatinsk	Underground	49.9111	78.9269	Semipalatinsk	1984-03-29
330	5.56	SOV	07/03/1984		Semipalatinsk	Underground	50.05	78.9561	Semipalatinsk	1984-07-03
331	5.77	SOV	19/02/1984		Semipalatinsk	Underground	49.8961	78.7431	Semipalatinsk	1984-02-19
332	5.48	SOV	26/12/1983		Semipalatinsk	Underground	49.79	78.1092	Semipalatinsk	1983-12-26
333	5.31	SOV	29/11/1983	630 S	Semipalatinsk	Underground	49.7586	78.0486	Semipalatinsk	1983-11-29
334	5.125568513119533	SOV	29/11/1983		Semipalatinsk	Underground	49.7303	78.0958	Semipalatinsk	1983-11-29
335	5.33	SOV	20/11/1983	628 S	Semipalatinsk	Underground	50.0508	78.9992	Semipalatinsk	1983-11-20
336	3.0	SOV	02/11/1983		Semipalatinsk	Underground	49.7792	78.1247	Semipalatinsk	1983-02-11
337	6.04	SOV	26/10/1983		Semipalatinsk	Underground	49.9125	78.8217	Semipalatinsk	1983-10-26
338	5.95	SOV	06/10/1983	625 S	Semipalatinsk	Underground	49.9246	78.7507	Semipalatinsk	1983-06-10
339	5.8	SOV	25/09/1983	624 S	Novaya Zemlya Test Site	Underground	73.328	54.541	Novaya Zemlya Test Site	1983-09-25
340	5.3	SOV	24/09/1983	623 Vega		Underground	46.766	48.274	623 Vega, ??????????? ?????????, ???????????? ?????, ???????????? ???????, ???, ??	1983-09-24
341	5.4	SOV	24/09/1983	622 Vega		Underground	46.754	48.289	622 Vega, ??????????? ?????????, ???????????? ?????, ???????????? ???????, ???, ??	1983-09-24
342	5.2	SOV	24/09/1983	621 Vega		Underground	46.749	48.303	621 Vega, ??????????? ?????????, ???????????? ?????, ???????????? ???????, ???, ??	1983-09-24
343	5.0	SOV	24/09/1983	620 Vega		Underground	46.767	48.31	620 Vega, ??????????? ?????????, ???????????? ?????, ???????????? ???????, ???, ??	1983-09-24
344	5.1	SOV	24/09/1983	619 Vega		Underground	46.788	48.297	619 Vega, ??????????? ?????????, ???????????? ?????, ???????????? ???????, ???, ??	1983-09-24
345	5.2	SOV	24/09/1983	618 Vega		Underground	46.783	48.315	618 Vega, ??????????? ?????????, ???????????? ?????, ???????????? ???????, ???, ??	1983-09-24
346	4.48	SOV	11/09/1983	617 Dynamika	Semipalatinsk	Underground	49.7847	78.0842	Semipalatinsk	1983-11-09
347	5.91	SOV	18/08/1983	616 S	Novaya Zemlya Test Site	Underground	73.354	54.974	Novaya Zemlya Test Site	1983-08-18
348	5.3	SOV	10/07/1983	615 Lira		Underground	51.38	53.34	615 Lira, ?????????? ?????, ???????-????????????? ???????, ?????????	1983-10-07
349	5.3	SOV	10/07/1983	614 Lira		Underground	51.367	53.327	614 Lira, ?????????? ?????, ???????-????????????? ???????, ?????????	1983-10-07
350	5.3	SOV	10/07/1983	613 Lira		Underground	51.363	53.306	613 Lira, ?????????? ?????, ???????-????????????? ???????, ?????????	1983-10-07
351	4.46	SOV	24/06/1983		Semipalatinsk	Underground	49.7397	78.0358	Semipalatinsk	1983-06-24
352	6.1	SOV	12/06/1983	611 S	Semipalatinsk	Underground	49.925	78.8981	Semipalatinsk	1983-12-06
353	5.43	SOV	30/05/1983	610 S	Semipalatinsk	Underground	49.7411	78.1203	Semipalatinsk	1983-05-30
354	4.65	SOV	12/04/1983		Semipalatinsk	Underground	49.7856	78.0847	Semipalatinsk	1983-12-04
355	4.61	SOV	30/03/1983		Semipalatinsk	Underground	49.785	78.0406	Semipalatinsk	1983-03-30
356	5.125568513119533	SOV	11/03/1983		Semipalatinsk	Underground	49.8233	78.0333	Semipalatinsk	1983-11-03
357	5.58	SOV	26/12/1982	606 S	Semipalatinsk	Underground	50.0631	78.9939	Semipalatinsk	1982-12-26
358	4.47	SOV	25/12/1982	605 S	Semipalatinsk	Underground	49.7811	78.035	Semipalatinsk	1982-12-25
359	6.08	SOV	05/12/1982	604 S	Semipalatinsk	Underground	49.9308	78.8097	Semipalatinsk	1982-05-12
360	5.4	SOV	16/10/1982	603 Vega		Underground	46.76	48.3	603 Vega, ??????????? ?????????, ???????????? ?????, ???????????? ???????, ???, ??	1982-10-16
361	5.2	SOV	16/10/1982	602 Vega		Underground	46.766	48.288	602 Vega, ??????????? ?????????, ???????????? ?????, ???????????? ???????, ???, ??	1982-10-16
362	5.2	SOV	16/10/1982	601 Vega		Underground	46.752	48.258	601 Vega, ??????????? ?????????, ???????????? ?????, ???????????? ???????, ???, ??	1982-10-16
363	5.2	SOV	16/10/1982	600 Vega		Underground	46.759	48.247	600 Vega, ??????????? ?????????, ???????????? ?????, ???????????? ???????, ???, ??	1982-10-16
364	5.6	SOV	11/10/1982	599 S	Novaya Zemlya Test Site	Underground	73.339	54.608	Novaya Zemlya Test Site	1982-11-10
365	5.3	SOV	10/10/1982	598 Neva-1		Underground	61.55	112.85	598 Neva-1, ?????????????? ??????, ?????????? ????, ?????????? ???? (??????), ???, ??	1982-10-10
366	5.2	SOV	25/09/1982	597 Rift-4		Underground	64.35	91.8	597 Rift-4, ??????????? ?????, ???????????? ????, ???, ??	1982-09-25
367	5.15	SOV	21/09/1982	596 S	Semipalatinsk	Underground	49.7792	78.1247	Semipalatinsk	1982-09-21
368	5.3	SOV	04/09/1982	595 Rift-1		Underground	69.2	81.65	595 Rift-1, ????????? ?????, ?????-???????? ?????????? ?????, ????????? ??????????? ?????, ??	1982-04-09
369	5.2	SOV	31/08/1982	594 S	Semipalatinsk	Underground	49.9142	78.7614	Semipalatinsk	1982-08-31
370	4.44	SOV	23/08/1982	593 S	Semipalatinsk	Underground	49.7403	78.0308	Semipalatinsk	1982-08-23
371	5.0	SOV	30/07/1982	592 Rift-3		Underground	53.8	104.15	592 Rift-3, ???????? ?????, ????-????????? ????????? ?????, ????????? ???????, ???, ??	1982-07-30
372	6.08	SOV	04/07/1982	591 S	Semipalatinsk	Underground	49.9586	78.8117	Semipalatinsk	1982-04-07
373	4.57	SOV	25/06/1982	590 S	Semipalatinsk	Underground	49.7714	78.1108	Semipalatinsk	1982-06-25
374	6.03	SOV	25/04/1982	589 S	Semipalatinsk	Underground	49.9169	78.8878	Semipalatinsk	1982-04-25
375	5.4	SOV	19/02/1982	588 S	Semipalatinsk	Underground	49.8233	78.0333	Semipalatinsk	1982-02-19
376	6.16	SOV	27/12/1981		Semipalatinsk	Underground	49.9331	78.7783	Semipalatinsk	1981-12-27
377	4.96	SOV	22/12/1981	586 S	Semipalatinsk	Underground	49.8342	78.0803	Semipalatinsk	1981-12-22
378	5.62	SOV	29/11/1981	585 S	Semipalatinsk	Underground	49.9019	78.8489	Semipalatinsk	1981-11-29
379	5.0	SOV	20/11/1981	584 S	Semipalatinsk	Underground	49.7367	78.1042	Semipalatinsk	1981-11-20
380	5.1	SOV	22/10/1981	583 Shpat-2		Underground	63.8	97.55	583 Shpat-2, ??????????? ?????, ???????????? ????, ???, ??	1981-10-22
381	6.0	SOV	18/10/1981	582 S	Semipalatinsk	Underground	49.9281	78.8447	Semipalatinsk	1981-10-18
382	5.125568513119533	SOV	16/10/1981		Semipalatinsk	Underground	49.8342	78.0803	Semipalatinsk	1981-10-16
383	6.0	SOV	01/10/1981	580 S	Novaya Zemlya Test Site	Underground	73.304	54.818	Novaya Zemlya Test Site	1981-01-10
384	5.3	SOV	26/09/1981	579 Vega		Underground	46.771	48.304	579 Vega, ??????????? ?????????, ???????????? ?????, ???????????? ???????, ???, ??	1981-09-26
385	5.2	SOV	26/09/1981	578 Vega		Underground	46.79	48.313	578 Vega, ??????????? ?????????, ???????????? ?????, ???????????? ???????, ???, ??	1981-09-26
386	6.06	SOV	13/09/1981		Semipalatinsk	Underground	49.9133	78.8944	Semipalatinsk	1981-09-13
387	4.4	SOV	02/09/1981	576 Geliy-1		Underground	60.6	55.7	576 Geliy-1, ?????????? ???????? ?????????, ?????????? ?????, ???????? ????, ??????????? ??????????? ?????, ??	1981-02-09
388	4.88	SOV	14/08/1981	575 S	Semipalatinsk	Underground	49.7522	78.0531	Semipalatinsk	1981-08-14
389	5.07	SOV	17/07/1981		Semipalatinsk	Underground	49.8014	78.1314	Semipalatinsk	1981-07-17
390	5.16	SOV	30/06/1981	573 S	Semipalatinsk	Underground	49.7675	78.0808	Semipalatinsk	1981-06-30
391	5.125568513119533	SOV	04/06/1981		Semipalatinsk	Underground	49.8233	78.0417	Semipalatinsk	1981-04-06
392	5.3	SOV	27/05/1981		Semipalatinsk	Underground	49.9869	78.9706	Semipalatinsk	1981-05-27
393	5.5	SOV	25/05/1981	570 Pirit		Underground	68.2	53.5	570 Pirit, ???????, ?????????? ?????, ???????? ?????????? ?????, ??????-???????? ??????????? ?????, ??	1981-05-25
394	5.94	SOV	22/04/1981	569 S	Semipalatinsk	Underground	49.8989	78.8086	Semipalatinsk	1981-04-22
395	5.49	SOV	29/03/1981	568 S	Semipalatinsk	Underground	50.0181	78.9788	Semipalatinsk	1981-03-29
396	5.125568513119533	SOV	25/03/1981		Semipalatinsk	Underground	49.8233	78.0417	Semipalatinsk	1981-03-25
397	5.87	SOV	27/12/1980	566 S	Semipalatinsk	Underground	50.0619	78.9753	Semipalatinsk	1980-12-27
398	4.16	SOV	26/12/1980		Semipalatinsk	Underground	49.8261	78.0919	Semipalatinsk	1980-12-26
399	5.93	SOV	14/12/1980	564 S	Semipalatinsk	Underground	49.9089	78.9186	Semipalatinsk	1980-12-14
400	4.6	SOV	10/12/1980	563 Angara		Underground	61.75	66.75	??????????? ?????, ?????-?????????? ?????????? ????? - ????, ????????? ??????????? ?????, ??	1980-10-12
401	5.125568513119533	SOV	05/12/1980	562 S	Semipalatinsk	Underground	49.8308	78.1139	Semipalatinsk	1980-05-12
402	3.6	SOV	05/12/1980		Semipalatinsk	Underground	49.7517	78.1317	Semipalatinsk	1980-05-12
403	5.2	SOV	01/11/1980	560 Batolit-1		Underground	60.8	97.55	560 Batolit-1, ??????????? ?????, ???????????? ????, ???, ??	1980-01-11
404	2.5	SOV	23/10/1980		Semipalatinsk	Underground	49.7517	78.1317	Semipalatinsk	1980-10-23
405	5.88	SOV	12/10/1980	558 S	Semipalatinsk	Underground	49.9675	79.0225	Semipalatinsk	1980-12-10
406	5.8	SOV	11/10/1980	557 S	Novaya Zemlya Test Site	Underground	73.336	54.94	Novaya Zemlya Test Site	1980-11-10
407	5.2	SOV	08/10/1980	556 Vega-1		Underground	46.757	48.275	556 Vega-1, ??????????? ?????????, ???????????? ?????, ???????????? ???????, ???, ??	1980-08-10
408	4.83	SOV	25/09/1980	555 Dynamika	Semipalatinsk	Underground	49.7833	78.0806	Semipalatinsk	1980-09-25
409	6.21	SOV	14/09/1980		Semipalatinsk	Underground	49.9367	78.7975	Semipalatinsk	1980-09-14
410	5.33	SOV	31/07/1980	553 S	Semipalatinsk	Underground	49.7906	78.0908	Semipalatinsk	1980-07-31
411	5.69	SOV	29/06/1980	552 S	Semipalatinsk	Underground	49.9486	78.8181	Semipalatinsk	1980-06-29
412	5.125568513119533	SOV	25/06/1980	550 Butan		Underground	52.9	56.5	237 Butan, ????????????, ???????????? ?????, ????????????, ??????????? ??????????? ?????, ??	1980-06-25
413	3.7	SOV	25/06/1980		Semipalatinsk	Underground	49.8258	78.0994	Semipalatinsk	1980-06-25
414	5.125568513119533	SOV	16/06/1980	549 Butan		Underground	52.9	56.5	237 Butan, ????????????, ???????????? ?????, ????????????, ??????????? ??????????? ?????, ??	1980-06-16
415	5.52	SOV	12/06/1980		Semipalatinsk	Underground	49.9887	78.9911	Semipalatinsk	1980-12-06
416	5.53	SOV	22/05/1980	547 S	Semipalatinsk	Underground	49.7797	78.0364	Semipalatinsk	1980-05-22
417	5.45	SOV	25/04/1980	546 S	Semipalatinsk	Underground	49.9764	78.7594	Semipalatinsk	1980-04-25
418	4.98	SOV	10/04/1980	545 S	Semipalatinsk	Underground	49.7825	78.0572	Semipalatinsk	1980-10-04
419	4.9	SOV	04/04/1980		Semipalatinsk	Underground	50	77.823	Semipalatinsk	1980-04-04
420	5.125568513119533	SOV	14/03/1980		Semipalatinsk	Underground	49.8233	78.0417	Semipalatinsk	1980-03-14
421	6.13	SOV	23/12/1979	542 S	Semipalatinsk	Underground	49.9322	78.7528	Semipalatinsk	1979-12-23
422	4.71	SOV	21/12/1979		Semipalatinsk	Underground	49.7922	78.113	Semipalatinsk	1979-12-21
423	5.99	SOV	02/12/1979	540 S	Semipalatinsk	Underground	49.9094	78.7844	Semipalatinsk	1979-02-12
424	4.42	SOV	30/11/1979		Semipalatinsk	Underground	49.7831	78.0867	Semipalatinsk	1979-11-30
425	5.98	SOV	28/10/1979	538 S	Semipalatinsk	Underground	49.9967	78.995	Semipalatinsk	1979-10-28
426	5.8	SOV	24/10/1979	537 Galit S		Underground	47.85	48.14	537 Galit, ??????????????? ?????, ?????????? ???????, ?????????	1979-10-24
427	5.85	SOV	18/10/1979	536 S	Novaya Zemlya Test Site	Underground	73.316	54.816	Novaya Zemlya Test Site	1979-10-18
428	5.23	SOV	18/10/1979	535 S	Semipalatinsk	Underground	49.8242	78.0975	Semipalatinsk	1979-10-18
429	5.0	SOV	07/10/1979	534 Sheksna		Underground	61.85	113.1	534 Sheksna, ?????????????? ??????, ?????????? ????, ?????????? ???? (??????), ???, ??	1979-07-10
430	5.4	SOV	04/10/1979	533 Kimberlit-1		Underground	60.675	71.455	533 Kimberlit-1, ????????????? ?????, ?????-?????????? ?????????? ????? - ????, ????????? ??????????? ?????, ??	1979-04-10
431	4.42	SOV	27/09/1979		Semipalatinsk	Underground	49.7506	78.0492	Semipalatinsk	1979-09-27
432	5.8	SOV	24/09/1979	531 S	Novaya Zemlya Test Site	Underground	73.343	54.672	Novaya Zemlya Test Site	1979-09-24
433	5.125568513119533	SOV	16/09/1979	530 Klivazh		Underground	48.2	38.3	530 Klivazh, ?-05-17, ???????????, ????????????? ???????? ????, ??????????? ?????? ????, ???????? ???????, 86222, ???????	1979-09-16
434	4.9	SOV	06/09/1979	529 Kimberlit-3		Underground	64.11	99.562	529 Kimberlit-3, ??????????? ?????, ???????????? ????, ???, ??	1979-06-09
435	6.13	SOV	18/08/1979	528 S	Semipalatinsk	Underground	49.9481	78.9189	Semipalatinsk	1979-08-18
436	4.9	SOV	12/08/1979	527 Kimberlit-4		Underground	61.803	122.43	527 Kimberlit-4, ???????????? ??????, ??????????????? ????, ?????????? ???? (??????), ???, ??	1979-12-08
437	6.13	SOV	04/08/1979	526 S	Semipalatinsk	Underground	49.9031	78.8878	Semipalatinsk	1979-04-08
438	5.2	SOV	18/07/1979		Semipalatinsk	Underground	49.7772	78.1125	Semipalatinsk	1979-07-18
439	5.16	SOV	18/07/1979		Semipalatinsk	Underground	49.919	77.812	Semipalatinsk	1979-07-18
440	5.6	SOV	14/07/1979	523 Galit S		Underground	47.88	48.12	523 Galit, ??????????????? ?????, ?????????? ???????, ?????????	1979-07-14
441	5.84	SOV	07/07/1979	522 S	Semipalatinsk	Underground	50.0331	78.9892	Semipalatinsk	1979-07-07
442	6.16	SOV	23/06/1979		Semipalatinsk	Underground	49.9147	78.8458	Semipalatinsk	1979-06-23
443	5.125568513119533	SOV	12/06/1979		Semipalatinsk	Underground	49.81	78.1714	Semipalatinsk	1979-12-06
444	5.27	SOV	31/05/1979	519 S	Semipalatinsk	Underground	49.8128	78.0594	Semipalatinsk	1979-05-31
445	5.22	SOV	06/05/1979	518 S	Semipalatinsk	Underground	49.7619	77.9825	Semipalatinsk	1979-06-05
446	5.125568513119533	SOV	10/04/1979		Semipalatinsk	Underground	49.81	78.1714	Semipalatinsk	1979-10-04
447	5.125568513119533	SOV	23/03/1979		Semipalatinsk	Underground	49.81	78.1714	Semipalatinsk	1979-03-23
448	5.39	SOV	16/02/1979	515 S	Semipalatinsk	Underground	49.974	77.668	Semipalatinsk	1979-02-16
449	5.29	SOV	01/02/1979		Semipalatinsk	Underground	50.0808	78.8533	Semipalatinsk	1979-01-02
450	6.0	SOV	17/01/1979	513 Galit S		Underground	47.92	48.12	513 Galit, ??????????????? ?????, ?????????? ???????, ?????????	1979-01-17
451	5.125568513119533	SOV	10/01/1979			Underground	47.909	47.912	508, ??????????????? ?????, ?????????? ???????, ?????????	1979-10-01
452	4.71	SOV	20/12/1978	511 S	Semipalatinsk	Underground	49.8108	78.0542	Semipalatinsk	1978-12-20
453	5.9	SOV	18/12/1978	510 Galit		Underground	47.86	48.16	510 Galit, ??????????????? ?????, ?????????? ???????, ?????????	1978-12-18
454	4.74	SOV	14/12/1978		Semipalatinsk	Underground	49.8158	78.1067	Semipalatinsk	1978-12-14
455	5.125568513119533	SOV	30/11/1978			Underground	47.909	47.912	508, ??????????????? ?????, ?????????? ???????, ?????????	1978-11-30
456	5.21	SOV	29/11/1978		Semipalatinsk	Underground	49.7833	78.0156	Semipalatinsk	1978-11-29
457	5.96	SOV	29/11/1978	506 S	Semipalatinsk	Underground	49.9533	78.7953	Semipalatinsk	1978-11-29
458	5.56	SOV	04/11/1978	505 S	Semipalatinsk	Underground	50.0417	78.9472	Semipalatinsk	1978-04-11
459	5.25	SOV	31/10/1978		Semipalatinsk	Underground	49.7886	78.1075	Semipalatinsk	1978-10-31
460	5.5	SOV	17/10/1978	503 Kraton-1		Underground	63.185	63.432	503 Kraton-1, ??????????? ?????, ?????-?????????? ?????????? ????? - ????, ????????? ??????????? ?????, ??	1978-10-17
461	5.8	SOV	17/10/1978	502 Galit S		Underground	47.85	48.12	502 Galit, ??????????????? ?????, ?????????? ???????, ?????????	1978-10-17
462	5.15	SOV	15/10/1978		Semipalatinsk	Underground	49.7367	78.1111	Semipalatinsk	1978-10-15
463	5.2	SOV	08/10/1978	500 Vyatka		Underground	61.55	112.85	598 Neva-1, ?????????????? ??????, ?????????? ????, ?????????? ???? (??????), ???, ??	1978-08-10
464	5.63	SOV	27/09/1978	499 S	Novaya Zemlya Test Site	Underground	73.349	54.676	Novaya Zemlya Test Site	1978-09-27
465	5.2	SOV	21/09/1978	498 Kraton-2		Underground	66.598	86.21	498 Kraton-2, ??????????? ?????, ???????????? ????, ???, ??	1978-09-21
466	4.21	SOV	20/09/1978		Semipalatinsk	Underground	49.7986	78.15	Semipalatinsk	1978-09-20
467	5.89	SOV	15/09/1978		Semipalatinsk	Underground	49.9283	78.8617	Semipalatinsk	1978-09-15
468	5.125568513119533	SOV	12/09/1978			Underground	47.909	47.912	508, ??????????????? ?????, ?????????? ???????, ?????????	1978-12-09
469	5.9	SOV	29/08/1978		Semipalatinsk	Underground	50.0061	78.9672	Semipalatinsk	1978-08-29
470	5.04	SOV	29/08/1978	493 S	Semipalatinsk	Underground	49.8133	78.1086	Semipalatinsk	1978-08-29
471	5.1	SOV	24/08/1978	492 Kraton-3		Underground	65.925	112.338	?????????? ????, ?????????? ???? (??????), ???, ??	1978-08-24
472	6.04	SOV	10/08/1978	491 S	Novaya Zemlya Test Site	Underground	73.291	54.883	Novaya Zemlya Test Site	1978-10-08
473	5.6	SOV	09/08/1978	490 Kraton-4		Underground	63.678	125.522	?????????? ??????, ????????? ????, ?????????? ???? (??????), ???, ??	1978-09-08
474	5.75	SOV	28/07/1978	489 S	Semipalatinsk	Underground	49.755	78.145	Semipalatinsk	1978-07-28
475	5.77	SOV	05/07/1978		Semipalatinsk	Underground	49.9	78.8667	Semipalatinsk	1978-05-07
476	5.83	SOV	11/06/1978		Semipalatinsk	Underground	49.9133	78.8019	Semipalatinsk	1978-11-06
477	5.125568513119533	SOV	02/06/1978		Semipalatinsk	Underground	49.7433	78.0517	Semipalatinsk	1978-02-06
478	4.68	SOV	29/05/1978		Semipalatinsk	Underground	49.7914	78.0944	Semipalatinsk	1978-05-29
479	5.125568513119533	SOV	24/05/1978		Semipalatinsk	Underground	49.7433	78.0517	Semipalatinsk	1978-05-24
480	5.35	SOV	22/04/1978	483 S	Semipalatinsk	Underground	49.7517	78.1317	Semipalatinsk	1978-04-22
481	5.69	SOV	26/03/1978	482 S	Semipalatinsk	Underground	49.7619	77.9825	Semipalatinsk	1978-03-26
482	5.19	SOV	19/03/1978		Semipalatinsk	Underground	49.945	77.704	Semipalatinsk	1978-03-19
483	4.91	SOV	26/12/1977	480 S	Semipalatinsk	Underground	49.8014	78.1283	Semipalatinsk	1977-12-26
484	5.125568513119533	SOV	26/12/1977		Semipalatinsk	Underground	49.8108	78.0542	Semipalatinsk	1977-12-26
485	5.89	SOV	30/11/1977	478 S	Semipalatinsk	Underground	49.9672	78.8744	Semipalatinsk	1977-11-30
486	3.92	SOV	27/11/1977		Semipalatinsk	Underground	49.7544	78.0503	Semipalatinsk	1977-11-27
487	2.8	SOV	12/11/1977		Semipalatinsk	Underground	50.0522	78.8644	Semipalatinsk	1977-12-11
488	5.125568513119533	SOV	30/10/1977			Underground	47.909	47.912	508, ??????????????? ?????, ?????????? ???????, ?????????	1977-10-30
489	5.56	SOV	29/10/1977		Semipalatinsk	Underground	50.0522	78.9803	Semipalatinsk	1977-10-29
490	5.52	SOV	29/10/1977	473 S	Semipalatinsk	Underground	49.8342	78.0803	Semipalatinsk	1977-10-29
491	5.125568513119533	SOV	14/10/1977			Underground	47.909	47.912	508, ??????????????? ?????, ?????????? ???????, ?????????	1977-10-14
492	4.6	SOV	09/10/1977		Novaya Zemlya Test Site	Underground	73.409	54.927	Novaya Zemlya Test Site	1977-09-10
493	5.0	SOV	30/09/1977	470 Galit		Underground	47.897	48.161	470 Galit, ??????????????? ?????, ?????????? ???????, ?????????	1977-09-30
494	4.8	SOV	10/09/1977	469 Meteorit-4		Underground	57.251	106.551	469 Meteorit-4, ?????, ???????????????? ???????? ?????????, ????-??????? ?????, ????????? ???????, ???, ??	1977-10-09
495	5.73	SOV	05/09/1977	468 S	Semipalatinsk	Underground	50.0556	78.9142	Semipalatinsk	1977-05-09
496	5.71	SOV	01/09/1977	467 S	Novaya Zemlya Test Site	Underground	73.339	54.619	Novaya Zemlya Test Site	1977-01-09
497	5.0	SOV	20/08/1977	466 Meteorit-3		Underground	64.108	99.558	466 Meteorit-3, ??????????? ?????, ???????????? ????, ???, ??	1977-08-20
498	5.01	SOV	17/08/1977		Semipalatinsk	Underground	49.8308	78.1139	Semipalatinsk	1977-08-17
499	5.0	SOV	10/08/1977	464 Meteorit-5		Underground	50.955	110.983	464 Meteorit-5, ??????, ?????????? ???????? ?????????, ????????? ?????, ????????????? ????, ???, ??	1977-10-08
500	5.13	SOV	30/07/1977	463 S	Semipalatinsk	Underground	49.7506	78.0492	Semipalatinsk	1977-07-30
501	5.0	SOV	26/07/1977	462 Meteorit-2		Underground	69.575	90.375	462 Meteorit-2, ????????? ????????? ???????, ?????????? ???????-???????? ?????, ???????????? ????, ???, ??	1977-07-26
502	5.2	SOV	29/06/1977		Semipalatinsk	Underground	49.9994	78.8667	Semipalatinsk	1977-06-29
503	5.75	SOV	29/05/1977		Semipalatinsk	Underground	49.9464	78.7717	Semipalatinsk	1977-05-29
504	5.07	SOV	25/04/1977		Semipalatinsk	Underground	49.8133	78.1086	Semipalatinsk	1977-04-25
505	5.41	SOV	29/03/1977	457 S	Semipalatinsk	Underground	49.7764	78.0175	Semipalatinsk	1977-03-29
506	5.4	SOV	29/03/1977		Semipalatinsk	Underground	49.97	78.086	Semipalatinsk	1977-03-29
507	5.09	SOV	30/12/1976	456 S	Semipalatinsk	Underground	49.7803	78.0367	Semipalatinsk	1976-12-30
508	5.9	SOV	07/12/1976		Semipalatinsk	Underground	49.8992	78.7864	Semipalatinsk	1976-07-12
509	5.8	SOV	07/12/1976	454 S	Semipalatinsk	Underground	49.9439	78.8392	Semipalatinsk	1976-07-12
510	5.79	SOV	23/11/1976		Semipalatinsk	Underground	50.0131	78.9433	Semipalatinsk	1976-11-23
511	5.3	SOV	05/11/1976	452 Oka		Underground	61.458	112.86	452 Oka, ??????, ?????????????? ??????, ?????????? ????, ?????????? ???? (??????), ???, ??	1976-05-11
512	4.62	SOV	30/10/1976		Semipalatinsk	Underground	49.8314	78.0572	Semipalatinsk	1976-10-30
513	5.1	SOV	20/10/1976	450 S	Novaya Zemlya Test Site	Underground	73.398	54.812	Novaya Zemlya Test Site	1976-10-20
514	5.83	SOV	29/09/1976	449 S	Novaya Zemlya Test Site	Underground	73.36	54.871	Novaya Zemlya Test Site	1976-09-29
515	5.74	SOV	28/08/1976		Semipalatinsk	Underground	49.975	78.9264	Semipalatinsk	1976-08-28
516	4.2	SOV	04/08/1976		Semipalatinsk	Underground	49.87	77.7	Semipalatinsk	1976-04-08
517	5.9	SOV	29/07/1976			Underground	47.87	48.15	446, ??????????????? ?????, ?????????? ???????, ?????????	1976-07-29
518	4.96	SOV	23/07/1976		Semipalatinsk	Underground	49.7433	78.0517	Semipalatinsk	1976-07-23
519	5.85	SOV	04/07/1976		Semipalatinsk	Underground	49.9042	78.8994	Semipalatinsk	1976-04-07
520	5.07	SOV	09/06/1976		Semipalatinsk	Underground	49.9936	79.0244	Semipalatinsk	1976-09-06
521	4.72	SOV	19/05/1976		Semipalatinsk	Underground	49.7775	78.0156	Semipalatinsk	1976-05-19
522	4.94	SOV	21/04/1976		Semipalatinsk	Underground	49.9006	78.8308	Semipalatinsk	1976-04-21
523	5.12	SOV	21/04/1976		Semipalatinsk	Underground	49.7547	78.1075	Semipalatinsk	1976-04-21
524	3.0	SOV	10/04/1976		Semipalatinsk	Underground	49.755	78.0475	Semipalatinsk	1976-10-04
525	4.3	SOV	29/03/1976			Underground	47.897	48.133	352 Galit, ??????????????? ?????, ?????????? ???????, ?????????	1976-03-29
526	2.2	SOV	17/03/1976		Semipalatinsk	Underground	49.7556	78.0992	Semipalatinsk	1976-03-17
527	5.18	SOV	15/01/1976		Semipalatinsk	Underground	49.81	78.1714	Semipalatinsk	1976-01-15
528	5.69	SOV	25/12/1975		Semipalatinsk	Underground	50.0439	78.82	Semipalatinsk	1975-12-25
529	5.0	SOV	13/12/1975		Semipalatinsk	Underground	49.8133	78.1086	Semipalatinsk	1975-12-13
530	5.61	SOV	29/10/1975		Semipalatinsk	Underground	49.9539	78.8739	Semipalatinsk	1975-10-29
531	6.6	SOV	21/10/1975	432 S	Novaya Zemlya Test Site	Underground	73.307	55.01	Novaya Zemlya Test Site	1975-10-21
532	5.125568513119533	SOV	18/10/1975	430 S	Novaya Zemlya Test Site	Underground	70.816	53.744	Novaya Zemlya Test Site	1975-10-18
533	6.75	SOV	18/10/1975		Novaya Zemlya Test Site	Underground	70.816	53.753	Novaya Zemlya Test Site	1975-10-18
534	4.28	SOV	05/10/1975		Semipalatinsk	Underground	49.7831	78.0867	Semipalatinsk	1975-05-10
535	4.8	SOV	29/09/1975	428 Gorizont-3		Underground	69.578	90.337	428 Gorizont-3, ????????? ????????? ???????, ?????????? ???????-???????? ?????, ???????????? ????, ???, ??	1975-09-29
536	6.55	SOV	23/08/1975	427 S	Novaya Zemlya Test Site	Underground	73.334	54.682	Novaya Zemlya Test Site	1975-08-23
537	5.1	SOV	12/08/1975	426 Gorizont-4		Underground	70.763	126.953	426 Gorizont-4, ????????? ??????, ????????? ????, ?????????? ???? (??????), ???, ??	1975-12-08
538	5.2	SOV	07/08/1975	425 S	Semipalatinsk	Underground	49.8019	78.1306	Semipalatinsk	1975-07-08
539	3.3	SOV	15/07/1975	424 S	Semipalatinsk	Underground	49.7914	78.0944	Semipalatinsk	1975-07-15
540	4.52	SOV	30/06/1975		Semipalatinsk	Underground	49.9856	78.8969	Semipalatinsk	1975-06-30
541	5.55	SOV	08/06/1975		Semipalatinsk	Underground	49.7517	78.0058	Semipalatinsk	1975-08-06
542	5.51	SOV	27/04/1975		Semipalatinsk	Underground	49.9375	78.9036	Semipalatinsk	1975-04-27
543	4.7	SOV	25/04/1975			Underground	47.909	47.912	508, ??????????????? ?????, ?????????? ???????, ?????????	1975-04-25
544	5.42	SOV	11/03/1975		Semipalatinsk	Underground	49.7547	78.1075	Semipalatinsk	1975-11-03
545	5.77	SOV	20/02/1975		Semipalatinsk	Underground	49.7989	78.0014	Semipalatinsk	1975-02-20
546	5.125568513119533	SOV	20/02/1975	417 S	Semipalatinsk	Underground	49.7775	78.0156	Semipalatinsk	1975-02-20
547	5.5	SOV	27/12/1974		Semipalatinsk	Underground	49.9658	79.0033	Semipalatinsk	1974-12-27
548	4.89	SOV	16/12/1974		Semipalatinsk	Underground	49.8331	78.0267	Semipalatinsk	1974-12-16
549	4.94	SOV	16/12/1974		Semipalatinsk	Underground	49.7678	78.0817	Semipalatinsk	1974-12-16
550	4.37	SOV	07/12/1974	413 Lazurit	Semipalatinsk	Underground	49.916	77.605	Semipalatinsk	1974-07-12
551	2.8	SOV	28/11/1974		Semipalatinsk	Underground	49.95	77.7	Semipalatinsk	1974-11-28
552	6.81	SOV	02/11/1974		Novaya Zemlya Test Site	Underground	70.81	53.91	Novaya Zemlya Test Site	1974-02-11
553	5.41	SOV	16/10/1974	410 Argon-3	Semipalatinsk	Underground	49.9875	78.8942	Semipalatinsk	1974-10-16
554	4.6	SOV	02/10/1974	409 Kristall		Underground	66.1	112.65	????????? ????????? ???????, ?????????? ????, ?????????? ???? (??????), ???, 678188, ??	1974-02-10
555	5.14	SOV	13/09/1974		Semipalatinsk	Underground	49.7697	78.0553	Semipalatinsk	1974-09-13
556	5.0	SOV	29/08/1974	406 Gorizont-1		Underground	67.085	62.625	406 Gorizont-1, ????????? ????? ???????, ?????????? ????, ??????-???????? ??????????? ?????, ??	1974-08-29
557	6.58	SOV	29/08/1974	407 S	Novaya Zemlya Test Site	Underground	73.397	54.905	Novaya Zemlya Test Site	1974-08-29
558	5.4	SOV	14/08/1974	405 Gorizont-2		Underground	68.903	75.823	405 Gorizont-2, ????????? ?????, ?????-???????? ?????????? ?????, ????????? ??????????? ?????, ??	1974-08-14
559	3.3	SOV	29/07/1974		Semipalatinsk	Underground	49.9375	78.9358	Semipalatinsk	1974-07-29
560	5.17	SOV	10/07/1974		Semipalatinsk	Underground	49.7772	78.1125	Semipalatinsk	1974-10-07
561	4.6	SOV	08/07/1974	402 Kama-1		Underground	53.7	55.1	402 Kama-1, ?????????? ?????, ????????????, ??????????? ??????????? ?????, 452096, ??	1974-08-07
562	4.42	SOV	25/06/1974		Semipalatinsk	Underground	49.8306	78.1014	Semipalatinsk	1974-06-25
563	5.81	SOV	31/05/1974		Semipalatinsk	Underground	49.9606	78.8442	Semipalatinsk	1974-05-31
564	5.24	SOV	16/05/1974		Semipalatinsk	Underground	49.7397	78.0358	Semipalatinsk	1974-05-16
565	4.35	SOV	16/04/1974		Semipalatinsk	Underground	50.0244	78.9264	Semipalatinsk	1974-04-16
566	5.125568513119533	SOV	28/02/1974		Semipalatinsk	Underground	49.8317	78.1094	Semipalatinsk	1974-02-28
567	5.48	SOV	30/01/1974	396 S	Semipalatinsk	Underground	49.8233	78.0417	Semipalatinsk	1974-01-30
568	4.24	SOV	31/12/1973		Semipalatinsk	Underground	49.7394	78.0864	Semipalatinsk	1973-12-31
569	5.79	SOV	14/12/1973		Semipalatinsk	Underground	50.0438	78.9857	Semipalatinsk	1973-12-14
570	2.6	SOV	04/11/1973		Semipalatinsk	Underground	50.0631	78.9331	Semipalatinsk	1973-04-11
571	6.98	SOV	27/10/1973		Novaya Zemlya Test Site	Underground	70.78	54.035	Novaya Zemlya Test Site	1973-10-27
572	4.8	SOV	26/10/1973	390 Kama-2		Underground	53.65	55.4	390 Kama-2, ???????????? ?????????, ??????????????? ?????, ????????????, ??????????? ??????????? ?????, 453148, ??	1973-10-26
573	5.23	SOV	26/10/1973		Semipalatinsk	Underground	49.7522	78.1325	Semipalatinsk	1973-10-26
574	5.2	SOV	30/09/1973	389 Sapfir-2		Underground	51.65	54.55	????????  ????  ??????? ? ??????????? ?????????, ?????????? ?????????, ????????? ????? ????????, ???????????? ???????, ??????????? ??????????? ?????, 460504, ??	1973-09-30
575	5.89	SOV	27/09/1973		Novaya Zemlya Test Site	Underground	70.731	53.836	Novaya Zemlya Test Site	1973-09-27
576	5.125568513119533	SOV	20/09/1973		Semipalatinsk	Underground	49.9617	78.8556	Semipalatinsk	1973-09-20
577	5.1	SOV	19/09/1973	386 Meridian-2		Underground	45.758	67.825	386 Meridian-2, ????????? ?????, ????-????????????? ???????, ?????????	1973-09-19
578	6.97	SOV	12/09/1973	385 S	Novaya Zemlya Test Site	Underground	73.314	55.056	Novaya Zemlya Test Site	1973-12-09
579	5.2	SOV	28/08/1973	384 Meridian-1		Underground	50.527	68.323	384 Meridian-1, ????????? ?????, ?????????????? ???????, ?????????	1973-08-28
580	5.3	SOV	15/08/1973	383 Meridian-3		Underground	42.775	67.408	383 Meridian-3, ????????? ?????, ????-????????????? ???????, ?????????	1973-08-15
581	6.17	SOV	23/07/1973		Semipalatinsk	Underground	49.9689	78.8175	Semipalatinsk	1973-07-23
582	5.34	SOV	10/07/1973	381 S	Semipalatinsk	Underground	49.7911	78.0128	Semipalatinsk	1973-10-07
583	5.36	SOV	19/04/1973		Semipalatinsk	Underground	49.984	77.614	Semipalatinsk	1973-04-19
584	5.48	SOV	16/02/1973		Semipalatinsk	Underground	49.8158	78.1067	Semipalatinsk	1973-02-16
585	4.6	SOV	28/12/1972		Semipalatinsk	Underground	49.7361	78.1072	Semipalatinsk	1972-12-28
586	5.96	SOV	10/12/1972		Semipalatinsk	Underground	50.027	78.9956	Semipalatinsk	1972-10-12
587	5.72	SOV	10/12/1972	376 S	Semipalatinsk	Underground	49.8261	78.0919	Semipalatinsk	1972-10-12
588	5.2	SOV	24/11/1972	375 Region-5		Underground	51.842	64.21	375 Region-5, ?????????????? ???????? ?????, ??????????? ?????, ???????????? ???????, ?????????	1972-11-24
589	4.5	SOV	24/11/1972	374 Region-2		Underground	51.99	51.867	374 Region-2, ????????? ?????????, ???????????? ?????, ???????????? ???????, ??????????? ??????????? ?????, ??	1972-11-24
590	6.16	SOV	02/11/1972		Semipalatinsk	Underground	49.927	78.8173	Semipalatinsk	1972-02-11
591	5.6	SOV	03/10/1972	372 Region-4		Underground	46.853	44.938	372 Region-4, ?????????? ???????? ?????????, ?????????????? ?????, ????????, ???, ??	1972-03-10
592	5.0	SOV	21/09/1972	371 Region-1		Underground	52.118	52.068	???????????? ?????????, ?????? ?????, ???????????? ???????, ??????????? ??????????? ?????, ??	1972-09-21
593	4.6	SOV	04/09/1972	370 Dnepr-1		Underground	67.75	33.1	370 Dnepr-1, ????????? ????? ??????????, ?????????? ???????, ??????-???????? ??????????? ?????, ??	1972-04-09
594	4.79	SOV	02/09/1972		Semipalatinsk	Underground	49.9594	77.6409	Semipalatinsk	1972-02-09
595	6.49	SOV	28/08/1972	368 S	Novaya Zemlya Test Site	Underground	73.388	54.847	Novaya Zemlya Test Site	1972-08-28
596	5.36	SOV	26/08/1972		Semipalatinsk	Underground	49.982	77.7166	Semipalatinsk	1972-08-26
597	5.7	SOV	20/08/1972	366 Region-3		Underground	49.4	48.142	366 Region-3, ???????????? ?????, ???????-????????????? ???????, ?????????	1972-08-20
598	5.11	SOV	16/08/1972		Semipalatinsk	Underground	49.7706	78.0572	Semipalatinsk	1972-08-16
599	5.125568513119533	SOV	27/07/1972		Novaya Zemlya Test Site	Underground	70.8	53.8	Novaya Zemlya Test Site	1972-07-27
600	4.8	SOV	09/07/1972	363 Fakel		Underground	49.8	35.4	363 Fakel, ?-03, ???????, ??????????? ?????, ?????????? ???????, 63042, ???????	1972-09-07
601	4.28	SOV	06/07/1972		Semipalatinsk	Underground	49.7361	78.1092	Semipalatinsk	1972-06-07
602	5.42	SOV	07/06/1972		Semipalatinsk	Underground	49.7731	77.99	Semipalatinsk	1972-07-06
603	5.125568513119533	SOV	07/06/1972		Semipalatinsk	Underground	49.8317	78.1094	Semipalatinsk	1972-07-06
604	5.125568513119533	SOV	20/04/1972		Semipalatinsk	Underground	49.8417	78.1072	Semipalatinsk	1972-04-20
605	4.9	SOV	11/04/1972	358 Crater		Underground	37.35	62.05	358 Crater, Baramaly, Mary welaaty, Trkmenistan	1972-11-04
606	5.18	SOV	28/03/1972	357 S	Semipalatinsk	Underground	49.7342	78.0825	Semipalatinsk	1972-03-28
607	5.45	SOV	10/03/1972	356 S	Semipalatinsk	Underground	49.7519	78.1181	Semipalatinsk	1972-10-03
608	5.27	SOV	10/02/1972		Semipalatinsk	Underground	50.0243	78.8781	Semipalatinsk	1972-10-02
609	5.84	SOV	30/12/1971		Semipalatinsk	Underground	49.755	78.0475	Semipalatinsk	1971-12-30
610	5.8	SOV	30/12/1971		Semipalatinsk	Underground	49.7492	78.0061	Semipalatinsk	1971-12-30
611	6.0	SOV	22/12/1971	352 Galit		Underground	47.897	48.133	352 Galit, ??????????????? ?????, ?????????? ???????, ?????????	1971-12-22
612	4.68	SOV	15/12/1971		Semipalatinsk	Underground	49.8306	77.9933	Semipalatinsk	1971-12-15
613	5.46	SOV	29/11/1971	350 S	Semipalatinsk	Underground	49.7378	78.0814	Semipalatinsk	1971-11-29
614	5.2	SOV	22/10/1971	349 Sapfir-1		Underground	51.6	54.45	349 Sapfir-1, ????????  ????  ??????? ? ??????????? ?????????, ?????????? ?????????, ????????? ????? ????????, ???????????? ???????, ??????????? ??????????? ?????, 460504, ??	1971-10-22
615	5.58	SOV	21/10/1971		Semipalatinsk	Underground	49.9738	77.5973	Semipalatinsk	1971-10-21
616	5.37	SOV	09/10/1971		Semipalatinsk	Underground	49.9779	77.6414	Semipalatinsk	1971-09-10
617	4.6	SOV	04/10/1971	346 Globus-2		Underground	61.358	48.092	346 Globus-2, ????????? ???????? ?????????, ??????????? ?????, ????????????? ???????, ??????-???????? ??????????? ?????, ??	1971-04-10
618	6.67	SOV	27/09/1971	345 S	Novaya Zemlya Test Site	Underground	73.393	54.92	Novaya Zemlya Test Site	1971-09-27
619	4.5	SOV	19/09/1971	344 Globus-1		Underground	57.508	42.643	?????????????? ???????? ?????????, ??????????? ?????, ?????????? ???????, ???, ??	1971-09-19
620	5.2	SOV	10/07/1971	343 Globus-3		Underground	64.167	55.267	343 Globus-3, ????????? ????????? ??????????, ????? ??????????, ?????????? ????, ??????-???????? ??????????? ?????, ??	1971-10-07
621	4.7	SOV	02/07/1971	342 Globus-4		Underground	67.283	63.467	342 Globus-4, ????????? ????? ???????, ?????????? ????, ??????-???????? ??????????? ?????, ??	1971-02-07
622	4.94	SOV	30/06/1971		Semipalatinsk	Underground	49.946	78.9805	Semipalatinsk	1971-06-30
623	5.54	SOV	19/06/1971		Semipalatinsk	Underground	49.969	77.6408	Semipalatinsk	1971-06-19
624	5.53	SOV	06/06/1971		Semipalatinsk	Underground	49.9754	77.6603	Semipalatinsk	1971-06-06
625	5.05	SOV	25/05/1971		Semipalatinsk	Underground	49.8042	78.145	Semipalatinsk	1971-05-25
626	6.08	SOV	25/04/1971		Semipalatinsk	Underground	49.7803	78.0367	Semipalatinsk	1971-04-25
627	3.78	SOV	09/04/1971		Semipalatinsk	Underground	49.8322	78.0386	Semipalatinsk	1971-09-04
628	5.5	SOV	23/03/1971	335 Taiga S		Underground	61.4	56.2	335 Taiga, ???????? ????????? ???????, ????-????????? ?????, ?????????? ????, ??????-???????? ??????????? ?????, ??	1971-03-23
629	5.77	SOV	22/03/1971		Semipalatinsk	Underground	49.7933	78.1131	Semipalatinsk	1971-03-22
630	5.125568513119533	SOV	22/03/1971		Semipalatinsk	Underground	49.7744	78.0828	Semipalatinsk	1971-03-22
631	4.47	SOV	29/01/1971		Semipalatinsk	Underground	49.8053	78.1686	Semipalatinsk	1971-01-29
632	6.0	SOV	23/12/1970	331 Say-Utes-3		Underground	44.025	54.933	331 Say-Utes-3, ????????????? ?????, ????????????? ???????, ?????????	1970-12-23
633	5.43	SOV	17/12/1970		Semipalatinsk	Underground	49.7519	78.1017	Semipalatinsk	1970-12-17
634	6.0	SOV	12/12/1970	329 Say-Utes-2		Underground	43.85	54.8	329 Say-Utes-2, ???????????? ?????, ????????????? ???????, ?????????	1970-12-12
635	5.44	SOV	04/11/1970		Semipalatinsk	Underground	49.9892	77.7624	Semipalatinsk	1970-04-11
636	6.79	SOV	14/10/1970	327 S	Novaya Zemlya Test Site	Underground	73.304	55.027	Novaya Zemlya Test Site	1970-10-14
637	5.125568513119533	SOV	06/09/1970		Semipalatinsk	Underground	49.7889	77.9975	Semipalatinsk	1970-06-09
638	5.53	SOV	06/09/1970		Semipalatinsk	Underground	49.7525	78.0053	Semipalatinsk	1970-06-09
639	5.34	SOV	24/07/1970		Semipalatinsk	Underground	49.8136	78.1322	Semipalatinsk	1970-07-24
640	5.38	SOV	21/07/1970		Semipalatinsk	Underground	49.9524	77.6729	Semipalatinsk	1970-07-21
641	5.125568513119533	SOV	28/06/1970	322 S	Semipalatinsk	Underground	49.7822	78.0533	Semipalatinsk	1970-06-28
642	5.87	SOV	28/06/1970		Semipalatinsk	Underground	49.7933	78.1131	Semipalatinsk	1970-06-28
643	4.9	SOV	25/06/1970	320 Magistral		Underground	52.2	55.7	320 Magistral, ???????????  ???????????, ????????????, ??????????? ?????, ???????????? ???????, ??????????? ??????????? ?????, ??	1970-06-25
644	4.2	SOV	27/05/1970		Semipalatinsk	Underground	49.7314	78.1011	Semipalatinsk	1970-05-27
645	4.93	SOV	27/03/1970		Semipalatinsk	Underground	49.7444	78.0033	Semipalatinsk	1970-03-27
646	5.125568513119533	SOV	18/02/1970		Semipalatinsk	Underground	49.7308	78.1025	Semipalatinsk	1970-02-18
647	5.6	SOV	29/01/1970	316 S	Semipalatinsk	Underground	49.7922	78.1131	Semipalatinsk	1970-01-29
648	4.22	SOV	29/12/1969		Semipalatinsk	Underground	49.7322	78.1044	Semipalatinsk	1969-12-29
649	5.79	SOV	28/12/1969		Semipalatinsk	Underground	49.9373	77.7142	Semipalatinsk	1969-12-28
650	5.8	SOV	06/12/1969	313 Say-Utes-1		Underground	43.867	54.8	313 Say-Utes-1, ???????????? ?????, ????????????? ???????, ?????????	1969-06-12
651	6.02	SOV	30/11/1969		Semipalatinsk	Underground	49.9243	78.9558	Semipalatinsk	1969-11-30
652	4.1	SOV	27/11/1969		Semipalatinsk	Underground	49.8367	78.0597	Semipalatinsk	1969-11-27
653	5.125568513119533	SOV	30/10/1969		Semipalatinsk	Underground	49.8442	78.1156	Semipalatinsk	1969-10-30
654	6.3	SOV	14/10/1969	309 S	Novaya Zemlya Test Site	Underground	73.39	54.787	Novaya Zemlya Test Site	1969-10-14
655	5.26	SOV	01/10/1969	308 S	Semipalatinsk	Underground	49.7864	78.1081	Semipalatinsk	1969-01-10
656	5.6	SOV	26/09/1969			Underground	45.848	42.6	307, ??????? ?????, ????????? ?????????, ?????????? ????????? ?????, ???????????, ????, ??	1969-09-26
657	4.91	SOV	11/09/1969	306 S	Semipalatinsk	Underground	49.7778	77.9864	Semipalatinsk	1969-11-09
658	4.8	SOV	08/09/1969	305 Grifon-2		Underground	57.22	55.417	305 Grifon-2, 57?-0005, ???????? ????????? ?????????, ???????? ?????, ???????? ????, ??????????? ??????????? ?????, 618122, ??	1969-08-09
659	4.8	SOV	02/09/1969	304 Grifon-1		Underground	57.22	55.393	304 Grifon-1, 57?-0005, ???????? ????????? ?????????, ???????? ?????, ???????? ????, ??????????? ??????????? ?????, 618122, ??	1969-02-09
660	5.5	SOV	23/07/1969		Semipalatinsk	Underground	49.8197	78.1372	Semipalatinsk	1969-07-23
661	5.24	SOV	04/07/1969	302 S	Semipalatinsk	Underground	49.7542	78.1092	Semipalatinsk	1969-04-07
662	5.29	SOV	31/05/1969		Semipalatinsk	Underground	49.9503	77.6942	Semipalatinsk	1969-05-31
663	5.26	SOV	16/05/1969		Semipalatinsk	Underground	49.7678	78.0817	Semipalatinsk	1969-05-16
664	4.55	SOV	13/04/1969		Semipalatinsk	Underground	49.7356	78.1047	Semipalatinsk	1969-04-13
665	3.6	SOV	04/04/1969		Semipalatinsk	Underground	49.7533	78.0536	Semipalatinsk	1969-04-04
666	5.66	SOV	07/03/1969		Semipalatinsk	Underground	49.8283	78.0597	Semipalatinsk	1969-07-03
667	5.04	SOV	18/12/1968		Semipalatinsk	Underground	49.7408	78.0878	Semipalatinsk	1968-12-18
668	4.24	SOV	12/11/1968	295 Telkem-2 S	Semipalatinsk	Underground	49.712	78.461	Semipalatinsk	1968-12-11
669	4.75	SOV	09/11/1968		Semipalatinsk	Underground	49.7997	78.1444	Semipalatinsk	1968-09-11
670	6.13	SOV	07/11/1968	293 S	Novaya Zemlya Test Site	Underground	73.387	54.858	Novaya Zemlya Test Site	1968-07-11
671	4.33	SOV	29/10/1968		Semipalatinsk	Underground	49.8333	78.0928	Semipalatinsk	1968-10-29
672	4.05	SOV	21/10/1968	291 Telkem-1	Semipalatinsk	Underground	49.7279	78.4863	Semipalatinsk	1968-10-21
673	5.86	SOV	29/09/1968	290 Argon	Semipalatinsk	Underground	49.8042	78.1056	Semipalatinsk	1968-09-29
674	5.44	SOV	05/09/1968		Semipalatinsk	Underground	49.7381	78.0808	Semipalatinsk	1968-05-09
675	4.76	SOV	20/08/1968	288 S	Semipalatinsk	Underground	49.8206	78.0811	Semipalatinsk	1968-08-20
676	5.17	SOV	12/07/1968	287 S	Semipalatinsk	Underground	49.7556	78.0992	Semipalatinsk	1968-12-07
677	5.5	SOV	01/07/1968	286 Galit		Underground	47.909	47.912	508, ??????????????? ?????, ?????????? ???????, ?????????	1968-01-07
678	5.28	SOV	19/06/1968		Semipalatinsk	Underground	49.9803	78.9855	Semipalatinsk	1968-06-19
679	5.24	SOV	11/06/1968		Semipalatinsk	Underground	49.7986	78.15	Semipalatinsk	1968-11-06
680	5.125568513119533	SOV	23/05/1968		Semipalatinsk	Underground	49.8333	78.0928	Semipalatinsk	1968-05-23
681	5.4	SOV	21/05/1968	282 Pamuk		Underground	38.918	65.032	282 Pamuk, Pomuq road, Bahoriston Tumani, Qashqadaryo Viloyati, 181009, O?zbekiston	1968-05-21
682	4.91	SOV	24/04/1968		Semipalatinsk	Underground	49.8417	78.1072	Semipalatinsk	1968-04-24
683	4.98	SOV	07/01/1968		Semipalatinsk	Underground	49.7539	78.0469	Semipalatinsk	1968-07-01
684	5.31	SOV	08/12/1967		Semipalatinsk	Underground	49.8183	78.1708	Semipalatinsk	1967-08-12
685	4.41	SOV	22/11/1967		Semipalatinsk	Underground	49.9419	77.6868	Semipalatinsk	1967-11-22
686	5.41	SOV	30/10/1967		Semipalatinsk	Underground	49.7972	77.9994	Semipalatinsk	1967-10-30
687	5.98	SOV	21/10/1967	276 S	Novaya Zemlya Test Site	Underground	73.39	54.81	Novaya Zemlya Test Site	1967-10-21
688	5.63	SOV	17/10/1967	275 S	Semipalatinsk	Underground	49.7844	77.9978	Semipalatinsk	1967-10-17
689	4.7	SOV	06/10/1967	274 Tavda		Underground	57.7	65.2	274 Tavda, ???????? ?????, ??????????????, ??????????????? ?????, ????????? ???????, ????????? ??????????? ?????, ??	1967-06-10
690	5.16	SOV	22/09/1967		Semipalatinsk	Underground	49.9596	77.6911	Semipalatinsk	1967-09-22
691	5.25	SOV	16/09/1967		Semipalatinsk	Underground	49.9372	77.7281	Semipalatinsk	1967-09-16
692	4.1	SOV	02/09/1967		Semipalatinsk	Underground	49.7419	78.0256	Semipalatinsk	1967-02-09
693	5.32	SOV	04/08/1967	270 S	Semipalatinsk	Underground	49.7544	78.0503	Semipalatinsk	1967-04-08
694	5.39	SOV	15/07/1967		Semipalatinsk	Underground	49.8442	78.1156	Semipalatinsk	1967-07-15
695	5.34	SOV	29/06/1967		Semipalatinsk	Underground	49.8222	78.0433	Semipalatinsk	1967-06-29
696	5.46	SOV	28/05/1967	267 S	Semipalatinsk	Underground	49.7517	78.0083	Semipalatinsk	1967-05-28
697	5.56	SOV	20/04/1967		Semipalatinsk	Underground	49.7361	78.1072	Semipalatinsk	1967-04-20
698	5.32	SOV	25/03/1967	265 S	Semipalatinsk	Underground	49.7533	78.0536	Semipalatinsk	1967-03-25
699	6.03	SOV	26/02/1967		Semipalatinsk	Underground	49.7394	78.0864	Semipalatinsk	1967-02-26
700	4.63	SOV	30/01/1967	263 S	Semipalatinsk	Underground	49.7731	77.99	Semipalatinsk	1967-01-30
701	5.92	SOV	18/12/1966		Semipalatinsk	Underground	49.9246	77.7472	Semipalatinsk	1966-12-18
702	4.8	SOV	03/12/1966	261 S	Semipalatinsk	Underground	49.7403	78.0308	Semipalatinsk	1966-03-12
703	3.36	SOV	19/11/1966		Semipalatinsk	Underground	49.8297	78.0575	Semipalatinsk	1966-11-19
704	3.5	SOV	29/10/1966		Semipalatinsk	Underground	49.7847	77.9994	Semipalatinsk	1966-10-29
705	5.125568513119533	SOV	27/10/1966		Novaya Zemlya Test Site	Underground	73.4	54.8	Novaya Zemlya Test Site	1966-10-27
706	6.49	SOV	27/10/1966		Novaya Zemlya Test Site	Underground	73.387	54.836	Novaya Zemlya Test Site	1966-10-27
707	5.67	SOV	19/10/1966		Semipalatinsk	Underground	49.7419	78.0256	Semipalatinsk	1966-10-19
708	5.1	SOV	30/09/1966	255 Urta-Bulak		Underground	38.968	64.517	255 Urta-Bulak, Bahoriston Tumani, Qashqadaryo Viloyati, O?zbekiston	1966-09-30
709	4.66	SOV	07/09/1966		Semipalatinsk	Underground	49.8306	78.0578	Semipalatinsk	1966-07-09
710	4.63	SOV	19/08/1966		Semipalatinsk	Underground	49.8306	78.1014	Semipalatinsk	1966-08-19
711	5.39	SOV	05/08/1966		Semipalatinsk	Underground	49.7589	78.0486	Semipalatinsk	1966-05-08
712	5.36	SOV	21/07/1966		Semipalatinsk	Underground	49.7356	78.1047	Semipalatinsk	1966-07-21
713	5.51	SOV	29/06/1966		Semipalatinsk	Underground	49.8392	78.0708	Semipalatinsk	1966-06-29
714	4.73	SOV	07/05/1966		Semipalatinsk	Underground	49.7361	78.1072	Semipalatinsk	1966-07-05
715	4.7	SOV	22/04/1966	248 Galit		Underground	47.829	47.935	248 Galit, ?????, ??????????????? ?????, ?????????? ???????, ?????????	1966-04-22
716	5.37	SOV	21/04/1966		Semipalatinsk	Underground	49.8178	78.0939	Semipalatinsk	1966-04-21
717	6.04	SOV	20/03/1966		Semipalatinsk	Underground	49.7517	78.0083	Semipalatinsk	1966-03-20
718	6.26	SOV	13/02/1966		Semipalatinsk	Underground	49.8142	78.1308	Semipalatinsk	1966-02-13
719	4.94	SOV	24/12/1965		Semipalatinsk	Underground	49.8117	78.1075	Semipalatinsk	1965-12-24
720	5.61	SOV	21/11/1965		Semipalatinsk	Underground	49.8283	78.0597	Semipalatinsk	1965-11-21
721	4.28	SOV	14/10/1965	242 Sary-Uzen	Semipalatinsk	Underground	49.9906	77.6357	Semipalatinsk	1965-10-14
722	5.47	SOV	08/10/1965		Semipalatinsk	Underground	49.8306	78.1014	Semipalatinsk	1965-08-10
723	5.22	SOV	17/09/1965		Semipalatinsk	Underground	49.8172	78.1425	Semipalatinsk	1965-09-17
724	4.28	SOV	29/07/1965		Semipalatinsk	Underground	49.785	77.9969	Semipalatinsk	1965-07-29
725	5.24	SOV	17/06/1965		Semipalatinsk	Underground	49.8306	78.0578	Semipalatinsk	1965-06-17
726	5.125568513119533	SOV	10/06/1965	237 Butan		Underground	52.9	56.5	237 Butan, ????????????, ???????????? ?????, ????????????, ??????????? ??????????? ?????, ??	1965-10-06
727	4.74	SOV	11/05/1965		Semipalatinsk	Underground	49.7731	77.9914	Semipalatinsk	1965-11-05
728	5.125568513119533	SOV	30/03/1965	235 Butan-1 S		Underground	52.9	56.5	237 Butan, ????????????, ???????????? ?????, ????????????, ??????????? ??????????? ?????, ??	1965-03-30
729	3.22	SOV	27/03/1965		Semipalatinsk	Underground	49.7747	77.9881	Semipalatinsk	1965-03-27
730	5.44	SOV	03/03/1965		Semipalatinsk	Underground	49.8297	78.0575	Semipalatinsk	1965-03-03
731	5.1	SOV	04/02/1965		Semipalatinsk	Underground	49.7731	77.9914	Semipalatinsk	1965-04-02
732	5.87	SOV	15/01/1965	231 Chagan	Semipalatinsk	Underground	49.935	79.0094	Semipalatinsk	1965-01-15
733	5.64	SOV	16/11/1964		Semipalatinsk	Underground	49.8139	78.1336	Semipalatinsk	1964-11-16
734	5.1	SOV	25/10/1964		Novaya Zemlya Test Site	Underground	73.387	54.985	Novaya Zemlya Test Site	1964-10-25
735	5.125568513119533	SOV	30/09/1964		Semipalatinsk	Underground	49.8208	78.0986	Semipalatinsk	1964-09-30
736	4.19	SOV	18/09/1964		Novaya Zemlya Test Site	Underground	73.667	54.533	Novaya Zemlya Test Site	1964-09-18
737	3.27	SOV	18/08/1964		Semipalatinsk	Underground	49.8206	78.0819	Semipalatinsk	1964-08-18
738	5.43	SOV	19/07/1964		Semipalatinsk	Underground	49.815	78.0931	Semipalatinsk	1964-07-19
739	4.42	SOV	06/06/1964		Semipalatinsk	Underground	49.7747	77.9881	Semipalatinsk	1964-06-06
740	5.55	SOV	16/05/1964		Semipalatinsk	Underground	49.8178	78.0939	Semipalatinsk	1964-05-16
741	5.56	SOV	15/03/1964		Semipalatinsk	Underground	49.8208	78.0986	Semipalatinsk	1964-03-15
742	5.125568513119533	SOV	25/12/1962		Novaya Zemlya Test Site	Atmospheric	73.4	56.5	Novaya Zemlya Test Site	1962-12-25
743	5.125568513119533	SOV	25/12/1962		Novaya Zemlya Test Site	Atmospheric	73	55	Novaya Zemlya Test Site	1962-12-25
744	5.125568513119533	SOV	24/12/1962		Novaya Zemlya Test Site	Atmospheric	73.6	57.5	Novaya Zemlya Test Site	1962-12-24
745	5.125568513119533	SOV	24/12/1962		Novaya Zemlya Test Site	Atmospheric	74.2	52.3	Novaya Zemlya Test Site	1962-12-24
746	5.125568513119533	SOV	24/12/1962		Semipalatinsk	Atmospheric	50	78	Semipalatinsk	1962-12-24
747	5.125568513119533	SOV	24/12/1962		Semipalatinsk	Atmospheric	50	78	Semipalatinsk	1962-12-24
748	5.125568513119533	SOV	23/12/1962		Novaya Zemlya Test Site	Atmospheric	73	55	Novaya Zemlya Test Site	1962-12-23
749	5.125568513119533	SOV	23/12/1962		Novaya Zemlya Test Site	Atmospheric	73	55	Novaya Zemlya Test Site	1962-12-23
750	5.125568513119533	SOV	23/12/1962		Novaya Zemlya Test Site	Atmospheric	73	55	Novaya Zemlya Test Site	1962-12-23
751	5.125568513119533	SOV	23/12/1962		Semipalatinsk	Atmospheric	50	78	Semipalatinsk	1962-12-23
752	5.125568513119533	SOV	22/12/1962		Novaya Zemlya Test Site	Atmospheric	73	55	Novaya Zemlya Test Site	1962-12-22
753	5.125568513119533	SOV	20/12/1962		Novaya Zemlya Test Site	Atmospheric	73	55	Novaya Zemlya Test Site	1962-12-20
754	5.125568513119533	SOV	18/12/1962		Novaya Zemlya Test Site	Atmospheric	73	55	Novaya Zemlya Test Site	1962-12-18
755	5.125568513119533	SOV	18/12/1962		Novaya Zemlya Test Site	Atmospheric	73	55	Novaya Zemlya Test Site	1962-12-18
756	5.125568513119533	SOV	01/12/1962		Semipalatinsk	Atmospheric	50	78	Semipalatinsk	1962-01-12
757	5.125568513119533	SOV	26/11/1962		Semipalatinsk	Atmospheric	50	78	Semipalatinsk	1962-11-26
758	5.125568513119533	SOV	24/11/1962		Semipalatinsk	Atmospheric	50	78	Semipalatinsk	1962-11-24
759	5.125568513119533	SOV	17/11/1962		Semipalatinsk	Atmospheric	50	78	Semipalatinsk	1962-11-17
760	5.125568513119533	SOV	14/11/1962		Semipalatinsk	Atmospheric	50	78	Semipalatinsk	1962-11-14
761	5.125568513119533	SOV	13/11/1962		Semipalatinsk	Atmospheric	50	78	Semipalatinsk	1962-11-13
762	5.125568513119533	SOV	11/11/1962		Semipalatinsk	Atmospheric	50	78	Semipalatinsk	1962-11-11
763	5.125568513119533	SOV	05/11/1962		Semipalatinsk	Atmospheric	50	78	Semipalatinsk	1962-05-11
764	5.125568513119533	SOV	04/11/1962		Semipalatinsk	Atmospheric	50	78	Semipalatinsk	1962-04-11
765	5.125568513119533	SOV	03/11/1962		Novaya Zemlya Test Site	Atmospheric	73	55	Novaya Zemlya Test Site	1962-03-11
766	5.125568513119533	SOV	03/11/1962		Novaya Zemlya Test Site	Atmospheric	73	55	Novaya Zemlya Test Site	1962-03-11
767	5.125568513119533	SOV	03/11/1962		Semipalatinsk	Atmospheric	50	78	Semipalatinsk	1962-03-11
768	5.125568513119533	SOV	01/11/1962		Semipalatinsk	Atmospheric	50	78	Semipalatinsk	1962-01-11
769	5.125568513119533	SOV	01/11/1962	195 K5	Missile Testing Range	Atmospheric	49	46	Missile Testing Range	1962-01-11
770	5.125568513119533	SOV	01/11/1962		Novaya Zemlya Test Site	Atmospheric	73	55	Novaya Zemlya Test Site	1962-01-11
771	5.125568513119533	SOV	31/10/1962		Semipalatinsk	Atmospheric	50	78	Semipalatinsk	1962-10-31
772	5.125568513119533	SOV	30/10/1962		Novaya Zemlya Test Site	Atmospheric	73	55	Novaya Zemlya Test Site	1962-10-30
773	5.125568513119533	SOV	30/10/1962		Semipalatinsk	Atmospheric	50	78	Semipalatinsk	1962-10-30
774	5.125568513119533	SOV	29/10/1962		Novaya Zemlya Test Site	Atmospheric	73	55	Novaya Zemlya Test Site	1962-10-29
775	5.125568513119533	SOV	28/10/1962	187 K4	Missile Testing Range	Atmospheric	49	46	Missile Testing Range	1962-10-28
776	5.125568513119533	SOV	28/10/1962		Semipalatinsk	Atmospheric	50	78	Semipalatinsk	1962-10-28
777	5.125568513119533	SOV	28/10/1962		Semipalatinsk	Atmospheric	50	78	Semipalatinsk	1962-10-28
778	5.125568513119533	SOV	27/10/1962		Novaya Zemlya Test Site	Atmospheric	73	55	Novaya Zemlya Test Site	1962-10-27
779	4.9	SOV	22/10/1962		Novaya Zemlya Test Site	Atmospheric	73.4	54.9	Novaya Zemlya Test Site	1962-10-22
780	5.125568513119533	SOV	22/10/1962	184 K3	Missile Testing Range	Atmospheric	49	46	Missile Testing Range	1962-10-22
781	5.125568513119533	SOV	20/10/1962		Semipalatinsk	Atmospheric	50	78	Semipalatinsk	1962-10-20
782	5.125568513119533	SOV	14/10/1962		Semipalatinsk	Atmospheric	50	78	Semipalatinsk	1962-10-14
783	5.125568513119533	SOV	13/10/1962		Semipalatinsk	Atmospheric	50	78	Semipalatinsk	1962-10-13
784	5.125568513119533	SOV	10/10/1962		Semipalatinsk	Atmospheric	50	78	Semipalatinsk	1962-10-10
785	5.125568513119533	SOV	09/10/1962		Novaya Zemlya Test Site	Atmospheric	73	55	Novaya Zemlya Test Site	1962-09-10
786	5.125568513119533	SOV	09/10/1962		Semipalatinsk	Atmospheric	50	78	Semipalatinsk	1962-09-10
787	5.125568513119533	SOV	07/10/1962		Novaya Zemlya Test Site	Atmospheric	73	55	Novaya Zemlya Test Site	1962-07-10
788	5.125568513119533	SOV	28/09/1962		Semipalatinsk	Atmospheric	50	78	Semipalatinsk	1962-09-28
789	5.1	SOV	27/09/1962		Novaya Zemlya Test Site	Atmospheric	74.3	52.4	Novaya Zemlya Test Site	1962-09-27
790	5.125568513119533	SOV	25/09/1962		Novaya Zemlya Test Site	Atmospheric	73.7	55	Novaya Zemlya Test Site	1962-09-25
791	5.125568513119533	SOV	25/09/1962		Semipalatinsk	Atmospheric	50	78	Semipalatinsk	1962-09-25
792	5.125568513119533	SOV	24/09/1962		Semipalatinsk	Atmospheric	50	78	Semipalatinsk	1962-09-24
793	5.125568513119533	SOV	22/09/1962		Semipalatinsk	Atmospheric	50	78	Semipalatinsk	1962-09-22
794	5.125568513119533	SOV	21/09/1962		Novaya Zemlya Test Site	Atmospheric	73	55	Novaya Zemlya Test Site	1962-09-21
795	4.9	SOV	19/09/1962		Novaya Zemlya Test Site	Atmospheric	73.8	53.8	Novaya Zemlya Test Site	1962-09-19
796	4.3	SOV	18/09/1962		Novaya Zemlya Test Site	Atmospheric	73.2	54.7	Novaya Zemlya Test Site	1962-09-18
797	4.6	SOV	16/09/1962		Novaya Zemlya Test Site	Atmospheric	74.2	51.6	Novaya Zemlya Test Site	1962-09-16
798	4.6	SOV	15/09/1962		Novaya Zemlya Test Site	Atmospheric	74.4	51.5	Novaya Zemlya Test Site	1962-09-15
799	4.4	SOV	08/09/1962		Novaya Zemlya Test Site	Atmospheric	73.7	53.8	Novaya Zemlya Test Site	1962-08-09
800	5.125568513119533	SOV	02/09/1962		Novaya Zemlya Test Site	Atmospheric	73	55	Novaya Zemlya Test Site	1962-02-09
801	5.125568513119533	SOV	31/08/1962		Semipalatinsk	Atmospheric	50	78	Semipalatinsk	1962-08-31
802	4.7	SOV	27/08/1962		Novaya Zemlya Test Site	Atmospheric	74.7	50.3	Novaya Zemlya Test Site	1962-08-27
803	5.125568513119533	SOV	27/08/1962		Semipalatinsk	Atmospheric	50	78	Semipalatinsk	1962-08-27
804	5.125568513119533	SOV	25/08/1962		Novaya Zemlya Test Site	Atmospheric	73	55	Novaya Zemlya Test Site	1962-08-25
805	5.125568513119533	SOV	25/08/1962		Semipalatinsk	Atmospheric	50	78	Semipalatinsk	1962-08-25
806	5.125568513119533	SOV	23/08/1962		Semipalatinsk	Atmospheric	50	78	Semipalatinsk	1962-08-23
807	4.4	SOV	22/08/1962		Novaya Zemlya Test Site	Atmospheric	74	53.3	Novaya Zemlya Test Site	1962-08-22
808	5.125568513119533	SOV	22/08/1962		Novaya Zemlya Test Site	Atmospheric	73	55	Novaya Zemlya Test Site	1962-08-22
809	5.125568513119533	SOV	22/08/1962		Semipalatinsk	Atmospheric	50	78	Semipalatinsk	1962-08-22
810	5.125568513119533	SOV	21/08/1962		Semipalatinsk	Atmospheric	50	78	Semipalatinsk	1962-08-21
811	4.6	SOV	20/08/1962		Novaya Zemlya Test Site	Atmospheric	74.3	51.5	Novaya Zemlya Test Site	1962-08-20
812	5.125568513119533	SOV	18/08/1962		Semipalatinsk	Atmospheric	50	78	Semipalatinsk	1962-08-18
813	5.125568513119533	SOV	18/08/1962		Semipalatinsk	Atmospheric	50	78	Semipalatinsk	1962-08-18
814	5.125568513119533	SOV	10/08/1962		Novaya Zemlya Test Site	Atmospheric	73	55	Novaya Zemlya Test Site	1962-10-08
815	5.125568513119533	SOV	07/08/1962		Semipalatinsk	Atmospheric	50	78	Semipalatinsk	1962-07-08
816	5.2	SOV	05/08/1962		Novaya Zemlya Test Site	Atmospheric	74.2	52.5	Novaya Zemlya Test Site	1962-05-08
817	5.125568513119533	SOV	04/08/1962		Semipalatinsk	Atmospheric	50	78	Semipalatinsk	1962-04-08
818	5.125568513119533	SOV	03/08/1962		Semipalatinsk	Atmospheric	50	78	Semipalatinsk	1962-03-08
819	5.125568513119533	SOV	01/08/1962		Semipalatinsk	Atmospheric	50	78	Semipalatinsk	1962-01-08
820	5.63	SOV	02/02/1962	143 Argon-1	Semipalatinsk	Underground	49.785	77.9969	Semipalatinsk	1962-02-02
821	5.125568513119533	SOV	04/11/1961		Novaya Zemlya Test Site	Atmospheric	73.7	55.7	Novaya Zemlya Test Site	1961-04-11
822	5.125568513119533	SOV	04/11/1961		Novaya Zemlya Test Site	Atmospheric	73	55	Novaya Zemlya Test Site	1961-04-11
823	5.125568513119533	SOV	04/11/1961		Semipalatinsk	Atmospheric	50	78	Semipalatinsk	1961-04-11
824	5.125568513119533	SOV	04/11/1961		Novaya Zemlya Test Site	Atmospheric	73	55	Novaya Zemlya Test Site	1961-04-11
825	5.125568513119533	SOV	03/11/1961		Semipalatinsk	Atmospheric	50	78	Semipalatinsk	1961-03-11
826	5.125568513119533	SOV	03/11/1961		Semipalatinsk	Atmospheric	50	78	Semipalatinsk	1961-03-11
827	5.125568513119533	SOV	02/11/1961		Novaya Zemlya Test Site	Atmospheric	73	55	Novaya Zemlya Test Site	1961-02-11
828	5.125568513119533	SOV	02/11/1961		Semipalatinsk	Atmospheric	50	78	Semipalatinsk	1961-02-11
829	5.125568513119533	SOV	02/11/1961		Novaya Zemlya Test Site	Atmospheric	73	55	Novaya Zemlya Test Site	1961-02-11
830	5.125568513119533	SOV	01/11/1961		Semipalatinsk	Atmospheric	50	78	Semipalatinsk	1961-01-11
831	5.125568513119533	SOV	31/10/1961		Novaya Zemlya Test Site	Atmospheric	73	55	Novaya Zemlya Test Site	1961-10-31
832	5.125568513119533	SOV	31/10/1961		Novaya Zemlya Test Site	Atmospheric	73.6	56.2	Novaya Zemlya Test Site	1961-10-31
833	5.4	SOV	30/10/1961	130 Tsar Bomba	Novaya Zemlya Test Site	Atmospheric	73.8	53.5	Novaya Zemlya Test Site	1961-10-30
834	5.125568513119533	SOV	30/10/1961		Semipalatinsk	Atmospheric	50	78	Semipalatinsk	1961-10-30
835	5.125568513119533	SOV	27/10/1961	126 Korall	Novaya Zemlya Test Site	Atmospheric	70.7	54.67	Novaya Zemlya Test Site	1961-10-27
836	5.125568513119533	SOV	27/10/1961	128 K1	Missile Testing Range	Atmospheric	49	46	Missile Testing Range	1961-10-27
837	5.125568513119533	SOV	27/10/1961	127 K2	Missile Testing Range	Atmospheric	49	46	Missile Testing Range	1961-10-27
838	5.125568513119533	SOV	25/10/1961		Novaya Zemlya Test Site	Atmospheric	73.52	54.3	Novaya Zemlya Test Site	1961-10-25
839	5.125568513119533	SOV	25/10/1961		Semipalatinsk	Atmospheric	50	78	Semipalatinsk	1961-10-25
840	5.125568513119533	SOV	23/10/1961		Novaya Zemlya Test Site	Atmospheric	73.9	53.8	Novaya Zemlya Test Site	1961-10-23
841	5.1	SOV	23/10/1961	122 Korall	Novaya Zemlya Test Site	Underground	70.7	54.56	Novaya Zemlya Test Site	1961-10-23
842	5.125568513119533	SOV	20/10/1961	121 Raduga	Novaya Zemlya Test Site	Atmospheric	73.8	53.2	Novaya Zemlya Test Site	1961-10-20
843	5.125568513119533	SOV	19/10/1961		Semipalatinsk	Atmospheric	50.45	77.75	Semipalatinsk	1961-10-19
844	5.125568513119533	SOV	17/10/1961		Semipalatinsk	Atmospheric	50.45	77.75	Semipalatinsk	1961-10-17
845	5.125568513119533	SOV	12/10/1961		Semipalatinsk	Atmospheric	50.45	77.75	Semipalatinsk	1961-12-10
846	4.78	SOV	11/10/1961		Semipalatinsk	Atmospheric	49.7739	77.9886	Semipalatinsk	1961-11-10
847	5.125568513119533	SOV	08/10/1961		Novaya Zemlya Test Site	Atmospheric	70.7	54.6	Novaya Zemlya Test Site	1961-08-10
848	4.7	SOV	06/10/1961		Novaya Zemlya Test Site	Atmospheric	74.3	51.6	Novaya Zemlya Test Site	1961-06-10
849	5.125568513119533	SOV	06/10/1961		Missile Testing Range	Atmospheric	48.45	44.3	Missile Testing Range	1961-06-10
850	4.5	SOV	04/10/1961		Novaya Zemlya Test Site	Atmospheric	73.7	53.8	Novaya Zemlya Test Site	1961-04-10
851	5.125568513119533	SOV	04/10/1961		Semipalatinsk	Atmospheric	50.44	77.76	Semipalatinsk	1961-04-10
852	5.125568513119533	SOV	02/10/1961		Novaya Zemlya Test Site	Atmospheric	73.92	54.55	Novaya Zemlya Test Site	1961-02-10
853	5.125568513119533	SOV	01/10/1961		Semipalatinsk	Atmospheric	50	78	Semipalatinsk	1961-01-10
854	5.125568513119533	SOV	26/09/1961		Semipalatinsk	Atmospheric	50.45	77.75	Semipalatinsk	1961-09-26
855	5.125568513119533	SOV	22/09/1961		Novaya Zemlya Test Site	Atmospheric	73.52	54.3	Novaya Zemlya Test Site	1961-09-22
856	5.125568513119533	SOV	21/09/1961		Semipalatinsk	Atmospheric	50.33	77.7	Semipalatinsk	1961-09-21
857	5.125568513119533	SOV	20/09/1961		Novaya Zemlya Test Site	Atmospheric	73.52	54.3	Novaya Zemlya Test Site	1961-09-20
858	5.125568513119533	SOV	20/09/1961		Semipalatinsk	Atmospheric	50	78	Semipalatinsk	1961-09-20
859	5.125568513119533	SOV	19/09/1961		Semipalatinsk	Atmospheric	50	78	Semipalatinsk	1961-09-19
860	5.125568513119533	SOV	18/09/1961		Novaya Zemlya Test Site	Atmospheric	74	52	Novaya Zemlya Test Site	1961-09-18
861	5.125568513119533	SOV	18/09/1961		Semipalatinsk	Atmospheric	50	78	Semipalatinsk	1961-09-18
862	5.125568513119533	SOV	18/09/1961		Semipalatinsk	Atmospheric	50	78	Semipalatinsk	1961-09-18
863	5.125568513119533	SOV	17/09/1961		Semipalatinsk	Atmospheric	50.45	77.75	Semipalatinsk	1961-09-17
864	5.125568513119533	SOV	16/09/1961		Novaya Zemlya Test Site	Atmospheric	74	51.9	Novaya Zemlya Test Site	1961-09-16
865	5.125568513119533	SOV	14/09/1961		Novaya Zemlya Test Site	Atmospheric	74.6	51.1	Novaya Zemlya Test Site	1961-09-14
866	5.125568513119533	SOV	14/09/1961		Semipalatinsk	Atmospheric	50.35	77.82	Semipalatinsk	1961-09-14
867	5.125568513119533	SOV	13/09/1961		Semipalatinsk	Atmospheric	50.45	77.75	Semipalatinsk	1961-09-13
868	5.125568513119533	SOV	13/09/1961		Novaya Zemlya Test Site	Atmospheric	70.87	53.33	Novaya Zemlya Test Site	1961-09-13
869	4.3	SOV	12/09/1961		Novaya Zemlya Test Site	Atmospheric	74.2	52.1	Novaya Zemlya Test Site	1961-12-09
870	5.125568513119533	SOV	11/09/1961		Semipalatinsk	Atmospheric	50	78	Semipalatinsk	1961-11-09
871	5.125568513119533	SOV	10/09/1961		Novaya Zemlya Test Site	Atmospheric	70.7	54.6	Novaya Zemlya Test Site	1961-10-09
872	4.6	SOV	10/09/1961		Novaya Zemlya Test Site	Atmospheric	74.2	52.5	Novaya Zemlya Test Site	1961-10-09
873	5.125568513119533	SOV	10/09/1961		Semipalatinsk	Atmospheric	50	78	Semipalatinsk	1961-10-09
874	5.125568513119533	SOV	09/09/1961		Semipalatinsk	Atmospheric	50	78	Semipalatinsk	1961-09-09
875	5.125568513119533	SOV	06/09/1961		Missile Testing Range	Atmospheric	48.45	44.3	Missile Testing Range	1961-06-09
876	5.125568513119533	SOV	06/09/1961		Semipalatinsk	Atmospheric	50	78	Semipalatinsk	1961-06-09
877	5.125568513119533	SOV	05/09/1961		Semipalatinsk	Atmospheric	50.45	77.74	Semipalatinsk	1961-05-09
878	5.125568513119533	SOV	04/09/1961		Semipalatinsk	Atmospheric	50.45	77.74	Semipalatinsk	1961-04-09
879	5.125568513119533	SOV	01/09/1961		Semipalatinsk	Atmospheric	50	78	Semipalatinsk	1961-01-09
880	5.125568513119533	SOV	03/11/1958		Missile Testing Range	Atmospheric	49	46	Missile Testing Range	1958-03-11
881	5.125568513119533	SOV	01/11/1958		Missile Testing Range	Atmospheric	49	46	Missile Testing Range	1958-01-11
882	5.125568513119533	SOV	25/10/1958		Novaya Zemlya Test Site	Atmospheric	73	55	Novaya Zemlya Test Site	1958-10-25
883	5.125568513119533	SOV	25/10/1958		Novaya Zemlya Test Site	Atmospheric	73	55	Novaya Zemlya Test Site	1958-10-25
884	5.125568513119533	SOV	24/10/1958		Novaya Zemlya Test Site	Atmospheric	73.68	54.97	Novaya Zemlya Test Site	1958-10-24
885	5.125568513119533	SOV	22/10/1958		Novaya Zemlya Test Site	Atmospheric	73.53	53.1	Novaya Zemlya Test Site	1958-10-22
886	5.125568513119533	SOV	21/10/1958		Novaya Zemlya Test Site	Atmospheric	73	55	Novaya Zemlya Test Site	1958-10-21
887	5.125568513119533	SOV	20/10/1958		Novaya Zemlya Test Site	Atmospheric	73	55	Novaya Zemlya Test Site	1958-10-20
888	5.125568513119533	SOV	19/10/1958		Novaya Zemlya Test Site	Atmospheric	73	55	Novaya Zemlya Test Site	1958-10-19
889	5.125568513119533	SOV	19/10/1958		Novaya Zemlya Test Site	Atmospheric	73	55	Novaya Zemlya Test Site	1958-10-19
890	5.125568513119533	SOV	18/10/1958		Novaya Zemlya Test Site	Atmospheric	73.97	52.47	Novaya Zemlya Test Site	1958-10-18
891	5.125568513119533	SOV	15/10/1958		Novaya Zemlya Test Site	Atmospheric	74	51.8	Novaya Zemlya Test Site	1958-10-15
892	5.125568513119533	SOV	12/10/1958		Novaya Zemlya Test Site	Atmospheric	74.93	53.32	Novaya Zemlya Test Site	1958-12-10
893	5.125568513119533	SOV	10/10/1958		Novaya Zemlya Test Site	Atmospheric	73	55	Novaya Zemlya Test Site	1958-10-10
894	5.125568513119533	SOV	06/10/1958		Novaya Zemlya Test Site	Atmospheric	73	55	Novaya Zemlya Test Site	1958-06-10
895	5.125568513119533	SOV	05/10/1958		Novaya Zemlya Test Site	Atmospheric	73	55	Novaya Zemlya Test Site	1958-05-10
896	5.125568513119533	SOV	04/10/1958		Novaya Zemlya Test Site	Atmospheric	73	55	Novaya Zemlya Test Site	1958-04-10
897	5.125568513119533	SOV	02/10/1958		Novaya Zemlya Test Site	Atmospheric	73	55	Novaya Zemlya Test Site	1958-02-10
898	5.125568513119533	SOV	02/10/1958		Novaya Zemlya Test Site	Atmospheric	73	55	Novaya Zemlya Test Site	1958-02-10
899	5.125568513119533	SOV	30/09/1958		Novaya Zemlya Test Site	Atmospheric	73	55	Novaya Zemlya Test Site	1958-09-30
900	5.125568513119533	SOV	30/09/1958		Novaya Zemlya Test Site	Atmospheric	73	55	Novaya Zemlya Test Site	1958-09-30
901	5.125568513119533	SOV	22/03/1958		Semipalatinsk	Atmospheric	50	78	Semipalatinsk	1958-03-22
902	5.125568513119533	SOV	21/03/1958		Novaya Zemlya Test Site	Atmospheric	73	55	Novaya Zemlya Test Site	1958-03-21
903	5.125568513119533	SOV	20/03/1958		Semipalatinsk	Atmospheric	50	78	Semipalatinsk	1958-03-20
904	5.125568513119533	SOV	18/03/1958		Semipalatinsk	Atmospheric	50	78	Semipalatinsk	1958-03-18
905	5.125568513119533	SOV	15/03/1958		Semipalatinsk	Atmospheric	50	78	Semipalatinsk	1958-03-15
906	5.125568513119533	SOV	14/03/1958		Novaya Zemlya Test Site	Atmospheric	73	55	Novaya Zemlya Test Site	1958-03-14
907	5.125568513119533	SOV	14/03/1958		Semipalatinsk	Atmospheric	50	78	Semipalatinsk	1958-03-14
908	5.125568513119533	SOV	13/03/1958		Semipalatinsk	Atmospheric	50	78	Semipalatinsk	1958-03-13
909	5.125568513119533	SOV	27/02/1958		Novaya Zemlya Test Site	Atmospheric	73	55	Novaya Zemlya Test Site	1958-02-27
910	5.125568513119533	SOV	27/02/1958		Novaya Zemlya Test Site	Atmospheric	73	55	Novaya Zemlya Test Site	1958-02-27
911	5.125568513119533	SOV	23/02/1958		Novaya Zemlya Test Site	Atmospheric	73	55	Novaya Zemlya Test Site	1958-02-23
912	5.125568513119533	SOV	17/01/1958		Semipalatinsk	Atmospheric	50	78	Semipalatinsk	1958-01-17
913	5.125568513119533	SOV	04/01/1958		Semipalatinsk	Atmospheric	50	78	Semipalatinsk	1958-04-01
914	5.125568513119533	SOV	28/12/1957		Semipalatinsk	Atmospheric	50	78	Semipalatinsk	1957-12-28
915	5.125568513119533	SOV	10/10/1957		Novaya Zemlya Test Site	Underground	70.7	54.56	Novaya Zemlya Test Site	1957-10-10
916	5.125568513119533	SOV	06/10/1957		Novaya Zemlya Test Site	Atmospheric	73	55	Novaya Zemlya Test Site	1957-06-10
917	5.125568513119533	SOV	26/09/1957		Semipalatinsk	Atmospheric	50	78	Semipalatinsk	1957-09-26
918	5.125568513119533	SOV	24/09/1957		Novaya Zemlya Test Site	Atmospheric	73	55	Novaya Zemlya Test Site	1957-09-24
919	5.125568513119533	SOV	13/09/1957		Semipalatinsk	Atmospheric	50	78	Semipalatinsk	1957-09-13
920	5.125568513119533	SOV	07/09/1957		Novaya Zemlya Test Site	Atmospheric	70.69	54.8	Novaya Zemlya Test Site	1957-07-09
921	5.125568513119533	SOV	26/08/1957		Semipalatinsk	Atmospheric	50	78	Semipalatinsk	1957-08-26
922	5.125568513119533	SOV	22/08/1957		Semipalatinsk	Atmospheric	50	78	Semipalatinsk	1957-08-22
923	5.125568513119533	SOV	16/04/1957		Semipalatinsk	Atmospheric	50	78	Semipalatinsk	1957-04-16
924	5.125568513119533	SOV	12/04/1957		Semipalatinsk	Atmospheric	50	78	Semipalatinsk	1957-12-04
925	5.125568513119533	SOV	10/04/1957		Semipalatinsk	Atmospheric	50	78	Semipalatinsk	1957-10-04
926	5.125568513119533	SOV	06/04/1957		Semipalatinsk	Atmospheric	50	78	Semipalatinsk	1957-06-04
927	5.125568513119533	SOV	03/04/1957		Semipalatinsk	Atmospheric	50	78	Semipalatinsk	1957-03-04
928	5.125568513119533	SOV	08/03/1957		Semipalatinsk	Atmospheric	50	78	Semipalatinsk	1957-08-03
929	5.125568513119533	SOV	19/01/1957		Missile Testing Range	Atmospheric	49	46	Missile Testing Range	1957-01-19
930	5.125568513119533	SOV	14/12/1956		Semipalatinsk	Atmospheric	50	78	Semipalatinsk	1956-12-14
931	5.125568513119533	SOV	17/11/1956		Semipalatinsk	Atmospheric	50	78	Semipalatinsk	1956-11-17
932	5.125568513119533	SOV	10/09/1956		Semipalatinsk	Atmospheric	50	78	Semipalatinsk	1956-10-09
933	5.125568513119533	SOV	02/09/1956		Semipalatinsk	Atmospheric	50	78	Semipalatinsk	1956-02-09
934	5.125568513119533	SOV	30/08/1956		Semipalatinsk	Atmospheric	50	78	Semipalatinsk	1956-08-30
935	5.125568513119533	SOV	24/08/1956		Semipalatinsk	Atmospheric	50	78	Semipalatinsk	1956-08-24
936	5.125568513119533	SOV	25/03/1956		Semipalatinsk	Atmospheric	50	78	Semipalatinsk	1956-03-25
937	5.125568513119533	SOV	16/03/1956		Semipalatinsk	Atmospheric	50	78	Semipalatinsk	1956-03-16
938	5.125568513119533	SOV	02/02/1956		Missile Testing Range	Atmospheric	46	62	Missile Testing Range	1956-02-02
939	5.125568513119533	SOV	22/11/1955	24 (Joe 19)	Semipalatinsk	Atmospheric	50	78	Semipalatinsk	1955-11-22
940	5.125568513119533	SOV	06/11/1955	23 (Joe 18)	Semipalatinsk	Atmospheric	50	78	Semipalatinsk	1955-06-11
941	5.125568513119533	SOV	21/09/1955	22 (Joe 17)	Novaya Zemlya Test Site	Underwater	70.7	54.56	Novaya Zemlya Test Site	1955-09-21
942	5.125568513119533	SOV	05/08/1955		Semipalatinsk	Atmospheric	50	78	Semipalatinsk	1955-05-08
943	5.125568513119533	SOV	02/08/1955	20 (Joe 16)	Semipalatinsk	Atmospheric	50	78	Semipalatinsk	1955-02-08
944	5.125568513119533	SOV	29/07/1955	19 (Joe 15)	Semipalatinsk	Atmospheric	50	78	Semipalatinsk	1955-07-29
945	5.125568513119533	SOV	30/10/1954	18 (Joe 14?)	Semipalatinsk	Atmospheric	50	78	Semipalatinsk	1954-10-30
946	5.125568513119533	SOV	26/10/1954	17 (Joe 13?)	Semipalatinsk	Atmospheric	50	78	Semipalatinsk	1954-10-26
947	5.125568513119533	SOV	23/10/1954	16 (Joe 12?)	Semipalatinsk	Atmospheric	50	78	Semipalatinsk	1954-10-23
948	5.125568513119533	SOV	19/10/1954		Semipalatinsk	Atmospheric	50	78	Semipalatinsk	1954-10-19
949	5.125568513119533	SOV	08/10/1954	14 (Joe 11?)	Semipalatinsk	Atmospheric	50	78	Semipalatinsk	1954-08-10
950	5.125568513119533	SOV	05/10/1954	13 (Joe 10?)	Semipalatinsk	Atmospheric	50	78	Semipalatinsk	1954-05-10
951	5.125568513119533	SOV	03/10/1954	12 (Joe 9?)	Semipalatinsk	Atmospheric	50	78	Semipalatinsk	1954-03-10
952	5.125568513119533	SOV	01/10/1954		Semipalatinsk	Atmospheric	50	78	Semipalatinsk	1954-01-10
953	5.125568513119533	SOV	29/09/1954		Semipalatinsk	Atmospheric	50	78	Semipalatinsk	1954-09-29
954	5.125568513119533	SOV	14/09/1954	9 (Joe 8?)		Atmospheric	52.6	52.84	??????????? ?????????, ?????? ?????, ???????????? ???????, ??????????? ??????????? ?????, ??	1954-09-14
955	5.125568513119533	SOV	10/09/1953	8 (Joe 7?)	Semipalatinsk	Atmospheric	50	78	Semipalatinsk	1953-10-09
956	5.125568513119533	SOV	08/09/1953		Semipalatinsk	Atmospheric	50	78	Semipalatinsk	1953-08-09
957	5.125568513119533	SOV	03/09/1953	6 (Joe 6?)	Semipalatinsk	Atmospheric	50	78	Semipalatinsk	1953-03-09
958	5.125568513119533	SOV	23/08/1953	5 (Joe 5)	Semipalatinsk	Atmospheric	50	78	Semipalatinsk	1953-08-23
959	5.125568513119533	SOV	12/08/1953	4 (Joe 4)	Semipalatinsk	Atmospheric	50	78	Semipalatinsk	1953-12-08
960	5.125568513119533	SOV	18/10/1951	3 (Joe 3)	Semipalatinsk	Atmospheric	50	78	Semipalatinsk	1951-10-18
961	5.125568513119533	SOV	24/09/1951	2 Vtoraya Molniya (Joe 2)	Semipalatinsk	Atmospheric	50	78	Semipalatinsk	1951-09-24
962	5.125568513119533	SOV	29/08/1949	1 Pervaya Molniya (Joe 1)	Semipalatinsk	Atmospheric	50.44	77.82	Semipalatinsk	1949-08-29
963	4.6	GBR	26/11/1991	Bristol	NTS	Underground	37.116449	-116.188871	NTS	1991-11-26
964	5.4	GBR	14/11/1990	Houston	NTS	Underground	37.116449	-116.188871	NTS	1990-11-14
965	5.5	GBR	08/12/1989	Barnwell	NTS	Underground	37.116449	-116.188871	NTS	1989-08-12
966	4.9	GBR	16/07/1987	Midland	NTS	Underground	37.116449	-116.188871	NTS	1987-07-16
967	5.6	GBR	25/06/1986	Darwin	NTS	Underground	37.116449	-116.188871	NTS	1986-06-25
968	5.7	GBR	05/12/1985	Kinibito	NTS	Underground	37.116449	-116.188871	NTS	1985-05-12
969	5.5	GBR	09/12/1984	Egmont	NTS	Underground	37.116449	-116.188871	NTS	1984-09-12
970	5.4	GBR	01/05/1984	Mundo	NTS	Underground	37.116449	-116.188871	NTS	1984-01-05
971	4.0	GBR	22/04/1983	Armada	NTS	Underground	37.116449	-116.188871	NTS	1983-04-22
972	5.4	GBR	25/04/1982	Gibne	NTS	Underground	37.116449	-116.188871	NTS	1982-04-25
973	5.4	GBR	12/11/1981	Rousanne	NTS	Underground	37.116449	-116.188871	NTS	1981-12-11
974	5.1	GBR	17/12/1980	Serpa	NTS	Underground	37.116449	-116.188871	NTS	1980-12-17
975	4.7	GBR	24/10/1980	Dutchess	NTS	Underground	37.116449	-116.188871	NTS	1980-10-24
976	5.5	GBR	26/04/1980	Colwick	NTS	Underground	37.116449	-116.188871	NTS	1980-04-26
977	4.8	GBR	29/08/1979	Nessel	NTS	Underground	37.116449	-116.188871	NTS	1979-08-29
978	5.1	GBR	18/11/1978	Quargel	NTS	Underground	37.116449	-116.188871	NTS	1978-11-18
979	5.5	GBR	11/04/1978	Fondutta	NTS	Underground	37.116449	-116.188871	NTS	1978-11-04
980	5.3	GBR	26/08/1976	Banon	NTS	Underground	37.116449	-116.188871	NTS	1976-08-26
981	4.8	GBR	23/05/1974	Fallon	NTS	Underground	37.116449	-116.188871	NTS	1974-05-23
982	5.16	GBR	10/09/1965	Charcoal	NTS	Underground	37.116449	-116.188871	NTS	1965-10-09
983	5.125568513119533	GBR	25/09/1964	Courser	NTS	Underground	37.116449	-116.188871	NTS	1964-09-25
984	5.125568513119533	GBR	17/07/1964	Cormorant	NTS	Underground	37.116449	-116.188871	NTS	1964-07-17
985	5.125568513119533	GBR	07/12/1962	Tendrac	NTS	Underground	37.116449	-116.188871	NTS	1962-07-12
986	5.125568513119533	GBR	01/03/1962	Pampas	NTS	Underground	37.116449	-116.188871	NTS	1962-01-03
987	5.125568513119533	GBR	23/09/1958	grapple	Christmas Island	Atmospheric	-10.447525	105.690449	Christmas Island	1958-09-23
988	5.125568513119533	GBR	11/09/1958	grapple	Christmas Island	Atmospheric	-10.447525	105.690449	Christmas Island	1958-11-09
989	5.125568513119533	GBR	02/09/1958	grapple	Christmas Island	Atmospheric	-10.447525	105.690449	Christmas Island	1958-02-09
990	5.125568513119533	GBR	22/08/1958	grapple	Christmas Island	Atmospheric	-10.447525	105.690449	Christmas Island	1958-08-22
991	5.125568513119533	GBR	28/04/1958	grapple	Christmas Island	Atmospheric	-10.447525	105.690449	Christmas Island	1958-04-28
992	5.125568513119533	GBR	08/11/1957	grapple	Christmas Island	Atmospheric	-10.447525	105.690449	Christmas Island	1957-08-11
993	5.125568513119533	GBR	09/10/1957	Antler	Maralinga	Atmospheric	-30.163170	131.575195	Maralinga	1957-09-10
994	5.125568513119533	GBR	25/09/1957	Antler	Maralinga	Atmospheric	-30.163170	131.575195	Maralinga	1957-09-25
995	5.125568513119533	GBR	14/09/1957	Antler	Maralinga	Atmospheric	-30.163170	131.575195	Maralinga	1957-09-14
996	5.125568513119533	GBR	19/06/1957	grapple	Christmas Island	Atmospheric	-10.447525	105.690449	Christmas Island	1957-06-19
997	5.125568513119533	GBR	31/05/1957	grapple	Christmas Island	Atmospheric	-10.447525	105.690449	Christmas Island	1957-05-31
998	5.125568513119533	GBR	15/05/1957	grapple	Christmas Island	Atmospheric	-10.447525	105.690449	Christmas Island	1957-05-15
999	5.125568513119533	GBR	22/10/1956	Buffalo	Maralinga	Atmospheric	-30.163170	131.575195	Maralinga	1956-10-22
1000	5.125568513119533	GBR	11/10/1956	Buffalo	Maralinga	Atmospheric	-30.163170	131.575195	Maralinga	1956-11-10
1001	5.125568513119533	GBR	04/10/1956	Buffalo	Maralinga	Atmospheric	-30.163170	131.575195	Maralinga	1956-04-10
1002	5.125568513119533	GBR	27/09/1956	Buffalo	Maralinga	Atmospheric	-30.163170	131.575195	Maralinga	1956-09-27
1003	5.125568513119533	GBR	19/06/1956	Mosaic G2	Monte Bello Is	Atmospheric	-20.439168	115.556260	Monte Bello Is	1956-06-19
1004	5.125568513119533	GBR	16/05/1956	Mosaic G1	Monte Bello Is	Atmospheric	-20.439168	115.556260	Monte Bello Is	1956-05-16
1005	5.125568513119533	GBR	26/10/1953	Totem 2	Emu Fields, Australia	Atmospheric	-28.698333	132.371389	Emu Fields, Australia	1953-10-26
1006	5.125568513119533	GBR	14/10/1953	Totem 1	Emu Fields, Australia	Atmospheric	-28.698333	132.371389	Emu Fields, Australia	1953-10-14
1007	5.125568513119533	GBR	03/10/1952	Hurricane	Monte Bello Is	Atmospheric	-20.439168	115.556260	Monte Bello Is	1952-03-10
1008	4.4	USA	23/09/1992	DIVIDER	Nevada Test Site	Underground	37.05575	116.03825	Nevada Test Site	1992-09-23
1009	4.4	USA	18/09/1992	HUNTERS TROPHY	Nevada Test Site	Underground	37.05575	116.03825	Nevada Test Site	1992-09-18
1010	5.125568513119533	USA	23/06/1992	GALENA-YELLOW	Nevada Test Site	Underground	37.05575	116.03825	Nevada Test Site	1992-06-23
1011	5.125568513119533	USA	19/06/1992	VICTORIA	Nevada Test Site	Underground	37.05575	116.03825	Nevada Test Site	1992-06-19
1012	5.125568513119533	USA	30/04/1992	DIAMOND FORTUNE	Nevada Test Site	Underground	37.05575	116.03825	Nevada Test Site	1992-04-30
1013	5.5	USA	26/03/1992	JUNCTION	Nevada Test Site	Underground	37.05575	116.03825	Nevada Test Site	1992-03-26
1014	5.125568513119533	USA	26/11/1991	BRISTOL	Nevada Test Site	Underground	37.05575	116.03825	Nevada Test Site	1991-11-26
1015	5.2	USA	18/10/1991	LUBBOCK	Nevada Test Site	Underground	37.05575	116.03825	Nevada Test Site	1991-10-18
1016	4.0	USA	19/09/1991	DISTANT ZENITH	Nevada Test Site	Underground	37.05575	116.03825	Nevada Test Site	1991-09-19
1017	5.5	USA	14/09/1991	HOYA	Nevada Test Site	Underground	37.05575	116.03825	Nevada Test Site	1991-09-14
1018	4.4	USA	15/08/1991	FLOYDADA	Nevada Test Site	Underground	37.05575	116.03825	Nevada Test Site	1991-08-15
1019	5.4	USA	16/04/1991	MONTELLO	Nevada Test Site	Underground	37.05575	116.03825	Nevada Test Site	1991-04-16
1020	5.6	USA	04/04/1991	BEXAR	Nevada Test Site	Underground	37.05575	116.03825	Nevada Test Site	1991-04-04
1021	4.3	USA	08/03/1991	COSO-BRONZE	Nevada Test Site	Underground	37.05575	116.03825	Nevada Test Site	1991-08-03
1022	5.125568513119533	USA	14/11/1990	HOUSTON	Nevada Test Site	Underground	37.05575	116.03825	Nevada Test Site	1990-11-14
1023	5.6	USA	12/10/1990	TENABO	Nevada Test Site	Underground	37.05575	116.03825	Nevada Test Site	1990-12-10
1024	5.125568513119533	USA	27/09/1990	LEDOUX	Nevada Test Site	Underground	37.05575	116.03825	Nevada Test Site	1990-09-27
1025	5.125568513119533	USA	20/09/1990	SUNDOWN-A	Nevada Test Site	Underground	37.05575	116.03825	Nevada Test Site	1990-09-20
1026	4.7	USA	25/07/1990	MINERAL QUARRY	Nevada Test Site	Underground	37.05575	116.03825	Nevada Test Site	1990-07-25
1027	4.1	USA	21/06/1990	AUSTIN	Nevada Test Site	Underground	37.05575	116.03825	Nevada Test Site	1990-06-21
1028	5.7	USA	13/06/1990	BULLION	Nevada Test Site	Underground	37.05575	116.03825	Nevada Test Site	1990-06-13
1029	5.125568513119533	USA	06/04/1990	BOWIE	Nevada Test Site	Underground	37.05575	116.03825	Nevada Test Site	1990-06-04
1030	5.1	USA	10/03/1990	METROPOLIS	Nevada Test Site	Underground	37.05575	116.03825	Nevada Test Site	1990-10-03
1031	5.125568513119533	USA	20/12/1989	WHITEFACE-A	Nevada Test Site	Underground	37.05575	116.03825	Nevada Test Site	1989-12-20
1032	5.125568513119533	USA	08/12/1989	BAMWELL	Nevada Test Site	Underground	37.05575	116.03825	Nevada Test Site	1989-08-12
1033	5.125568513119533	USA	15/11/1989	MULESHOE	Nevada Test Site	Underground	37.05575	116.03825	Nevada Test Site	1989-11-15
1034	5.7	USA	31/10/1989	HORNITOS	Nevada Test Site	Underground	37.05575	116.03825	Nevada Test Site	1989-10-31
1035	4.7	USA	14/09/1989	DISKO ELM	Nevada Test Site	Underground	37.05575	116.03825	Nevada Test Site	1989-09-14
1036	4.9	USA	27/06/1989	AMARILLO	Nevada Test Site	Underground	37.05575	116.03825	Nevada Test Site	1989-06-27
1037	5.3	USA	22/06/1989	CONTACT	Nevada Test Site	Underground	37.05575	116.03825	Nevada Test Site	1989-06-22
1038	3.7	USA	26/05/1989	TULIA	Nevada Test Site	Underground	37.05575	116.03825	Nevada Test Site	1989-05-26
1039	4.4	USA	15/05/1989	PALISADE-1	Nevada Test Site	Underground	37.05575	116.03825	Nevada Test Site	1989-05-15
1040	5.0	USA	09/03/1989	INGOT	Nevada Test Site	Underground	37.05575	116.03825	Nevada Test Site	1989-09-03
1041	4.4	USA	24/02/1989	KAWICH-RED	Nevada Test Site	Underground	37.05575	116.03825	Nevada Test Site	1989-02-24
1042	5.2	USA	10/02/1989	TEXARKANA	Nevada Test Site	Underground	37.05575	116.03825	Nevada Test Site	1989-10-02
1043	5.0	USA	10/12/1988	MISTY ECHO	Nevada Test Site	Underground	37.05575	116.03825	Nevada Test Site	1988-10-12
1044	5.125568513119533	USA	09/12/1988	KAWICH-WHITE	Nevada Test Site	Underground	37.05575	116.03825	Nevada Test Site	1988-09-12
1045	5.125568513119533	USA	09/11/1988	MONAHANS-A	Nevada Test Site	Underground	37.05575	116.03825	Nevada Test Site	1988-09-11
1046	5.9	USA	13/10/1988	DALHART	Nevada Test Site	Underground	37.05575	116.03825	Nevada Test Site	1988-10-13
1047	5.1	USA	30/08/1988	BULLFROG	Nevada Test Site	Underground	37.05575	116.03825	Nevada Test Site	1988-08-30
1048	4.1	USA	23/08/1988	HARLINGEN-A	Nevada Test Site	Underground	37.05575	116.03825	Nevada Test Site	1988-08-23
1049	5.6	USA	17/08/1988	KEARSARGE	Nevada Test Site	Underground	37.05575	116.03825	Nevada Test Site	1988-08-17
1050	5.7	USA	07/07/1988	ALAMO	Nevada Test Site	Underground	37.05575	116.03825	Nevada Test Site	1988-07-07
1051	5.125568513119533	USA	22/06/1988	NIGHTINGALE	Nevada Test Site	Underground	37.05575	116.03825	Nevada Test Site	1988-06-22
1052	5.125568513119533	USA	22/06/1988	RHYOLITE	Nevada Test Site	Underground	37.05575	116.03825	Nevada Test Site	1988-06-22
1053	5.4	USA	02/06/1988	COMSTOCK	Nevada Test Site	Underground	37.05575	116.03825	Nevada Test Site	1988-02-06
1054	4.3	USA	21/05/1988	LAREDO	Nevada Test Site	Underground	37.05575	116.03825	Nevada Test Site	1988-05-21
1055	4.8	USA	13/05/1988	SCHELLBOURNE	Nevada Test Site	Underground	37.05575	116.03825	Nevada Test Site	1988-05-13
1056	4.1	USA	07/04/1988	ABILENE	Nevada Test Site	Underground	37.05575	116.03825	Nevada Test Site	1988-07-04
1057	5.3	USA	15/02/1988	KERNVILLE	Nevada Test Site	Underground	37.05575	116.03825	Nevada Test Site	1988-02-15
1058	4.1	USA	02/12/1987	MISSION CYBER	Nevada Test Site	Underground	37.05575	116.03825	Nevada Test Site	1987-02-12
1059	5.125568513119533	USA	01/12/1987	WACO	Nevada Test Site	Underground	37.05575	116.03825	Nevada Test Site	1987-01-12
1060	5.2	USA	23/10/1987	BORATE	Nevada Test Site	Underground	37.05575	116.03825	Nevada Test Site	1987-10-23
1061	5.7	USA	24/09/1987	LOCKNEY	Nevada Test Site	Underground	37.05575	116.03825	Nevada Test Site	1987-09-24
1062	5.9	USA	13/08/1987	TAHOKA	Nevada Test Site	Underground	37.05575	116.03825	Nevada Test Site	1987-08-13
1063	5.125568513119533	USA	16/07/1987	MIDLAND	Nevada Test Site	Underground	37.05575	116.03825	Nevada Test Site	1987-07-16
1064	4.6	USA	30/06/1987	PANCHUELA	Nevada Test Site	Underground	37.05575	116.03825	Nevada Test Site	1987-06-30
1065	5.125568513119533	USA	20/06/1987	MISSION GHOST	Nevada Test Site	Underground	37.05575	116.03825	Nevada Test Site	1987-06-20
1066	5.125568513119533	USA	18/06/1987	BRIE	Nevada Test Site	Underground	37.05575	116.03825	Nevada Test Site	1987-06-18
1067	5.5	USA	30/04/1987	HARDIN	Nevada Test Site	Underground	37.05575	116.03825	Nevada Test Site	1987-04-30
1068	4.2	USA	22/04/1987	PRESIDIO	Nevada Test Site	Underground	37.05575	116.03825	Nevada Test Site	1987-04-22
1069	5.5	USA	18/04/1987	DELAMAR	Nevada Test Site	Underground	37.05575	116.03825	Nevada Test Site	1987-04-18
1070	4.3	USA	18/03/1987	MIDDLE NOTE	Nevada Test Site	Underground	37.05575	116.03825	Nevada Test Site	1987-03-18
1071	4.5	USA	11/02/1987	TORNERO	Nevada Test Site	Underground	37.05575	116.03825	Nevada Test Site	1987-11-02
1072	5.125568513119533	USA	03/02/1987	HAZEBROOK-EMERALD (GREEN)	Nevada Test Site	Underground	37.05575	116.03825	Nevada Test Site	1987-03-02
1073	5.6	USA	13/12/1986	BODIE	Nevada Test Site	Underground	37.05575	116.03825	Nevada Test Site	1986-12-13
1074	5.8	USA	14/11/1986	GASCON	Nevada Test Site	Underground	37.05575	116.03825	Nevada Test Site	1986-11-14
1075	5.6	USA	16/10/1986	BELMONT	Nevada Test Site	Underground	37.05575	116.03825	Nevada Test Site	1986-10-16
1076	5.6	USA	30/09/1986	LABQUARK	Nevada Test Site	Underground	37.05575	116.03825	Nevada Test Site	1986-09-30
1077	5.125568513119533	USA	11/09/1986	ALEMAN	Nevada Test Site	Underground	37.05575	116.03825	Nevada Test Site	1986-11-09
1078	5.125568513119533	USA	04/09/1986	GALVESTON	Nevada Test Site	Underground	37.05575	116.03825	Nevada Test Site	1986-04-09
1079	4.6	USA	24/07/1986	CORNUCOPIA	Nevada Test Site	Underground	37.05575	116.03825	Nevada Test Site	1986-07-24
1080	5.7	USA	17/07/1986	CYBAR	Nevada Test Site	Underground	37.05575	116.03825	Nevada Test Site	1986-07-17
1081	5.125568513119533	USA	25/06/1986	DARWIN	Nevada Test Site	Underground	37.05575	116.03825	Nevada Test Site	1986-06-25
1082	5.4	USA	05/06/1986	TAJO	Nevada Test Site	Underground	37.05575	116.03825	Nevada Test Site	1986-05-06
1083	5.125568513119533	USA	21/05/1986	PANAMINT	Nevada Test Site	Underground	37.05575	116.03825	Nevada Test Site	1986-05-21
1084	5.4	USA	22/04/1986	JEFFERSON	Nevada Test Site	Underground	37.05575	116.03825	Nevada Test Site	1986-04-22
1085	4.0	USA	20/04/1986	MOGOLLON	Nevada Test Site	Underground	37.05575	116.03825	Nevada Test Site	1986-04-20
1086	5.0	USA	10/04/1986	MIGHTY OAK	Nevada Test Site	Underground	37.05575	116.03825	Nevada Test Site	1986-10-04
1087	5.2	USA	22/03/1986	GLENCOE	Nevada Test Site	Underground	37.05575	116.03825	Nevada Test Site	1986-03-22
1088	5.3	USA	28/12/1985	GOLDSTONE	Nevada Test Site	Underground	37.05575	116.03825	Nevada Test Site	1985-12-28
1089	5.125568513119533	USA	05/12/1985	KINIBITO	Nevada Test Site	Underground	37.05575	116.03825	Nevada Test Site	1985-05-12
1090	5.125568513119533	USA	30/10/1985	ABO	Nevada Test Site	Underground	37.05575	116.03825	Nevada Test Site	1985-10-30
1091	4.7	USA	16/10/1985	ROQUEFORT	Nevada Test Site	Underground	37.05575	116.03825	Nevada Test Site	1985-10-16
1092	4.2	USA	09/10/1985	DIAMOND BEECH	Nevada Test Site	Underground	37.05575	116.03825	Nevada Test Site	1985-09-10
1093	5.125568513119533	USA	09/10/1985	MILL YARD	Nevada Test Site	Underground	37.05575	116.03825	Nevada Test Site	1985-09-10
1094	4.7	USA	27/09/1985	PONIL	Nevada Test Site	Underground	37.05575	116.03825	Nevada Test Site	1985-09-27
1095	4.6	USA	17/08/1985	CHAMITA	Nevada Test Site	Underground	37.05575	116.03825	Nevada Test Site	1985-08-17
1096	5.125568513119533	USA	14/08/1985	CEBRERO	Nevada Test Site	Underground	37.05575	116.03825	Nevada Test Site	1985-08-14
1097	5.2	USA	25/07/1985	SERENA	Nevada Test Site	Underground	37.05575	116.03825	Nevada Test Site	1985-07-25
1098	4.3	USA	26/06/1985	MARIBO	Nevada Test Site	Underground	37.05575	116.03825	Nevada Test Site	1985-06-26
1099	4.6	USA	12/06/1985	VILLE	Nevada Test Site	Underground	37.05575	116.03825	Nevada Test Site	1985-12-06
1100	5.5	USA	12/06/1985	SALUT	Nevada Test Site	Underground	37.05575	116.03825	Nevada Test Site	1985-12-06
1101	5.7	USA	02/05/1985	TOWANDA	Nevada Test Site	Underground	37.05575	116.03825	Nevada Test Site	1985-02-05
1102	4.8	USA	06/04/1985	MISTY RAIN	Nevada Test Site	Underground	37.05575	116.03825	Nevada Test Site	1985-06-04
1103	5.8	USA	02/04/1985	HERMOSA	Nevada Test Site	Underground	37.05575	116.03825	Nevada Test Site	1985-02-04
1104	5.3	USA	23/03/1985	COTTAGE	Nevada Test Site	Underground	37.05575	116.03825	Nevada Test Site	1985-03-23
1105	4.8	USA	15/03/1985	VAUGHN	Nevada Test Site	Underground	37.05575	116.03825	Nevada Test Site	1985-03-15
1106	4.2	USA	20/12/1984	MINERO	Nevada Test Site	Underground	37.05575	116.03825	Nevada Test Site	1984-12-20
1107	5.4	USA	15/12/1984	TIERRA	Nevada Test Site	Underground	37.05575	116.03825	Nevada Test Site	1984-12-15
1108	5.125568513119533	USA	09/12/1984	EGMONT	Nevada Test Site	Underground	37.05575	116.03825	Nevada Test Site	1984-09-12
1109	4.5	USA	10/11/1984	VILLITA	Nevada Test Site	Underground	37.05575	116.03825	Nevada Test Site	1984-10-11
1110	4.2	USA	02/10/1984	VERMEJO	Nevada Test Site	Underground	37.05575	116.03825	Nevada Test Site	1984-02-10
1111	5.0	USA	13/09/1984	BRETON	Nevada Test Site	Underground	37.05575	116.03825	Nevada Test Site	1984-09-13
1112	5.125568513119533	USA	30/08/1984	WEXFORD	Nevada Test Site	Underground	37.05575	116.03825	Nevada Test Site	1984-08-30
1113	4.9	USA	30/08/1984	DOLCETTO	Nevada Test Site	Underground	37.05575	116.03825	Nevada Test Site	1984-08-30
1114	4.7	USA	02/08/1984	CORREO	Nevada Test Site	Underground	37.05575	116.03825	Nevada Test Site	1984-02-08
1115	5.4	USA	25/07/1984	KAPPELI	Nevada Test Site	Underground	37.05575	116.03825	Nevada Test Site	1984-07-25
1116	3.6	USA	12/07/1984	NORMANNA	Nevada Test Site	Underground	37.05575	116.03825	Nevada Test Site	1984-12-07
1117	4.7	USA	20/06/1984	DUORO	Nevada Test Site	Underground	37.05575	116.03825	Nevada Test Site	1984-06-20
1118	5.8	USA	31/05/1984	CAPROCK	Nevada Test Site	Underground	37.05575	116.03825	Nevada Test Site	1984-05-31
1119	5.125568513119533	USA	16/05/1984	BELLOW	Nevada Test Site	Underground	37.05575	116.03825	Nevada Test Site	1984-05-16
1120	5.125568513119533	USA	02/05/1984	ORKNEY	Nevada Test Site	Underground	37.05575	116.03825	Nevada Test Site	1984-02-05
1121	5.125568513119533	USA	01/05/1984	MUNDO	Nevada Test Site	Underground	37.05575	116.03825	Nevada Test Site	1984-01-05
1122	4.5	USA	31/03/1984	AGRINI	Nevada Test Site	Underground	37.05575	116.03825	Nevada Test Site	1984-03-31
1123	5.9	USA	01/03/1984	TORTUGAS	Nevada Test Site	Underground	37.05575	116.03825	Nevada Test Site	1984-01-03
1124	5.1	USA	15/02/1984	MIDAS MYTH/MILAGRO	Nevada Test Site	Underground	37.05575	116.03825	Nevada Test Site	1984-02-15
1125	4.1	USA	31/01/1984	GORBEA	Nevada Test Site	Underground	37.05575	116.03825	Nevada Test Site	1984-01-31
1126	5.2	USA	16/12/1983	ROMANO	Nevada Test Site	Underground	37.05575	116.03825	Nevada Test Site	1983-12-16
1127	5.125568513119533	USA	09/12/1983	MUGGINS	Nevada Test Site	Underground	37.05575	116.03825	Nevada Test Site	1983-09-12
1128	5.125568513119533	USA	29/09/1983	NAVATA	Nevada Test Site	Underground	37.05575	116.03825	Nevada Test Site	1983-09-29
1129	5.125568513119533	USA	22/09/1983	TECHADO	Nevada Test Site	Underground	37.05575	116.03825	Nevada Test Site	1983-09-22
1130	5.125568513119533	USA	21/09/1983	BRANCO	Nevada Test Site	Underground	37.05575	116.03825	Nevada Test Site	1983-09-21
1131	5.125568513119533	USA	21/09/1983	TOMME/MIDNIGHT ZEPHYR	Nevada Test Site	Underground	37.05575	116.03825	Nevada Test Site	1983-09-21
1132	5.5	USA	01/09/1983	CHANCELLOR	Nevada Test Site	Underground	37.05575	116.03825	Nevada Test Site	1983-01-09
1133	4.1	USA	27/08/1983	JARLSBERG	Nevada Test Site	Underground	37.05575	116.03825	Nevada Test Site	1983-08-27
1134	4.4	USA	11/08/1983	SABADO	Nevada Test Site	Underground	37.05575	116.03825	Nevada Test Site	1983-11-08
1135	4.2	USA	03/08/1983	LABAN	Nevada Test Site	Underground	37.05575	116.03825	Nevada Test Site	1983-03-08
1136	4.5	USA	09/06/1983	DANABLU	Nevada Test Site	Underground	37.05575	116.03825	Nevada Test Site	1983-09-06
1137	4.5	USA	26/05/1983	FAHADA	Nevada Test Site	Underground	37.05575	116.03825	Nevada Test Site	1983-05-26
1138	5.125568513119533	USA	26/05/1983	MINI JADE	Nevada Test Site	Underground	37.05575	116.03825	Nevada Test Site	1983-05-26
1139	4.5	USA	05/05/1983	CROWDIE	Nevada Test Site	Underground	37.05575	116.03825	Nevada Test Site	1983-05-05
1140	5.125568513119533	USA	22/04/1983	ARMADA	Nevada Test Site	Underground	37.05575	116.03825	Nevada Test Site	1983-04-22
1141	5.7	USA	14/04/1983	TURQUOISE	Nevada Test Site	Underground	37.05575	116.03825	Nevada Test Site	1983-04-14
1142	5.2	USA	26/03/1983	CABRA	Nevada Test Site	Underground	37.05575	116.03825	Nevada Test Site	1983-03-26
1143	4.0	USA	17/02/1983	CHEEDAM	Nevada Test Site	Underground	37.05575	116.03825	Nevada Test Site	1983-02-17
1144	5.125568513119533	USA	11/02/1983	COALORA	Nevada Test Site	Underground	37.05575	116.03825	Nevada Test Site	1983-11-02
1145	4.8	USA	10/12/1982	MANTECA	Nevada Test Site	Underground	37.05575	116.03825	Nevada Test Site	1982-10-12
1146	4.4	USA	12/11/1982	SEYVAL	Nevada Test Site	Underground	37.05575	116.03825	Nevada Test Site	1982-12-11
1147	5.125568513119533	USA	29/09/1982	BORREGO	Nevada Test Site	Underground	37.05575	116.03825	Nevada Test Site	1982-09-29
1148	4.9	USA	23/09/1982	FRISCO	Nevada Test Site	Underground	37.05575	116.03825	Nevada Test Site	1982-09-23
1149	4.9	USA	23/09/1982	HURON LANDING	Nevada Test Site	Underground	37.05575	116.03825	Nevada Test Site	1982-09-23
1150	5.125568513119533	USA	23/09/1982	DIAMOND ACE	Nevada Test Site	Underground	37.05575	116.03825	Nevada Test Site	1982-09-23
1151	5.125568513119533	USA	02/09/1982	CERRO	Nevada Test Site	Underground	37.05575	116.03825	Nevada Test Site	1982-02-09
1152	5.125568513119533	USA	11/08/1982	QUESO	Nevada Test Site	Underground	37.05575	116.03825	Nevada Test Site	1982-11-08
1153	5.7	USA	05/08/1982	ATRISCO	Nevada Test Site	Underground	37.05575	116.03825	Nevada Test Site	1982-05-08
1154	4.5	USA	29/07/1982	MONTEREY	Nevada Test Site	Underground	37.05575	116.03825	Nevada Test Site	1982-07-29
1155	5.6	USA	24/06/1982	NEBBIOLO	Nevada Test Site	Underground	37.05575	116.03825	Nevada Test Site	1982-06-24
1156	5.125568513119533	USA	16/06/1982	KESTI	Nevada Test Site	Underground	37.05575	116.03825	Nevada Test Site	1982-06-16
1157	5.7	USA	07/05/1982	BOUSCHET	Nevada Test Site	Underground	37.05575	116.03825	Nevada Test Site	1982-07-05
1158	4.3	USA	06/05/1982	KRYDDOST	Nevada Test Site	Underground	37.05575	116.03825	Nevada Test Site	1982-06-05
1159	5.125568513119533	USA	25/04/1982	GIBNE	Nevada Test Site	Underground	37.05575	116.03825	Nevada Test Site	1982-04-25
1160	4.5	USA	17/04/1982	TENAJA	Nevada Test Site	Underground	37.05575	116.03825	Nevada Test Site	1982-04-17
1161	5.6	USA	12/02/1982	HOSTA	Nevada Test Site	Underground	37.05575	116.03825	Nevada Test Site	1982-12-02
1162	5.4	USA	12/02/1982	MOLBO	Nevada Test Site	Underground	37.05575	116.03825	Nevada Test Site	1982-12-02
1163	5.9	USA	28/01/1982	JORNADA	Nevada Test Site	Underground	37.05575	116.03825	Nevada Test Site	1982-01-28
1164	4.4	USA	16/12/1981	CABOC	Nevada Test Site	Underground	37.05575	116.03825	Nevada Test Site	1981-12-16
1165	4.8	USA	03/12/1981	AKAVI	Nevada Test Site	Underground	37.05575	116.03825	Nevada Test Site	1981-03-12
1166	5.125568513119533	USA	12/11/1981	ROUSANNE	Nevada Test Site	Underground	37.05575	116.03825	Nevada Test Site	1981-12-11
1167	4.9	USA	11/11/1981	TILCI	Nevada Test Site	Underground	37.05575	116.03825	Nevada Test Site	1981-11-11
1168	5.1	USA	01/10/1981	PALIZA	Nevada Test Site	Underground	37.05575	116.03825	Nevada Test Site	1981-01-10
1169	5.125568513119533	USA	24/09/1981	CERNADA	Nevada Test Site	Underground	37.05575	116.03825	Nevada Test Site	1981-09-24
1170	5.125568513119533	USA	04/09/1981	TREBBIANO	Nevada Test Site	Underground	37.05575	116.03825	Nevada Test Site	1981-04-09
1171	5.125568513119533	USA	27/08/1981	ISLAY	Nevada Test Site	Underground	37.05575	116.03825	Nevada Test Site	1981-08-27
1172	5.125568513119533	USA	05/08/1981	HAVARTI	Nevada Test Site	Underground	37.05575	116.03825	Nevada Test Site	1981-05-08
1173	5.125568513119533	USA	16/07/1981	PINEAU	Nevada Test Site	Underground	37.05575	116.03825	Nevada Test Site	1981-07-16
1174	5.125568513119533	USA	10/07/1981	NIZA	Nevada Test Site	Underground	37.05575	116.03825	Nevada Test Site	1981-10-07
1175	5.6	USA	06/06/1981	HARZER	Nevada Test Site	Underground	37.05575	116.03825	Nevada Test Site	1981-06-06
1176	4.2	USA	29/05/1981	ALIGOTE	Nevada Test Site	Underground	37.05575	116.03825	Nevada Test Site	1981-05-29
1177	5.125568513119533	USA	30/04/1981	VIDE	Nevada Test Site	Underground	37.05575	116.03825	Nevada Test Site	1981-04-30
1178	5.125568513119533	USA	25/02/1981	SECO	Nevada Test Site	Underground	37.05575	116.03825	Nevada Test Site	1981-02-25
1179	5.125568513119533	USA	05/02/1981	CLAIRETTE	Nevada Test Site	Underground	37.05575	116.03825	Nevada Test Site	1981-05-02
1180	5.7	USA	15/01/1981	BASEBALL	Nevada Test Site	Underground	37.05575	116.03825	Nevada Test Site	1981-01-15
1181	5.125568513119533	USA	17/12/1980	SERPA	Nevada Test Site	Underground	37.05575	116.03825	Nevada Test Site	1980-12-17
1182	4.1	USA	14/11/1980	DAUPHIN	Nevada Test Site	Underground	37.05575	116.03825	Nevada Test Site	1980-11-14
1183	4.7	USA	31/10/1980	MINERS IRON	Nevada Test Site	Underground	37.05575	116.03825	Nevada Test Site	1980-10-31
1184	5.125568513119533	USA	24/10/1980	DUTCHESS	Nevada Test Site	Underground	37.05575	116.03825	Nevada Test Site	1980-10-24
1185	5.125568513119533	USA	25/09/1980	RIOLA	Nevada Test Site	Underground	37.05575	116.03825	Nevada Test Site	1980-09-25
1186	4.6	USA	25/09/1980	BONARDA	Nevada Test Site	Underground	37.05575	116.03825	Nevada Test Site	1980-09-25
1187	4.3	USA	31/07/1980	VERDELLO	Nevada Test Site	Underground	37.05575	116.03825	Nevada Test Site	1980-07-31
1188	5.6	USA	25/07/1980	TAFI	Nevada Test Site	Underground	37.05575	116.03825	Nevada Test Site	1980-07-25
1189	4.5	USA	24/06/1980	HURON KING	Nevada Test Site	Underground	37.05575	116.03825	Nevada Test Site	1980-06-24
1190	5.6	USA	12/06/1980	KASH	Nevada Test Site	Underground	37.05575	116.03825	Nevada Test Site	1980-12-06
1191	5.125568513119533	USA	22/05/1980	FLORA	Nevada Test Site	Underground	37.05575	116.03825	Nevada Test Site	1980-05-22
1192	4.5	USA	02/05/1980	CANFIELD	Nevada Test Site	Underground	37.05575	116.03825	Nevada Test Site	1980-02-05
1193	5.125568513119533	USA	26/04/1980	COLWICK	Nevada Test Site	Underground	37.05575	116.03825	Nevada Test Site	1980-04-26
1194	5.3	USA	16/04/1980	PYRAMID	Nevada Test Site	Underground	37.05575	116.03825	Nevada Test Site	1980-04-16
1195	4.8	USA	03/04/1980	LIPTAUER	Nevada Test Site	Underground	37.05575	116.03825	Nevada Test Site	1980-03-04
1196	3.9	USA	08/03/1980	NORBO	Nevada Test Site	Underground	37.05575	116.03825	Nevada Test Site	1980-08-03
1197	4.4	USA	28/02/1980	TARKO	Nevada Test Site	Underground	37.05575	116.03825	Nevada Test Site	1980-02-28
1198	5.125568513119533	USA	14/12/1979	AZUL	Nevada Test Site	Underground	37.05575	116.03825	Nevada Test Site	1979-12-14
1199	3.8	USA	29/11/1979	BACKGAMMON	Nevada Test Site	Underground	37.05575	116.03825	Nevada Test Site	1979-11-29
1200	5.6	USA	26/09/1979	SHEEPSHEAD	Nevada Test Site	Underground	37.05575	116.03825	Nevada Test Site	1979-09-26
1201	5.125568513119533	USA	08/09/1979	PERA	Nevada Test Site	Underground	37.05575	116.03825	Nevada Test Site	1979-08-09
1202	5.8	USA	06/09/1979	HEARTS	Nevada Test Site	Underground	37.05575	116.03825	Nevada Test Site	1979-06-09
1203	5.125568513119533	USA	29/08/1979	NESSEL	Nevada Test Site	Underground	37.05575	116.03825	Nevada Test Site	1979-08-29
1204	4.9	USA	08/08/1979	OFFSHORE	Nevada Test Site	Underground	37.05575	116.03825	Nevada Test Site	1979-08-08
1205	4.6	USA	03/08/1979	BURZET	Nevada Test Site	Underground	37.05575	116.03825	Nevada Test Site	1979-03-08
1206	5.0	USA	28/06/1979	FAJY	Nevada Test Site	Underground	37.05575	116.03825	Nevada Test Site	1979-06-28
1207	4.0	USA	20/06/1979	CHESS	Nevada Test Site	Underground	37.05575	116.03825	Nevada Test Site	1979-06-20
1208	5.5	USA	11/06/1979	PEPATO	Nevada Test Site	Underground	37.05575	116.03825	Nevada Test Site	1979-11-06
1209	5.125568513119533	USA	11/05/1979	FREEZEOUT	Nevada Test Site	Underground	37.05575	116.03825	Nevada Test Site	1979-11-05
1210	4.4	USA	14/03/1979	MEMORY	Nevada Test Site	Underground	37.05575	116.03825	Nevada Test Site	1979-03-14
1211	4.9	USA	15/02/1979	KLOSTER	Nevada Test Site	Underground	37.05575	116.03825	Nevada Test Site	1979-02-15
1212	5.5	USA	08/02/1979	QUINELLA	Nevada Test Site	Underground	37.05575	116.03825	Nevada Test Site	1979-08-02
1213	4.5	USA	24/01/1979	BACCARAT	Nevada Test Site	Underground	37.05575	116.03825	Nevada Test Site	1979-01-24
1214	5.6	USA	16/12/1978	FARM	Nevada Test Site	Underground	37.05575	116.03825	Nevada Test Site	1978-12-16
1215	5.125568513119533	USA	01/12/1978	CONCENTRATION	Nevada Test Site	Underground	37.05575	116.03825	Nevada Test Site	1978-01-12
1216	5.125568513119533	USA	18/11/1978	QUARGEL	Nevada Test Site	Underground	37.05575	116.03825	Nevada Test Site	1978-11-18
1217	4.2	USA	02/11/1978	EMMENTHAL	Nevada Test Site	Underground	37.05575	116.03825	Nevada Test Site	1978-02-11
1218	5.8	USA	27/09/1978	RUMMY	Nevada Test Site	Underground	37.05575	116.03825	Nevada Test Site	1978-09-27
1219	5.0	USA	27/09/1978	DRAUGHTS	Nevada Test Site	Underground	37.05575	116.03825	Nevada Test Site	1978-09-27
1220	5.125568513119533	USA	27/09/1978	CREMINO	Nevada Test Site	Underground	37.05575	116.03825	Nevada Test Site	1978-09-27
1221	4.6	USA	13/09/1978	DIABLO HAWK	Nevada Test Site	Underground	37.05575	116.03825	Nevada Test Site	1978-09-13
1222	5.6	USA	31/08/1978	PANIR	Nevada Test Site	Underground	37.05575	116.03825	Nevada Test Site	1978-08-31
1223	5.6	USA	12/07/1978	LOWBALL	Nevada Test Site	Underground	37.05575	116.03825	Nevada Test Site	1978-12-07
1224	4.0	USA	07/07/1978	SATZ	Nevada Test Site	Underground	37.05575	116.03825	Nevada Test Site	1978-07-07
1225	5.125568513119533	USA	01/06/1978	JACKPOTS	Nevada Test Site	Underground	37.05575	116.03825	Nevada Test Site	1978-01-06
1226	5.125568513119533	USA	10/05/1978	TRANSOM	Nevada Test Site	Underground	37.05575	116.03825	Nevada Test Site	1978-10-05
1227	5.125568513119533	USA	25/04/1978	ASCO	Nevada Test Site	Underground	37.05575	116.03825	Nevada Test Site	1978-04-25
1228	5.125568513119533	USA	11/04/1978	BACKBEACH	Nevada Test Site	Underground	37.05575	116.03825	Nevada Test Site	1978-11-04
1229	5.4	USA	11/04/1978	FONDUTTA	Nevada Test Site	Underground	37.05575	116.03825	Nevada Test Site	1978-11-04
1230	5.125568513119533	USA	23/03/1978	TOPMAST	Nevada Test Site	Underground	37.05575	116.03825	Nevada Test Site	1978-03-23
1231	5.6	USA	23/03/1978	ICEBERG	Nevada Test Site	Underground	37.05575	116.03825	Nevada Test Site	1978-03-23
1232	4.0	USA	16/03/1978	KARAB	Nevada Test Site	Underground	37.05575	116.03825	Nevada Test Site	1978-03-16
1233	5.6	USA	23/02/1978	REBLOCHON	Nevada Test Site	Underground	37.05575	116.03825	Nevada Test Site	1978-02-23
1234	3.8	USA	13/02/1978	CAMPOS	Nevada Test Site	Underground	37.05575	116.03825	Nevada Test Site	1978-02-13
1235	5.7	USA	14/12/1977	FARALLONES	Nevada Test Site	Underground	37.05575	116.03825	Nevada Test Site	1977-12-14
1236	5.125568513119533	USA	14/12/1977	RIB	Nevada Test Site	Underground	37.05575	116.03825	Nevada Test Site	1977-12-14
1237	4.7	USA	17/11/1977	SEAMOUNT	Nevada Test Site	Underground	37.05575	116.03825	Nevada Test Site	1977-11-17
1238	5.8	USA	09/11/1977	SANDREEF	Nevada Test Site	Underground	37.05575	116.03825	Nevada Test Site	1977-09-11
1239	4.7	USA	01/11/1977	HYBLA GOLD	Nevada Test Site	Underground	37.05575	116.03825	Nevada Test Site	1977-01-11
1240	4.4	USA	26/10/1977	BOBSTAY	Nevada Test Site	Underground	37.05575	116.03825	Nevada Test Site	1977-10-26
1241	4.8	USA	27/09/1977	COULOMMIERS	Nevada Test Site	Underground	37.05575	116.03825	Nevada Test Site	1977-09-27
1242	4.5	USA	15/09/1977	EBBTIDE	Nevada Test Site	Underground	37.05575	116.03825	Nevada Test Site	1977-09-15
1243	5.6	USA	19/08/1977	SCANTLING	Nevada Test Site	Underground	37.05575	116.03825	Nevada Test Site	1977-08-19
1244	5.125568513119533	USA	19/08/1977	SCUPPER	Nevada Test Site	Underground	37.05575	116.03825	Nevada Test Site	1977-08-19
1245	5.125568513119533	USA	16/08/1977	FLOTOST	Nevada Test Site	Underground	37.05575	116.03825	Nevada Test Site	1977-08-16
1246	5.125568513119533	USA	16/08/1977	GRUYERE	Nevada Test Site	Underground	37.05575	116.03825	Nevada Test Site	1977-08-16
1247	5.1	USA	04/08/1977	STRAKE	Nevada Test Site	Underground	37.05575	116.03825	Nevada Test Site	1977-04-08
1248	5.125568513119533	USA	28/07/1977	CARNELIAN	Nevada Test Site	Underground	37.05575	116.03825	Nevada Test Site	1977-07-28
1249	5.125568513119533	USA	02/06/1977	FOREFOOT	Nevada Test Site	Underground	37.05575	116.03825	Nevada Test Site	1977-02-06
1250	5.3	USA	25/05/1977	CREWLINE	Nevada Test Site	Underground	37.05575	116.03825	Nevada Test Site	1977-05-25
1251	5.4	USA	27/04/1977	BULKHEAD	Nevada Test Site	Underground	37.05575	116.03825	Nevada Test Site	1977-04-27
1252	5.6	USA	05/04/1977	MARSILLY	Nevada Test Site	Underground	37.05575	116.03825	Nevada Test Site	1977-05-04
1253	5.125568513119533	USA	08/03/1977	DOFINO	Nevada Test Site	Underground	37.05575	116.03825	Nevada Test Site	1977-08-03
1254	4.6	USA	16/02/1977	COVE	Nevada Test Site	Underground	37.05575	116.03825	Nevada Test Site	1977-02-16
1255	5.5	USA	28/12/1976	RUDDER	Nevada Test Site	Underground	37.05575	116.03825	Nevada Test Site	1976-12-28
1256	5.125568513119533	USA	21/12/1976	SUTTER	Nevada Test Site	Underground	37.05575	116.03825	Nevada Test Site	1976-12-21
1257	5.125568513119533	USA	21/12/1976	ASIAGO	Nevada Test Site	Underground	37.05575	116.03825	Nevada Test Site	1976-12-21
1258	4.9	USA	08/12/1976	REDMUD	Nevada Test Site	Underground	37.05575	116.03825	Nevada Test Site	1976-08-12
1259	5.125568513119533	USA	23/11/1976	CHEVRE	Nevada Test Site	Underground	37.05575	116.03825	Nevada Test Site	1976-11-23
1260	5.125568513119533	USA	10/11/1976	SPRIT	Nevada Test Site	Underground	37.05575	116.03825	Nevada Test Site	1976-10-11
1261	5.125568513119533	USA	06/10/1976	GOUDA	Nevada Test Site	Underground	37.05575	116.03825	Nevada Test Site	1976-06-10
1262	5.125568513119533	USA	26/08/1976	BANON	Nevada Test Site	Underground	37.05575	116.03825	Nevada Test Site	1976-08-26
1263	5.3	USA	27/07/1976	BILLET	Nevada Test Site	Underground	37.05575	116.03825	Nevada Test Site	1976-07-27
1264	5.125568513119533	USA	20/05/1976	RIVOLI	Nevada Test Site	Underground	37.05575	116.03825	Nevada Test Site	1976-05-20
1265	4.9	USA	12/05/1976	MIGHTY EPIC	Nevada Test Site	Underground	37.05575	116.03825	Nevada Test Site	1976-12-05
1266	5.8	USA	17/03/1976	STRAIT	Nevada Test Site	Underground	37.05575	116.03825	Nevada Test Site	1976-03-17
1267	6.1	USA	17/03/1976	POOL	Nevada Test Site	Underground	37.05575	116.03825	Nevada Test Site	1976-03-17
1268	6.3	USA	14/03/1976	COLBY	Nevada Test Site	Underground	37.05575	116.03825	Nevada Test Site	1976-03-14
1269	6.0	USA	09/03/1976	ESTUARY	Nevada Test Site	Underground	37.05575	116.03825	Nevada Test Site	1976-09-03
1270	4.2	USA	26/02/1976	SHALLOWS	Nevada Test Site	Underground	37.05575	116.03825	Nevada Test Site	1976-02-26
1271	6.0	USA	14/02/1976	CHESHIRE	Nevada Test Site	Underground	37.05575	116.03825	Nevada Test Site	1976-02-14
1272	6.3	USA	12/02/1976	FONTINA	Nevada Test Site	Underground	37.05575	116.03825	Nevada Test Site	1976-12-02
1273	5.7	USA	04/02/1976	ESROM	Nevada Test Site	Underground	37.05575	116.03825	Nevada Test Site	1976-04-02
1274	5.8	USA	04/02/1976	KEELSON	Nevada Test Site	Underground	37.05575	116.03825	Nevada Test Site	1976-04-02
1275	6.2	USA	03/01/1976	MUENSTER	Nevada Test Site	Underground	37.05575	116.03825	Nevada Test Site	1976-03-01
1276	5.7	USA	20/12/1975	CHIBERTA	Nevada Test Site	Underground	37.05575	116.03825	Nevada Test Site	1975-12-20
1277	5.0	USA	26/11/1975	LEYDEN	Nevada Test Site	Underground	37.05575	116.03825	Nevada Test Site	1975-11-26
1278	6.0	USA	20/11/1975	INLET	Nevada Test Site	Underground	37.05575	116.03825	Nevada Test Site	1975-11-20
1279	4.4	USA	18/11/1975	DECK	Nevada Test Site	Underground	37.05575	116.03825	Nevada Test Site	1975-11-18
1280	6.4	USA	28/10/1975	KASSERI	Nevada Test Site	Underground	37.05575	116.03825	Nevada Test Site	1975-10-28
1281	4.7	USA	24/10/1975	HUSKY PUP	Nevada Test Site	Underground	37.05575	116.03825	Nevada Test Site	1975-10-24
1282	4.6	USA	06/09/1975	MARSH	Nevada Test Site	Underground	37.05575	116.03825	Nevada Test Site	1975-06-09
1283	6.2	USA	26/06/1975	CAMEMBERT	Nevada Test Site	Underground	37.05575	116.03825	Nevada Test Site	1975-06-26
1284	6.1	USA	19/06/1975	MAST	Nevada Test Site	Underground	37.05575	116.03825	Nevada Test Site	1975-06-19
1285	5.125568513119533	USA	18/06/1975	FUTTOCK	Nevada Test Site	Underground	37.05575	116.03825	Nevada Test Site	1975-06-18
1286	5.125568513119533	USA	11/06/1975	ALVISO	Nevada Test Site	Underground	37.05575	116.03825	Nevada Test Site	1975-11-06
1287	5.7	USA	03/06/1975	MIZZEN	Nevada Test Site	Underground	37.05575	116.03825	Nevada Test Site	1975-03-06
1288	5.9	USA	03/06/1975	STILTON	Nevada Test Site	Underground	37.05575	116.03825	Nevada Test Site	1975-03-06
1289	6.0	USA	14/05/1975	TYBO	Nevada Test Site	Underground	37.05575	116.03825	Nevada Test Site	1975-05-14
1290	5.2	USA	30/04/1975	OBAR	Nevada Test Site	Underground	37.05575	116.03825	Nevada Test Site	1975-04-30
1291	4.6	USA	24/04/1975	EDAM	Nevada Test Site	Underground	37.05575	116.03825	Nevada Test Site	1975-04-24
1292	4.9	USA	05/04/1975	DINING CAR	Nevada Test Site	Underground	37.05575	116.03825	Nevada Test Site	1975-05-04
1293	5.5	USA	07/03/1975	CABRILLO	Nevada Test Site	Underground	37.05575	116.03825	Nevada Test Site	1975-07-03
1294	5.7	USA	28/02/1975	TOPGALLANT	Nevada Test Site	Underground	37.05575	116.03825	Nevada Test Site	1975-02-28
1295	5.125568513119533	USA	19/02/1975	BILGE	Nevada Test Site	Underground	37.05575	116.03825	Nevada Test Site	1975-02-19
1296	5.125568513119533	USA	06/02/1975	TELEME	Nevada Test Site	Underground	37.05575	116.03825	Nevada Test Site	1975-06-02
1297	5.125568513119533	USA	06/02/1975	PORTOLA	Nevada Test Site	Underground	37.05575	116.03825	Nevada Test Site	1975-06-02
1298	4.3	USA	16/12/1974	KEEL	Nevada Test Site	Underground	37.05575	116.03825	Nevada Test Site	1974-12-16
1299	5.125568513119533	USA	26/11/1974	PUDDLE	Nevada Test Site	Underground	37.05575	116.03825	Nevada Test Site	1974-11-26
1300	5.125568513119533	USA	02/11/1974	TEMESCAL	Nevada Test Site	Underground	37.05575	116.03825	Nevada Test Site	1974-02-11
1301	5.125568513119533	USA	28/10/1974	HYBLA FAIR	Nevada Test Site	Underground	37.05575	116.03825	Nevada Test Site	1974-10-28
1302	5.125568513119533	USA	17/10/1974	ESTACA	Nevada Test Site	Underground	37.05575	116.03825	Nevada Test Site	1974-10-17
1303	5.6	USA	26/09/1974	STANYAN	Nevada Test Site	Underground	37.05575	116.03825	Nevada Test Site	1974-09-26
1304	5.125568513119533	USA	26/09/1974	TRUMBULL	Nevada Test Site	Underground	37.05575	116.03825	Nevada Test Site	1974-09-26
1305	4.4	USA	25/09/1974	PRATT	Nevada Test Site	Underground	37.05575	116.03825	Nevada Test Site	1974-09-25
1306	5.8	USA	30/08/1974	PORTMANTEAU	Nevada Test Site	Underground	37.05575	116.03825	Nevada Test Site	1974-08-30
1307	4.6	USA	14/08/1974	PUYE	Nevada Test Site	Underground	37.05575	116.03825	Nevada Test Site	1974-08-14
1308	5.125568513119533	USA	18/07/1974	CRESTLAKE-TANSAN	Nevada Test Site	Underground	37.05575	116.03825	Nevada Test Site	1974-07-18
1309	5.7	USA	10/07/1974	ESCABOSA	Nevada Test Site	Underground	37.05575	116.03825	Nevada Test Site	1974-10-07
1310	5.0	USA	19/06/1974	MING BLADE	Nevada Test Site	Underground	37.05575	116.03825	Nevada Test Site	1974-06-19
1311	4.4	USA	06/06/1974	JARA	Nevada Test Site	Underground	37.05575	116.03825	Nevada Test Site	1974-06-06
1312	5.125568513119533	USA	23/05/1974	FALLON	Nevada Test Site	Underground	37.05575	116.03825	Nevada Test Site	1974-05-23
1313	4.2	USA	22/05/1974	GROVE	Nevada Test Site	Underground	37.05575	116.03825	Nevada Test Site	1974-05-22
1314	5.125568513119533	USA	08/05/1974	JIB	Nevada Test Site	Underground	37.05575	116.03825	Nevada Test Site	1974-08-05
1315	5.125568513119533	USA	01/05/1974	PLOMO	Nevada Test Site	Underground	37.05575	116.03825	Nevada Test Site	1974-01-05
1316	5.125568513119533	USA	23/04/1974	POTRERO	Nevada Test Site	Underground	37.05575	116.03825	Nevada Test Site	1974-04-23
1317	5.125568513119533	USA	12/04/1974	SAPELLO	Nevada Test Site	Underground	37.05575	116.03825	Nevada Test Site	1974-12-04
1318	5.125568513119533	USA	14/03/1974	HULSEA	Nevada Test Site	Underground	37.05575	116.03825	Nevada Test Site	1974-03-14
1319	5.8	USA	27/02/1974	LATIR	Nevada Test Site	Underground	37.05575	116.03825	Nevada Test Site	1974-02-27
1320	5.125568513119533	USA	10/01/1974	PINEDROPS-SLOAT	Nevada Test Site	Underground	37.05575	116.03825	Nevada Test Site	1974-10-01
1321	5.125568513119533	USA	19/12/1973	ELIDA	Nevada Test Site	Underground	37.05575	116.03825	Nevada Test Site	1973-12-19
1322	5.125568513119533	USA	19/12/1973	SPAR	Nevada Test Site	Underground	37.05575	116.03825	Nevada Test Site	1973-12-19
1323	5.125568513119533	USA	13/12/1973	SEAFOAM	Nevada Test Site	Underground	37.05575	116.03825	Nevada Test Site	1973-12-13
1324	4.4	USA	12/12/1973	PAJARA	Nevada Test Site	Underground	37.05575	116.03825	Nevada Test Site	1973-12-12
1325	4.4	USA	28/11/1973	BERNAL	Nevada Test Site	Underground	37.05575	116.03825	Nevada Test Site	1973-11-28
1326	4.8	USA	12/10/1973	HUSKY ACE	Nevada Test Site	Underground	37.05575	116.03825	Nevada Test Site	1973-12-10
1327	5.125568513119533	USA	02/10/1973	WALLER	Nevada Test Site	Underground	37.05575	116.03825	Nevada Test Site	1973-02-10
1328	5.125568513119533	USA	02/10/1973	POLYGONUM	Nevada Test Site	Underground	37.05575	116.03825	Nevada Test Site	1973-02-10
1329	5.125568513119533	USA	28/06/1973	SILENE	Nevada Test Site	Underground	37.05575	116.03825	Nevada Test Site	1973-06-28
1330	4.9	USA	28/06/1973	PORTULACA	Nevada Test Site	Underground	37.05575	116.03825	Nevada Test Site	1973-06-28
1331	5.3	USA	21/06/1973	POTRILLO	Nevada Test Site	Underground	37.05575	116.03825	Nevada Test Site	1973-06-21
1332	6.1	USA	06/06/1973	ALMENDRO	Nevada Test Site	Underground	37.05575	116.03825	Nevada Test Site	1973-06-06
1333	5.1	USA	05/06/1973	DIDO QUEEN	Nevada Test Site	Underground	37.05575	116.03825	Nevada Test Site	1973-05-06
1334	4.8	USA	24/05/1973	CABRESTO	Nevada Test Site	Underground	37.05575	116.03825	Nevada Test Site	1973-05-24
1335	5.125568513119533	USA	24/05/1973	KASHAN	Nevada Test Site	Underground	37.05575	116.03825	Nevada Test Site	1973-05-24
1336	5.4	USA	17/05/1973	RIO BLANCO-1	Rifle, Colorado	Underground	39.534702	-107.783120	Rifle, Colorado	1973-05-17
1337	5.125568513119533	USA	09/05/1973	MESITA	Nevada Test Site	Underground	37.05575	116.03825	Nevada Test Site	1973-09-05
1338	5.6	USA	26/04/1973	STARWORT	Nevada Test Site	Underground	37.05575	116.03825	Nevada Test Site	1973-04-26
1339	5.125568513119533	USA	26/04/1973	COLMOR	Nevada Test Site	Underground	37.05575	116.03825	Nevada Test Site	1973-04-26
1340	4.7	USA	25/04/1973	ANGUS	Nevada Test Site	Underground	37.05575	116.03825	Nevada Test Site	1973-04-25
1341	5.125568513119533	USA	05/04/1973	NATOMA	Nevada Test Site	Underground	37.05575	116.03825	Nevada Test Site	1973-05-04
1342	5.125568513119533	USA	23/03/1973	GAZOOK	Nevada Test Site	Underground	37.05575	116.03825	Nevada Test Site	1973-03-23
1343	5.4	USA	08/03/1973	MIERA	Nevada Test Site	Underground	37.05575	116.03825	Nevada Test Site	1973-08-03
1344	5.125568513119533	USA	14/02/1973	ALUMROOT	Nevada Test Site	Underground	37.05575	116.03825	Nevada Test Site	1973-02-14
1345	5.125568513119533	USA	21/12/1972	FLAX-TEST	Nevada Test Site	Underground	37.05575	116.03825	Nevada Test Site	1972-12-21
1346	5.0	USA	21/12/1972	FLAX-SOURCE	Nevada Test Site	Underground	37.05575	116.03825	Nevada Test Site	1972-12-21
1347	5.125568513119533	USA	14/12/1972	SOLANUM	Nevada Test Site	Underground	37.05575	116.03825	Nevada Test Site	1972-12-14
1348	5.125568513119533	USA	12/12/1972	TULOSO	Nevada Test Site	Underground	37.05575	116.03825	Nevada Test Site	1972-12-12
1349	5.125568513119533	USA	17/11/1972	CANNA-UMBRINUS	Nevada Test Site	Underground	37.05575	116.03825	Nevada Test Site	1972-11-17
1350	5.125568513119533	USA	09/11/1972	ARSENATE	Nevada Test Site	Underground	37.05575	116.03825	Nevada Test Site	1972-09-11
1351	5.125568513119533	USA	09/11/1972	AKBAR	Nevada Test Site	Underground	37.05575	116.03825	Nevada Test Site	1972-09-11
1352	4.4	USA	26/09/1972	DELPHINIUM	Nevada Test Site	Underground	37.05575	116.03825	Nevada Test Site	1972-09-26
1353	5.7	USA	21/09/1972	OSCURO	Nevada Test Site	Underground	37.05575	116.03825	Nevada Test Site	1972-09-21
1354	5.125568513119533	USA	09/08/1972	CEBOLLA	Nevada Test Site	Underground	37.05575	116.03825	Nevada Test Site	1972-09-08
1355	4.0	USA	25/07/1972	ATARQUE	Nevada Test Site	Underground	37.05575	116.03825	Nevada Test Site	1972-07-25
1356	5.0	USA	20/07/1972	DIAMOND SCULLS	Nevada Test Site	Underground	37.05575	116.03825	Nevada Test Site	1972-07-20
1357	5.125568513119533	USA	28/06/1972	HAPLOPAPPUS	Nevada Test Site	Underground	37.05575	116.03825	Nevada Test Site	1972-06-28
1358	5.125568513119533	USA	28/06/1972	TAJIQUE	Nevada Test Site	Underground	37.05575	116.03825	Nevada Test Site	1972-06-28
1359	5.125568513119533	USA	28/06/1972	CAPITAN	Nevada Test Site	Underground	37.05575	116.03825	Nevada Test Site	1972-06-28
1360	5.125568513119533	USA	07/06/1972	MERIDA	Nevada Test Site	Underground	37.05575	116.03825	Nevada Test Site	1972-07-06
1361	4.9	USA	19/05/1972	MONERO	Nevada Test Site	Underground	37.05575	116.03825	Nevada Test Site	1972-05-19
1362	4.4	USA	17/05/1972	ZINNIA	Nevada Test Site	Underground	37.05575	116.03825	Nevada Test Site	1972-05-17
1363	5.125568513119533	USA	11/05/1972	KARA	Nevada Test Site	Underground	37.05575	116.03825	Nevada Test Site	1972-11-05
1364	5.0	USA	02/05/1972	MISTY NORTH	Nevada Test Site	Underground	37.05575	116.03825	Nevada Test Site	1972-02-05
1365	5.125568513119533	USA	19/04/1972	JICARILLA	Nevada Test Site	Underground	37.05575	116.03825	Nevada Test Site	1972-04-19
1366	4.6	USA	19/04/1972	LONGCHAMPS	Nevada Test Site	Underground	37.05575	116.03825	Nevada Test Site	1972-04-19
1367	4.6	USA	30/03/1972	OCATE	Nevada Test Site	Underground	37.05575	116.03825	Nevada Test Site	1972-03-30
1368	5.125568513119533	USA	23/03/1972	SAPPHO	Nevada Test Site	Underground	37.05575	116.03825	Nevada Test Site	1972-03-23
1369	5.125568513119533	USA	17/02/1972	DIANTHUS	Nevada Test Site	Underground	37.05575	116.03825	Nevada Test Site	1972-02-17
1370	5.125568513119533	USA	03/02/1972	COWLES	Nevada Test Site	Underground	37.05575	116.03825	Nevada Test Site	1972-03-02
1371	5.125568513119533	USA	05/01/1972	MESCALERO	Nevada Test Site	Underground	37.05575	116.03825	Nevada Test Site	1972-05-01
1372	5.125568513119533	USA	14/12/1971	HOSPAH	Nevada Test Site	Underground	37.05575	116.03825	Nevada Test Site	1971-12-14
1373	5.125568513119533	USA	14/12/1971	YERBA	Nevada Test Site	Underground	37.05575	116.03825	Nevada Test Site	1971-12-14
1374	4.7	USA	14/12/1971	CHAENACTIS	Nevada Test Site	Underground	37.05575	116.03825	Nevada Test Site	1971-12-14
1375	4.7	USA	30/11/1971	PARNASSIA	Nevada Test Site	Underground	37.05575	116.03825	Nevada Test Site	1971-11-30
1376	5.125568513119533	USA	24/11/1971	DIAGONAL LINE	Nevada Test Site	Underground	37.05575	116.03825	Nevada Test Site	1971-11-24
1377	6.8	USA	06/11/1971	CANNIKIN	Amchitka, Alaska	Underground	51.456	179.102	Amchitka, Alaska	1971-06-11
1378	4.4	USA	14/10/1971	LAGOON	Nevada Test Site	Underground	37.05575	116.03825	Nevada Test Site	1971-10-14
1379	4.7	USA	08/10/1971	CATHAY	Nevada Test Site	Underground	37.05575	116.03825	Nevada Test Site	1971-08-10
1380	5.125568513119533	USA	29/09/1971	CHANTILLY	Nevada Test Site	Underground	37.05575	116.03825	Nevada Test Site	1971-09-29
1381	4.4	USA	29/09/1971	PEDERNAL	Nevada Test Site	Underground	37.05575	116.03825	Nevada Test Site	1971-09-29
1382	5.125568513119533	USA	22/09/1971	FRIJOLES-DEMING	Nevada Test Site	Underground	37.05575	116.03825	Nevada Test Site	1971-09-22
1383	5.4	USA	18/08/1971	ALGODONES	Nevada Test Site	Underground	37.05575	116.03825	Nevada Test Site	1971-08-18
1384	5.125568513119533	USA	06/08/1971	BALTIC	Nevada Test Site	Underground	37.05575	116.03825	Nevada Test Site	1971-06-08
1385	5.125568513119533	USA	05/08/1971	NAMA-AMARYLIS	Nevada Test Site	Underground	37.05575	116.03825	Nevada Test Site	1971-05-08
1386	5.125568513119533	USA	04/08/1971	BARRANCA	Nevada Test Site	Underground	37.05575	116.03825	Nevada Test Site	1971-04-08
1387	5.125568513119533	USA	21/07/1971	APODACA	Nevada Test Site	Underground	37.05575	116.03825	Nevada Test Site	1971-07-21
1388	5.125568513119533	USA	09/07/1971	BRACKEN	Nevada Test Site	Underground	37.05575	116.03825	Nevada Test Site	1971-09-07
1389	5.5	USA	08/07/1971	MINIATA	Nevada Test Site	Underground	37.05575	116.03825	Nevada Test Site	1971-08-07
1390	5.125568513119533	USA	01/07/1971	DIAMOND MINE	Nevada Test Site	Underground	37.05575	116.03825	Nevada Test Site	1971-01-07
1391	4.9	USA	29/06/1971	CAMPHOR	Nevada Test Site	Underground	37.05575	116.03825	Nevada Test Site	1971-06-29
1392	5.2	USA	24/06/1971	HAREBELL	Nevada Test Site	Underground	37.05575	116.03825	Nevada Test Site	1971-06-24
1393	4.8	USA	23/06/1971	LAGUNA	Nevada Test Site	Underground	37.05575	116.03825	Nevada Test Site	1971-06-23
1394	5.125568513119533	USA	23/06/1971	DEXTER	Nevada Test Site	Underground	37.05575	116.03825	Nevada Test Site	1971-06-23
1395	4.9	USA	16/06/1971	EMBUDO	Nevada Test Site	Underground	37.05575	116.03825	Nevada Test Site	1971-06-16
1396	5.2	USA	18/12/1970	BANEBERRY	Nevada Test Site	Underground	37.05575	116.03825	Nevada Test Site	1970-12-18
1397	5.8	USA	17/12/1970	CARPETBAG	Nevada Test Site	Underground	37.05575	116.03825	Nevada Test Site	1970-12-17
1398	5.2	USA	16/12/1970	ARTESIA	Nevada Test Site	Underground	37.05575	116.03825	Nevada Test Site	1970-12-16
1399	5.1	USA	16/12/1970	AVENS-ANDORRE	Nevada Test Site	Underground	37.05575	116.03825	Nevada Test Site	1970-12-16
1400	5.125568513119533	USA	16/12/1970	CANJILON	Nevada Test Site	Underground	37.072	116.026	Nevada Test Site	1970-12-16
1401	5.125568513119533	USA	03/12/1970	CARRIZOZO	Nevada Test Site	Underground	37.002	116.039	Nevada Test Site	1970-03-12
1402	5.125568513119533	USA	19/11/1970	PENASCO	Nevada Test Site	Underground	37.015	116.017	Nevada Test Site	1970-11-19
1403	4.9	USA	05/11/1970	ABEYTAS	Nevada Test Site	Underground	37.05575	116.03825	Nevada Test Site	1970-05-11
1404	5.125568513119533	USA	28/10/1970	TRUCHAS-CHACON	Nevada Test Site	Underground	37.05575	116.03825	Nevada Test Site	1970-10-28
1405	5.5	USA	14/10/1970	TIJERAS	Nevada Test Site	Underground	37.05575	116.03825	Nevada Test Site	1970-10-14
1406	5.125568513119533	USA	13/10/1970	SCREE-ACAJOU	Nevada Test Site	Underground	37.05575	116.03825	Nevada Test Site	1970-10-13
1407	4.3	USA	26/06/1970	ARNICA-YELLOW	Nevada Test Site	Underground	37.05575	116.03825	Nevada Test Site	1970-06-26
1408	5.125568513119533	USA	28/05/1970	PITON-A	Nevada Test Site	Underground	37.05575	116.03825	Nevada Test Site	1970-05-28
1409	4.2	USA	28/05/1970	PITON-C	Nevada Test Site	Underground	37.05575	116.03825	Nevada Test Site	1970-05-28
1410	5.6	USA	26/05/1970	FLASK-GREEN	Nevada Test Site	Underground	37.05575	116.03825	Nevada Test Site	1970-05-26
1411	5.0	USA	26/05/1970	HUDSON MOON	Nevada Test Site	Underground	37.05575	116.03825	Nevada Test Site	1970-05-26
1412	5.1	USA	21/05/1970	MORRONES	Nevada Test Site	Underground	37.05575	116.03825	Nevada Test Site	1970-05-21
1413	3.5	USA	21/05/1970	MANZANAS	Nevada Test Site	Underground	37.05575	116.03825	Nevada Test Site	1970-05-21
1414	5.3	USA	15/05/1970	CORNICE-YELLOW	Nevada Test Site	Underground	37.05575	116.03825	Nevada Test Site	1970-05-15
1415	5.125568513119533	USA	12/05/1970	DIAMOND DUST	Nevada Test Site	Underground	37.05575	116.03825	Nevada Test Site	1970-12-05
1416	5.2	USA	05/05/1970	MINT LEAF	Nevada Test Site	Underground	37.05575	116.03825	Nevada Test Site	1970-05-05
1417	4.5	USA	01/05/1970	HOD-A (GREEN)	Nevada Test Site	Underground	37.05575	116.03825	Nevada Test Site	1970-01-05
1418	5.125568513119533	USA	01/05/1970	HOD-C (BLUE)	Nevada Test Site	Underground	37.05575	116.03825	Nevada Test Site	1970-01-05
1419	4.2	USA	01/05/1970	BEEBALM	Nevada Test Site	Underground	37.05575	116.03825	Nevada Test Site	1970-01-05
1420	4.8	USA	21/04/1970	CAN-GREEN	Nevada Test Site	Underground	37.05575	116.03825	Nevada Test Site	1970-04-21
1421	4.6	USA	21/04/1970	SNUBBER	Nevada Test Site	Underground	37.05575	116.03825	Nevada Test Site	1970-04-21
1422	6.5	USA	26/03/1970	HANDLEY	Nevada Test Site	Underground	37.05575	116.03825	Nevada Test Site	1970-03-26
1423	5.5	USA	23/03/1970	SHAPER	Nevada Test Site	Underground	37.05575	116.03825	Nevada Test Site	1970-03-23
1424	4.1	USA	19/03/1970	JAL	Nevada Test Site	Underground	37.05575	116.03825	Nevada Test Site	1970-03-19
1425	4.3	USA	06/03/1970	ARABIS-RED	Nevada Test Site	Underground	37.05575	116.03825	Nevada Test Site	1970-06-03
1426	4.5	USA	06/03/1970	CYATHUS	Nevada Test Site	Underground	37.05575	116.03825	Nevada Test Site	1970-06-03
1427	5.3	USA	26/02/1970	YANNIGAN-RED	Nevada Test Site	Underground	37.05575	116.03825	Nevada Test Site	1970-02-26
1428	5.2	USA	25/02/1970	CUMARIN	Nevada Test Site	Underground	37.05575	116.03825	Nevada Test Site	1970-02-25
1429	4.7	USA	11/02/1970	DIANA MIST	Nevada Test Site	Underground	37.05575	116.03825	Nevada Test Site	1970-11-02
1430	4.7	USA	05/02/1970	LABIS	Nevada Test Site	Underground	37.05575	116.03825	Nevada Test Site	1970-05-02
1431	5.125568513119533	USA	04/02/1970	BELEN	Nevada Test Site	Underground	37.05575	116.03825	Nevada Test Site	1970-04-02
1432	5.6	USA	04/02/1970	GRAPE B	Nevada Test Site	Underground	37.05575	116.03825	Nevada Test Site	1970-04-02
1433	4.6	USA	30/01/1970	AJO	Nevada Test Site	Underground	37.05575	116.03825	Nevada Test Site	1970-01-30
1434	4.6	USA	23/01/1970	FOB-GREEN	Nevada Test Site	Underground	37.05575	116.03825	Nevada Test Site	1970-01-23
1435	5.2	USA	18/12/1969	TERRINE-WHITE	Nevada Test Site	Underground	37.05575	116.03825	Nevada Test Site	1969-12-18
1436	4.8	USA	17/12/1969	LOVAGE	Nevada Test Site	Underground	37.05575	116.03825	Nevada Test Site	1969-12-17
1437	5.5	USA	17/12/1969	GRAPE A	Nevada Test Site	Underground	37.05575	116.03825	Nevada Test Site	1969-12-17
1438	5.125568513119533	USA	10/12/1969	TUN-A	Nevada Test Site	Underground	37.05575	116.03825	Nevada Test Site	1969-10-12
1439	5.125568513119533	USA	10/12/1969	CULANTRO-A	Nevada Test Site	Underground	37.05575	116.03825	Nevada Test Site	1969-10-12
1440	5.0	USA	05/12/1969	DIESEL TRAIN	Nevada Test Site	Underground	37.05575	116.03825	Nevada Test Site	1969-05-12
1441	5.0	USA	21/11/1969	PICCALILLI	Nevada Test Site	Underground	37.05575	116.03825	Nevada Test Site	1969-11-21
1442	5.125568513119533	USA	21/11/1969	PLANER	Nevada Test Site	Underground	37.05575	116.03825	Nevada Test Site	1969-11-21
1443	5.125568513119533	USA	13/11/1969	SCUTTLE	Nevada Test Site	Underground	37.05575	116.03825	Nevada Test Site	1969-11-13
1444	5.7	USA	29/10/1969	CALABASH	Nevada Test Site	Underground	37.05575	116.03825	Nevada Test Site	1969-10-29
1445	5.0	USA	29/10/1969	POD-A	Nevada Test Site	Underground	37.05575	116.03825	Nevada Test Site	1969-10-29
1446	5.1	USA	29/10/1969	CRUET	Nevada Test Site	Underground	37.05575	116.03825	Nevada Test Site	1969-10-29
1447	5.125568513119533	USA	16/10/1969	SEAWEED B	Nevada Test Site	Underground	37.05575	116.03825	Nevada Test Site	1969-10-16
1448	5.6	USA	08/10/1969	PIPKIN	Nevada Test Site	Underground	37.05575	116.03825	Nevada Test Site	1969-08-10
1449	6.4	USA	02/10/1969	MILROW	Amchitka, Alaska	Underground	51.403	179.179	Amchitka, Alaska	1969-02-10
1450	5.125568513119533	USA	01/10/1969	SEAWEED-C	Nevada Test Site	Underground	37.05575	116.03825	Nevada Test Site	1969-01-10
1451	5.125568513119533	USA	20/09/1969	KYACK-A	Nevada Test Site	Underground	37.05575	116.03825	Nevada Test Site	1969-09-20
1452	6.2	USA	16/09/1969	JORUM	Nevada Test Site	Underground	37.05575	116.03825	Nevada Test Site	1969-09-16
1453	4.5	USA	12/09/1969	MINUTE STEAK	Nevada Test Site	Underground	37.05575	116.03825	Nevada Test Site	1969-12-09
1454	5.3	USA	10/09/1969	RULISON	Grand Valley, Colorado	Underground	40.072738	-106.064018	Grand Valley, Colorado	1969-10-09
1455	5.125568513119533	USA	27/08/1969	HOREHOUND	Nevada Test Site	Underground	37.05575	116.03825	Nevada Test Site	1969-08-27
1456	4.7	USA	27/08/1969	PLIERS	Nevada Test Site	Underground	37.05575	116.03825	Nevada Test Site	1969-08-27
1457	5.125568513119533	USA	14/08/1969	SPIDER-A	Nevada Test Site	Underground	37.05575	116.03825	Nevada Test Site	1969-08-14
1458	5.6	USA	16/07/1969	HUTCH	Nevada Test Site	Underground	37.05575	116.03825	Nevada Test Site	1969-07-16
1459	4.7	USA	16/07/1969	ILDRIM	Nevada Test Site	Underground	37.05575	116.03825	Nevada Test Site	1969-07-16
1460	5.125568513119533	USA	26/06/1969	BOWL-1	Nevada Test Site	Underground	37.05575	116.03825	Nevada Test Site	1969-06-26
1461	4.5	USA	12/06/1969	TAPPER	Nevada Test Site	Underground	37.05575	116.03825	Nevada Test Site	1969-12-06
1462	5.0	USA	27/05/1969	TORRIDO	Nevada Test Site	Underground	37.05575	116.03825	Nevada Test Site	1969-05-27
1463	5.125568513119533	USA	27/05/1969	IPECAC-A	Nevada Test Site	Underground	37.05575	116.03825	Nevada Test Site	1969-05-27
1464	5.125568513119533	USA	15/05/1969	ALIMENT	Nevada Test Site	Underground	37.05575	116.03825	Nevada Test Site	1969-05-15
1465	5.8	USA	07/05/1969	PURSE	Nevada Test Site	Underground	37.05575	116.03825	Nevada Test Site	1969-07-05
1466	5.3	USA	30/04/1969	BLENTON	Nevada Test Site	Underground	37.05575	116.03825	Nevada Test Site	1969-04-30
1467	5.2	USA	30/04/1969	THISTLE	Nevada Test Site	Underground	37.05575	116.03825	Nevada Test Site	1969-04-30
1468	5.125568513119533	USA	24/04/1969	GOURD-AMBER	Nevada Test Site	Underground	37.05575	116.03825	Nevada Test Site	1969-04-24
1469	4.9	USA	21/03/1969	COFFER	Nevada Test Site	Underground	37.05575	116.03825	Nevada Test Site	1969-03-21
1470	4.6	USA	20/03/1969	BARSAC	Nevada Test Site	Underground	37.05575	116.03825	Nevada Test Site	1969-03-20
1471	5.125568513119533	USA	18/03/1969	CHATTY	Nevada Test Site	Underground	37.05575	116.03825	Nevada Test Site	1969-03-18
1472	5.125568513119533	USA	18/03/1969	VALISE	Nevada Test Site	Underground	37.05575	116.03825	Nevada Test Site	1969-03-18
1473	5.125568513119533	USA	12/02/1969	CYPRESS	Nevada Test Site	Underground	37.05575	116.03825	Nevada Test Site	1969-12-02
1474	5.125568513119533	USA	04/02/1969	NIPPER	Nevada Test Site	Underground	37.05575	116.03825	Nevada Test Site	1969-04-02
1475	5.125568513119533	USA	04/02/1969	WINCH	Nevada Test Site	Underground	37.05575	116.03825	Nevada Test Site	1969-04-02
1476	5.125568513119533	USA	30/01/1969	BIGGIN	Nevada Test Site	Underground	37.05575	116.03825	Nevada Test Site	1969-01-30
1477	4.9	USA	30/01/1969	VISE	Nevada Test Site	Underground	37.05575	116.03825	Nevada Test Site	1969-01-30
1478	5.125568513119533	USA	22/01/1969	SHAVE	Nevada Test Site	Underground	37.05575	116.03825	Nevada Test Site	1969-01-22
1479	5.3	USA	15/01/1969	WINESKIN	Nevada Test Site	Underground	37.05575	116.03825	Nevada Test Site	1969-01-15
1480	5.125568513119533	USA	15/01/1969	PACKARD	Nevada Test Site	Underground	37.05575	116.03825	Nevada Test Site	1969-01-15
1481	6.3	USA	19/12/1968	BENHAM	Nevada Test Site	Underground	37.05575	116.03825	Nevada Test Site	1968-12-19
1482	5.125568513119533	USA	12/12/1968	SCISSORS	Nevada Test Site	Underground	37.05575	116.03825	Nevada Test Site	1968-12-12
1483	5.125568513119533	USA	12/12/1968	TYG-A	Nevada Test Site	Underground	37.05575	116.03825	Nevada Test Site	1968-12-12
1484	5.125568513119533	USA	12/12/1968	BAY LEAF	Nevada Test Site	Underground	37.05575	116.03825	Nevada Test Site	1968-12-12
1485	4.8	USA	08/12/1968	SCHOONER	Nevada Test Site	Underground	37.05575	116.03825	Nevada Test Site	1968-08-12
1486	5.125568513119533	USA	22/11/1968	TINDERBOX	Nevada Test Site	Underground	37.05575	116.03825	Nevada Test Site	1968-11-22
1487	4.9	USA	20/11/1968	MING VASE	Nevada Test Site	Underground	37.05575	116.03825	Nevada Test Site	1968-11-20
1488	5.125568513119533	USA	15/11/1968	KNIFE B	Nevada Test Site	Underground	37.05575	116.03825	Nevada Test Site	1968-11-15
1489	5.125568513119533	USA	15/11/1968	AUGER	Nevada Test Site	Underground	37.05575	116.03825	Nevada Test Site	1968-11-15
1490	5.125568513119533	USA	04/11/1968	CREW-2nd	Nevada Test Site	Underground	37.05575	116.03825	Nevada Test Site	1968-04-11
1491	5.0	USA	04/11/1968	CREW	Nevada Test Site	Underground	37.05575	116.03825	Nevada Test Site	1968-04-11
1492	5.125568513119533	USA	31/10/1968	BIT-A	Nevada Test Site	Underground	37.05575	116.03825	Nevada Test Site	1968-10-31
1493	5.125568513119533	USA	31/10/1968	FILE	Nevada Test Site	Underground	37.05575	116.03825	Nevada Test Site	1968-10-31
1494	5.125568513119533	USA	29/10/1968	HULA	Nevada Test Site	Underground	37.05575	116.03825	Nevada Test Site	1968-10-29
1495	5.125568513119533	USA	10/10/1968	VAT	Nevada Test Site	Underground	37.05575	116.03825	Nevada Test Site	1968-10-10
1496	5.125568513119533	USA	03/10/1968	KNIFE C	Nevada Test Site	Underground	37.05575	116.03825	Nevada Test Site	1968-03-10
1497	5.125568513119533	USA	03/10/1968	WELDER	Nevada Test Site	Underground	37.05575	116.03825	Nevada Test Site	1968-03-10
1498	5.0	USA	24/09/1968	HUDSON SEAL	Nevada Test Site	Underground	37.05575	116.03825	Nevada Test Site	1968-09-24
1499	5.1	USA	17/09/1968	STODDARD	Nevada Test Site	Underground	37.05575	116.03825	Nevada Test Site	1968-09-17
1500	5.8	USA	12/09/1968	KNIFE A	Nevada Test Site	Underground	37.05575	116.03825	Nevada Test Site	1968-12-09
1501	5.6	USA	06/09/1968	NOGGIN	Nevada Test Site	Underground	37.05575	116.03825	Nevada Test Site	1968-06-09
1502	5.9	USA	29/08/1968	SLED	Nevada Test Site	Underground	37.05575	116.03825	Nevada Test Site	1968-08-29
1503	5.125568513119533	USA	27/08/1968	DIANA MOON	Nevada Test Site	Underground	37.05575	116.03825	Nevada Test Site	1968-08-27
1504	5.125568513119533	USA	15/08/1968	RACK	Nevada Test Site	Underground	37.05575	116.03825	Nevada Test Site	1968-08-15
1505	5.125568513119533	USA	09/08/1968	IMP	Nevada Test Site	Underground	37.05575	116.03825	Nevada Test Site	1968-09-08
1506	5.125568513119533	USA	30/07/1968	TANYA	Nevada Test Site	Underground	37.05575	116.03825	Nevada Test Site	1968-07-30
1507	5.125568513119533	USA	17/07/1968	SPUD	Nevada Test Site	Underground	37.05575	116.03825	Nevada Test Site	1968-07-17
1508	5.3	USA	28/06/1968	CHATEAUGAY	Nevada Test Site	Underground	37.05575	116.03825	Nevada Test Site	1968-06-28
1509	5.125568513119533	USA	25/06/1968	SEVILLA	Nevada Test Site	Underground	37.05575	116.03825	Nevada Test Site	1968-06-25
1510	5.125568513119533	USA	25/06/1968	FUNNEL	Nevada Test Site	Underground	37.05575	116.03825	Nevada Test Site	1968-06-25
1511	5.9	USA	15/06/1968	RICKEY	Nevada Test Site	Underground	37.05575	116.03825	Nevada Test Site	1968-06-15
1512	5.125568513119533	USA	06/06/1968	TUB-A	Nevada Test Site	Underground	37.05575	116.03825	Nevada Test Site	1968-06-06
1513	5.125568513119533	USA	05/06/1968	WEMBLEY	Nevada Test Site	Underground	37.05575	116.03825	Nevada Test Site	1968-05-06
1514	5.125568513119533	USA	28/05/1968	ADZE	Nevada Test Site	Underground	37.05575	116.03825	Nevada Test Site	1968-05-28
1515	4.7	USA	17/05/1968	CLARKSMOBILE	Nevada Test Site	Underground	37.05575	116.03825	Nevada Test Site	1968-05-17
1516	5.125568513119533	USA	08/05/1968	CROCK	Nevada Test Site	Underground	37.05575	116.03825	Nevada Test Site	1968-08-05
1517	5.125568513119533	USA	03/05/1968	HATCHET	Nevada Test Site	Underground	37.05575	116.03825	Nevada Test Site	1968-03-05
1518	6.3	USA	26/04/1968	BOXCAR	Nevada Test Site	Underground	37.05575	116.03825	Nevada Test Site	1968-04-26
1519	3.89	USA	23/04/1968	SCROLL	Nevada Test Site	Underground	37.05575	116.03825	Nevada Test Site	1968-04-23
1520	4.9	USA	18/04/1968	SHUFFLE	Nevada Test Site	Underground	37.05575	116.03825	Nevada Test Site	1968-04-18
1521	4.6	USA	10/04/1968	NOOR	Nevada Test Site	Underground	37.05575	116.03825	Nevada Test Site	1968-10-04
1522	5.125568513119533	USA	04/04/1968	BEVEL	Nevada Test Site	Underground	37.05575	116.03825	Nevada Test Site	1968-04-04
1523	5.125568513119533	USA	25/03/1968	MILK SHAKE	Nevada Test Site	Underground	37.05575	116.03825	Nevada Test Site	1968-03-25
1524	5.6	USA	22/03/1968	STINGER	Nevada Test Site	Underground	37.05575	116.03825	Nevada Test Site	1968-03-22
1525	5.125568513119533	USA	14/03/1968	POMMARD	Nevada Test Site	Underground	37.05575	116.03825	Nevada Test Site	1968-03-14
1526	5.125568513119533	USA	12/03/1968	BUGGY-A	Nevada Test Site	Underground	37.05575	116.03825	Nevada Test Site	1968-12-03
1527	5.125568513119533	USA	05/03/1968	RUSSET	Nevada Test Site	Underground	37.05575	116.03825	Nevada Test Site	1968-05-03
1528	5.0	USA	29/02/1968	DORSAL FIN	Nevada Test Site	Underground	37.05575	116.03825	Nevada Test Site	1968-02-29
1529	5.8	USA	21/02/1968	KNOX	Nevada Test Site	Underground	37.05575	116.03825	Nevada Test Site	1968-02-21
1530	5.125568513119533	USA	21/02/1968	TORCH	Nevada Test Site	Underground	37.05575	116.03825	Nevada Test Site	1968-02-21
1531	5.125568513119533	USA	31/01/1968	MALLET	Nevada Test Site	Underground	37.05575	116.03825	Nevada Test Site	1968-01-31
1532	5.125568513119533	USA	26/01/1968	CABRIOLET	Nevada Test Site	Underground	37.05575	116.03825	Nevada Test Site	1968-01-26
1533	5.125568513119533	USA	24/01/1968	BRUSH	Nevada Test Site	Underground	37.05575	116.03825	Nevada Test Site	1968-01-24
1534	6.3	USA	19/01/1968	FAULTLESS	Central Nevada	Underground	38.060229	-117.220892	Central Nevada	1968-01-19
1535	5.125568513119533	USA	19/01/1968	STACCATO	Nevada Test Site	Underground	37.05575	116.03825	Nevada Test Site	1968-01-19
1536	5.125568513119533	USA	18/01/1968	HUPMOBILE	Nevada Test Site	Underground	37.05575	116.03825	Nevada Test Site	1968-01-18
1537	5.125568513119533	USA	15/12/1967	STILT	Nevada Test Site	Underground	37.05575	116.03825	Nevada Test Site	1967-12-15
1538	5.1	USA	10/12/1967	GASBUGGY	Farmington, New Mexico	Underground	36.728058	-108.218686	Farmington, New Mexico	1967-10-12
1539	5.125568513119533	USA	06/12/1967	POLKA	Nevada Test Site	Underground	37.05575	116.03825	Nevada Test Site	1967-06-12
1540	5.1	USA	08/11/1967	COBBLER	Nevada Test Site	Underground	37.05575	116.03825	Nevada Test Site	1967-08-11
1541	5.125568513119533	USA	25/10/1967	WORTH	Nevada Test Site	Underground	37.05575	116.03825	Nevada Test Site	1967-10-25
1542	5.125568513119533	USA	25/10/1967	SAZERAC	Nevada Test Site	Underground	37.05575	116.03825	Nevada Test Site	1967-10-25
1543	5.125568513119533	USA	25/10/1967	COGNAC	Nevada Test Site	Underground	37.05575	116.03825	Nevada Test Site	1967-10-25
1544	5.7	USA	18/10/1967	LANPHER	Nevada Test Site	Underground	37.05575	116.03825	Nevada Test Site	1967-10-18
1545	5.7	USA	27/09/1967	ZAZA	Nevada Test Site	Underground	37.05575	116.03825	Nevada Test Site	1967-09-27
1546	5.125568513119533	USA	21/09/1967	MARVEL	Nevada Test Site	Underground	37.05575	116.03825	Nevada Test Site	1967-09-21
1547	5.125568513119533	USA	15/09/1967	GILROY	Nevada Test Site	Underground	37.05575	116.03825	Nevada Test Site	1967-09-15
1548	5.0	USA	07/09/1967	YARD	Nevada Test Site	Underground	37.05575	116.03825	Nevada Test Site	1967-07-09
1549	5.0	USA	31/08/1967	DOOR MIST	Nevada Test Site	Underground	37.05575	116.03825	Nevada Test Site	1967-08-31
1550	5.125568513119533	USA	24/08/1967	LEXINGTON	Nevada Test Site	Underground	37.05575	116.03825	Nevada Test Site	1967-08-24
1551	4.6	USA	18/08/1967	BORDEAUX	Nevada Test Site	Underground	37.05575	116.03825	Nevada Test Site	1967-08-18
1552	5.125568513119533	USA	10/08/1967	WASHER	Nevada Test Site	Underground	37.05575	116.03825	Nevada Test Site	1967-10-08
1553	5.125568513119533	USA	04/08/1967	GIBSON	Nevada Test Site	Underground	37.05575	116.03825	Nevada Test Site	1967-04-08
1554	5.0	USA	27/07/1967	STANLEY	Nevada Test Site	Underground	37.05575	116.03825	Nevada Test Site	1967-07-27
1555	5.125568513119533	USA	14/07/1967	VITO	Nevada Test Site	Underground	37.05575	116.03825	Nevada Test Site	1967-07-14
1556	4.6	USA	29/06/1967	UMBER	Nevada Test Site	Underground	37.05575	116.03825	Nevada Test Site	1967-06-29
1557	5.1	USA	26/06/1967	MIDI MIST	Nevada Test Site	Underground	37.05575	116.03825	Nevada Test Site	1967-06-26
1558	5.125568513119533	USA	22/06/1967	SWITCH	Nevada Test Site	Underground	37.05575	116.03825	Nevada Test Site	1967-06-22
1559	5.54	USA	26/05/1967	KNICKERBOCKER	Nevada Test Site	Underground	37.05575	116.03825	Nevada Test Site	1967-05-26
1560	5.125568513119533	USA	26/05/1967	ABSINTHE	Nevada Test Site	Underground	37.05575	116.03825	Nevada Test Site	1967-05-26
1561	5.7	USA	23/05/1967	SCOTCH	Nevada Test Site	Underground	37.05575	116.03825	Nevada Test Site	1967-05-23
1562	5.9	USA	20/05/1967	COMMODORE	Nevada Test Site	Underground	37.05575	116.03825	Nevada Test Site	1967-05-20
1563	5.0	USA	10/05/1967	MICKEY	Nevada Test Site	Underground	37.05575	116.03825	Nevada Test Site	1967-10-05
1564	3.8	USA	27/04/1967	EFFENDI	Nevada Test Site	Underground	37.05575	116.03825	Nevada Test Site	1967-04-27
1565	4.3	USA	21/04/1967	CHOCOLATE	Nevada Test Site	Underground	37.05575	116.03825	Nevada Test Site	1967-04-21
1566	3.9	USA	07/04/1967	FAWN	Nevada Test Site	Underground	37.05575	116.03825	Nevada Test Site	1967-07-04
1567	5.125568513119533	USA	06/04/1967	HEILMAN	Nevada Test Site	Underground	37.05575	116.03825	Nevada Test Site	1967-06-04
1568	5.125568513119533	USA	04/04/1967	OAKLAND	Nevada Test Site	Underground	37.05575	116.03825	Nevada Test Site	1967-04-04
1569	5.125568513119533	USA	10/03/1967	FIZZ	Nevada Test Site	Underground	37.05575	116.03825	Nevada Test Site	1967-10-03
1570	5.125568513119533	USA	03/03/1967	MUSHROOM	Nevada Test Site	Underground	37.05575	116.03825	Nevada Test Site	1967-03-03
1571	4.2	USA	02/03/1967	RIVET III	Nevada Test Site	Underground	37.05575	116.03825	Nevada Test Site	1967-02-03
1572	5.8	USA	23/02/1967	AGILE	Nevada Test Site	Underground	37.05575	116.03825	Nevada Test Site	1967-02-23
1573	4.4	USA	23/02/1967	PERSIMMON	Nevada Test Site	Underground	37.05575	116.03825	Nevada Test Site	1967-02-23
1574	4.8	USA	08/02/1967	WARD	Nevada Test Site	Underground	37.05575	116.03825	Nevada Test Site	1967-08-02
1575	5.125568513119533	USA	26/01/1967	RIVET II	Nevada Test Site	Underground	37.05575	116.03825	Nevada Test Site	1967-01-26
1576	5.3	USA	20/01/1967	BOURBON	Nevada Test Site	Underground	37.05575	116.03825	Nevada Test Site	1967-01-20
1577	5.4	USA	19/01/1967	NASH	Nevada Test Site	Underground	37.05575	116.03825	Nevada Test Site	1967-01-19
1578	5.125568513119533	USA	18/01/1967	RIVET I	Nevada Test Site	Underground	37.05575	116.03825	Nevada Test Site	1967-01-18
1579	6.3	USA	20/12/1966	GREELEY	Nevada Test Site	Underground	37.05575	116.03825	Nevada Test Site	1966-12-20
1580	4.6	USA	13/12/1966	NEW POINT	Nevada Test Site	Underground	37.05575	116.03825	Nevada Test Site	1966-12-13
1581	5.125568513119533	USA	13/12/1966	SIDECAR	Nevada Test Site	Underground	37.05575	116.03825	Nevada Test Site	1966-12-13
1582	5.125568513119533	USA	03/12/1966	STERLING	Hattiesburg, Mississippi	Underground	31.327119	-89.290339	Hattiesburg, Mississippi	1966-03-12
1583	5.125568513119533	USA	22/11/1966	VIGIL	Nevada Test Site	Underground	37.05575	116.03825	Nevada Test Site	1966-11-22
1584	5.125568513119533	USA	18/11/1966	CERISE	Nevada Test Site	Underground	37.05575	116.03825	Nevada Test Site	1966-11-18
1585	5.125568513119533	USA	11/11/1966	AJAX	Nevada Test Site	Underground	37.05575	116.03825	Nevada Test Site	1966-11-11
1586	5.125568513119533	USA	05/11/1966	SIMMS	Nevada Test Site	Underground	37.05575	116.03825	Nevada Test Site	1966-05-11
1587	5.125568513119533	USA	15/10/1966	KHAKI	Nevada Test Site	Underground	37.05575	116.03825	Nevada Test Site	1966-10-15
1588	4.1	USA	29/09/1966	NEWARK	Nevada Test Site	Underground	37.05575	116.03825	Nevada Test Site	1966-09-29
1589	5.125568513119533	USA	23/09/1966	DAIQUIRI	Nevada Test Site	Underground	37.05575	116.03825	Nevada Test Site	1966-09-23
1590	4.6	USA	12/09/1966	DERRINGER	Nevada Test Site	Underground	37.05575	116.03825	Nevada Test Site	1966-12-09
1591	5.125568513119533	USA	12/08/1966	TANGERINE	Nevada Test Site	Underground	37.05575	116.03825	Nevada Test Site	1966-12-08
1592	5.125568513119533	USA	10/08/1966	ROVENA	Nevada Test Site	Underground	37.05575	116.03825	Nevada Test Site	1966-10-08
1593	5.125568513119533	USA	28/07/1966	SAXON	Nevada Test Site	Underground	37.05575	116.03825	Nevada Test Site	1966-07-28
1594	6.1	USA	30/06/1966	HALFBEAK	Nevada Test Site	Underground	37.05575	116.03825	Nevada Test Site	1966-06-30
1595	5.125568513119533	USA	25/06/1966	VULCAN	Nevada Test Site	Underground	37.05575	116.03825	Nevada Test Site	1966-06-25
1596	5.125568513119533	USA	15/06/1966	KANKAKEE	Nevada Test Site	Underground	37.05575	116.03825	Nevada Test Site	1966-06-15
1597	5.125568513119533	USA	15/06/1966	DOUBLE PLAY	Nevada Test Site	Underground	37.05575	116.03825	Nevada Test Site	1966-06-15
1598	5.125568513119533	USA	10/06/1966	PUCE	Nevada Test Site	Underground	37.05575	116.03825	Nevada Test Site	1966-10-06
1599	5.7	USA	03/06/1966	TAN	Nevada Test Site	Underground	37.05575	116.03825	Nevada Test Site	1966-03-06
1600	5.6	USA	02/06/1966	PILE DRIVER	Nevada Test Site	Underground	37.05575	116.03825	Nevada Test Site	1966-02-06
1601	5.1	USA	27/05/1966	DISCUS THROWER	Nevada Test Site	Underground	37.05575	116.03825	Nevada Test Site	1966-05-27
1602	5.9	USA	19/05/1966	DUMONT	Nevada Test Site	Underground	37.05575	116.03825	Nevada Test Site	1966-05-19
1603	5.6	USA	13/05/1966	PIRANHA	Nevada Test Site	Underground	37.05575	116.03825	Nevada Test Site	1966-05-13
1604	4.3	USA	12/05/1966	TAPESTRY	Nevada Test Site	Underground	37.05575	116.03825	Nevada Test Site	1966-12-05
1605	5.5	USA	06/05/1966	CHARTREUSE	Nevada Test Site	Underground	37.05575	116.03825	Nevada Test Site	1966-06-05
1606	4.4	USA	05/05/1966	CYCLAMEN	Nevada Test Site	Underground	37.05575	116.03825	Nevada Test Site	1966-05-05
1607	5.5	USA	04/05/1966	TRAVELER	Nevada Test Site	Underground	37.05575	116.03825	Nevada Test Site	1966-04-05
1608	5.125568513119533	USA	29/04/1966	OCHRE	Nevada Test Site	Underground	37.05575	116.03825	Nevada Test Site	1966-04-29
1609	4.51	USA	25/04/1966	PIN STRIPE	Nevada Test Site	Underground	37.05575	116.03825	Nevada Test Site	1966-04-25
1610	5.125568513119533	USA	23/04/1966	FENTON	Nevada Test Site	Underground	37.05575	116.03825	Nevada Test Site	1966-04-23
1611	5.4	USA	14/04/1966	DURYEA	Nevada Test Site	Underground	37.05575	116.03825	Nevada Test Site	1966-04-14
1612	5.125568513119533	USA	07/04/1966	TOMATO	Nevada Test Site	Underground	37.05575	116.03825	Nevada Test Site	1966-07-04
1613	4.45	USA	06/04/1966	STUTZ	Nevada Test Site	Underground	37.05575	116.03825	Nevada Test Site	1966-06-04
1614	5.125568513119533	USA	01/04/1966	LIME	Nevada Test Site	Underground	37.05575	116.03825	Nevada Test Site	1966-01-04
1615	5.125568513119533	USA	24/03/1966	TEMPLAR	Nevada Test Site	Underground	37.05575	116.03825	Nevada Test Site	1966-03-24
1616	5.125568513119533	USA	18/03/1966	PURPLE	Nevada Test Site	Underground	37.05575	116.03825	Nevada Test Site	1966-03-18
1617	5.125568513119533	USA	12/03/1966	CLYMER	Nevada Test Site	Underground	37.05575	116.03825	Nevada Test Site	1966-12-03
1618	5.125568513119533	USA	07/03/1966	FINFOOT	Nevada Test Site	Underground	37.05575	116.03825	Nevada Test Site	1966-07-03
1619	4.11	USA	05/03/1966	RED HOT	Nevada Test Site	Underground	37.05575	116.03825	Nevada Test Site	1966-05-03
1620	5.0	USA	24/02/1966	REX	Nevada Test Site	Underground	37.05575	116.03825	Nevada Test Site	1966-02-24
1621	4.3	USA	03/02/1966	PLAID II	Nevada Test Site	Underground	37.05575	116.03825	Nevada Test Site	1966-03-02
1622	5.125568513119533	USA	22/01/1966	REO	Nevada Test Site	Underground	37.05575	116.03825	Nevada Test Site	1966-01-22
1623	5.125568513119533	USA	21/01/1966	DOVEKIE	Nevada Test Site	Underground	37.05575	116.03825	Nevada Test Site	1966-01-21
1624	5.125568513119533	USA	18/01/1966	SIENNA	Nevada Test Site	Underground	37.05575	116.03825	Nevada Test Site	1966-01-18
1625	5.2	USA	18/01/1966	LAMPBLACK	Nevada Test Site	Underground	37.05575	116.03825	Nevada Test Site	1966-01-18
1626	5.125568513119533	USA	13/01/1966	MAXWELL	Nevada Test Site	Underground	37.05575	116.03825	Nevada Test Site	1966-01-13
1627	5.3	USA	16/12/1965	BUFF	Nevada Test Site	Underground	37.05575	116.03825	Nevada Test Site	1965-12-16
1628	5.125568513119533	USA	16/12/1965	EMERSON	Nevada Test Site	Underground	37.05575	116.03825	Nevada Test Site	1965-12-16
1629	5.62	USA	03/12/1965	CORDUROY	Nevada Test Site	Underground	37.05575	116.03825	Nevada Test Site	1965-03-12
1630	5.125568513119533	USA	23/11/1965	KERMET	Nevada Test Site	Underground	37.05575	116.03825	Nevada Test Site	1965-11-23
1631	5.125568513119533	USA	12/11/1965	SEPIA	Nevada Test Site	Underground	37.05575	116.03825	Nevada Test Site	1965-12-11
1632	6.1	USA	29/10/1965	LONG SHOT	Amchitka, Alaska	Underground	51.424	179.179	Amchitka, Alaska	1965-10-29
1633	5.125568513119533	USA	17/09/1965	ELKHART	Nevada Test Site	Underground	37.05575	116.03825	Nevada Test Site	1965-09-17
1634	5.125568513119533	USA	10/09/1965	CHARCOAL	Nevada Test Site	Underground	37.05575	116.03825	Nevada Test Site	1965-10-09
1635	4.2	USA	01/09/1965	MOA	Nevada Test Site	Underground	37.05575	116.03825	Nevada Test Site	1965-01-09
1636	5.125568513119533	USA	27/08/1965	CENTAUR	Nevada Test Site	Underground	37.05575	116.03825	Nevada Test Site	1965-08-27
1637	5.125568513119533	USA	21/08/1965	TICKING	Nevada Test Site	Underground	37.05575	116.03825	Nevada Test Site	1965-08-21
1638	5.125568513119533	USA	06/08/1965	MAUVE	Nevada Test Site	Underground	37.05575	116.03825	Nevada Test Site	1965-06-08
1639	5.4	USA	23/07/1965	BRONZE	Nevada Test Site	Underground	37.05575	116.03825	Nevada Test Site	1965-07-23
1640	5.125568513119533	USA	22/07/1965	PONGEE	Nevada Test Site	Underground	37.05575	116.03825	Nevada Test Site	1965-07-22
1641	5.125568513119533	USA	16/07/1965	IZZER	Nevada Test Site	Underground	37.05575	116.03825	Nevada Test Site	1965-07-16
1642	5.125568513119533	USA	17/06/1965	TINY TOT	Nevada Test Site	Underground	37.05575	116.03825	Nevada Test Site	1965-06-17
1643	4.48	USA	16/06/1965	DILUTED WATERS	Nevada Test Site	Underground	37.05575	116.03825	Nevada Test Site	1965-06-16
1644	5.125568513119533	USA	11/06/1965	ORGANDY	Nevada Test Site	Underground	37.05575	116.03825	Nevada Test Site	1965-11-06
1645	5.125568513119533	USA	11/06/1965	PETREL	Nevada Test Site	Underground	37.05575	116.03825	Nevada Test Site	1965-11-06
1646	5.125568513119533	USA	21/05/1965	TWEED	Nevada Test Site	Underground	37.05575	116.03825	Nevada Test Site	1965-05-21
1647	5.125568513119533	USA	14/05/1965	SCAUP	Nevada Test Site	Underground	37.05575	116.03825	Nevada Test Site	1965-05-14
1648	5.125568513119533	USA	14/05/1965	CAMBRIC	Nevada Test Site	Underground	37.05575	116.03825	Nevada Test Site	1965-05-14
1649	5.125568513119533	USA	12/05/1965	BUTEO	Nevada Test Site	Underground	37.05575	116.03825	Nevada Test Site	1965-12-05
1650	5.125568513119533	USA	07/05/1965	TEE	Nevada Test Site	Underground	37.05575	116.03825	Nevada Test Site	1965-07-05
1651	5.125568513119533	USA	23/04/1965	MUSCOVY	Nevada Test Site	Underground	37.05575	116.03825	Nevada Test Site	1965-04-23
1652	5.125568513119533	USA	22/04/1965	CHENILLE	Nevada Test Site	Underground	37.05575	116.03825	Nevada Test Site	1965-04-22
1653	5.0	USA	21/04/1965	GUM DROP	Nevada Test Site	Underground	37.05575	116.03825	Nevada Test Site	1965-04-21
1654	4.33	USA	14/04/1965	PALANQUIN	Nevada Test Site	Underground	37.05575	116.03825	Nevada Test Site	1965-04-14
1655	5.125568513119533	USA	05/04/1965	KESTREL	Nevada Test Site	Underground	37.05575	116.03825	Nevada Test Site	1965-05-04
1656	5.25	USA	26/03/1965	CUP	Nevada Test Site	Underground	37.05575	116.03825	Nevada Test Site	1965-03-26
1657	5.125568513119533	USA	20/03/1965	SUEDE	Nevada Test Site	Underground	37.05575	116.03825	Nevada Test Site	1965-03-20
1658	5.33	USA	03/03/1965	WAGTAIL	Nevada Test Site	Underground	37.05575	116.03825	Nevada Test Site	1965-03-03
1659	5.125568513119533	USA	19/02/1965	SEERSUCKER	Nevada Test Site	Underground	37.05575	116.03825	Nevada Test Site	1965-02-19
1660	4.54	USA	18/02/1965	WISHBONE	Nevada Test Site	Underground	37.05575	116.03825	Nevada Test Site	1965-02-18
1661	5.125568513119533	USA	16/02/1965	MERLIN	Nevada Test Site	Underground	37.05575	116.03825	Nevada Test Site	1965-02-16
1662	5.125568513119533	USA	12/02/1965	ALPACA	Nevada Test Site	Underground	37.05575	116.03825	Nevada Test Site	1965-12-02
1663	5.125568513119533	USA	04/02/1965	CASHMERE	Nevada Test Site	Underground	37.05575	116.03825	Nevada Test Site	1965-04-02
1664	5.125568513119533	USA	29/01/1965	TERN	Nevada Test Site	Underground	37.05575	116.03825	Nevada Test Site	1965-01-29
1665	5.125568513119533	USA	14/01/1965	WOOL	Nevada Test Site	Underground	37.05575	116.03825	Nevada Test Site	1965-01-14
1666	5.125568513119533	USA	18/12/1964	SULKY	Nevada Test Site	Underground	37.05575	116.03825	Nevada Test Site	1964-12-18
1667	5.125568513119533	USA	16/12/1964	MUDPACK	Nevada Test Site	Underground	37.05575	116.03825	Nevada Test Site	1964-12-16
1668	5.125568513119533	USA	16/12/1964	PARROT	Nevada Test Site	Underground	37.05575	116.03825	Nevada Test Site	1964-12-16
1669	5.125568513119533	USA	16/12/1964	CASSOWARY	Nevada Test Site	Underground	37.05575	116.03825	Nevada Test Site	1964-12-16
1670	5.125568513119533	USA	05/12/1964	DRILL SOURCE (lower)	Nevada Test Site	Underground	37.05575	116.03825	Nevada Test Site	1964-05-12
1671	4.8	USA	05/12/1964	CREPE	Nevada Test Site	Underground	37.134	116.071	Nevada Test Site	1964-05-12
1672	4.8	USA	05/11/1964	HANDCAR	Nevada Test Site	Underground	37.05575	116.03825	Nevada Test Site	1964-05-11
1673	5.125568513119533	USA	31/10/1964	FOREST	Nevada Test Site	Underground	37.05575	116.03825	Nevada Test Site	1964-10-31
1674	5.125568513119533	USA	23/10/1964	GARDEN	Nevada Test Site	Underground	37.05575	116.03825	Nevada Test Site	1964-10-23
1675	4.6	USA	22/10/1964	SALMON	Hattiesburg, Mississippi	Underground	31.327119	-89.290339	Hattiesburg, Mississippi	1964-10-22
1676	5.125568513119533	USA	16/10/1964	BARBEL	Nevada Test Site	Underground	37.05575	116.03825	Nevada Test Site	1964-10-16
1677	4.8	USA	09/10/1964	PAR	Nevada Test Site	Underground	37.05575	116.03825	Nevada Test Site	1964-09-10
1678	4.89	USA	02/10/1964	AUK	Nevada Test Site	Underground	37.05575	116.03825	Nevada Test Site	1964-02-10
1679	5.125568513119533	USA	25/09/1964	COURSER	Nevada Test Site	Underground	37.05575	116.03825	Nevada Test Site	1964-09-25
1680	5.125568513119533	USA	11/09/1964	SPOON	Nevada Test Site	Underground	37.05575	116.03825	Nevada Test Site	1964-11-09
1681	5.125568513119533	USA	04/09/1964	GUANAY	Nevada Test Site	Underground	37.05575	116.03825	Nevada Test Site	1964-04-09
1682	5.125568513119533	USA	28/08/1964	HADDOCK	Nevada Test Site	Underground	37.05575	116.03825	Nevada Test Site	1964-08-28
1683	5.125568513119533	USA	27/08/1964	PLAYER	Nevada Test Site	Underground	37.05575	116.03825	Nevada Test Site	1964-08-27
1684	5.125568513119533	USA	22/08/1964	CANVASBACK	Nevada Test Site	Underground	37.05575	116.03825	Nevada Test Site	1964-08-22
1685	5.125568513119533	USA	19/08/1964	ALVA	Nevada Test Site	Underground	37.05575	116.03825	Nevada Test Site	1964-08-19
1686	5.125568513119533	USA	24/07/1964	TROGON	Nevada Test Site	Underground	37.05575	116.03825	Nevada Test Site	1964-07-24
1687	5.125568513119533	USA	23/07/1964	LINKS	Nevada Test Site	Underground	37.05575	116.03825	Nevada Test Site	1964-07-23
1688	5.125568513119533	USA	17/07/1964	CORMORANT	Nevada Test Site	Underground	37.05575	116.03825	Nevada Test Site	1964-07-17
1689	5.125568513119533	USA	16/07/1964	BYE	Nevada Test Site	Underground	37.05575	116.03825	Nevada Test Site	1964-07-16
1690	5.125568513119533	USA	30/06/1964	DUB	Nevada Test Site	Underground	37.05575	116.03825	Nevada Test Site	1964-06-30
1691	5.125568513119533	USA	25/06/1964	FADE	Nevada Test Site	Underground	37.05575	116.03825	Nevada Test Site	1964-06-25
1692	5.125568513119533	USA	18/06/1964	DUFFER	Nevada Test Site	Underground	37.05575	116.03825	Nevada Test Site	1964-06-18
1693	5.125568513119533	USA	12/06/1964	BITTERLING	Nevada Test Site	Underground	37.05575	116.03825	Nevada Test Site	1964-12-06
1694	5.125568513119533	USA	11/06/1964	ACE	Nevada Test Site	Underground	37.05575	116.03825	Nevada Test Site	1964-11-06
1695	5.125568513119533	USA	15/05/1964	MINNOW	Nevada Test Site	Underground	37.05575	116.03825	Nevada Test Site	1964-05-15
1696	5.125568513119533	USA	14/05/1964	BACKSWING	Nevada Test Site	Underground	37.05575	116.03825	Nevada Test Site	1964-05-14
1697	5.125568513119533	USA	07/05/1964	DRIVER	Nevada Test Site	Underground	37.05575	116.03825	Nevada Test Site	1964-07-05
1698	4.1	USA	29/04/1964	PIPEFISH	Nevada Test Site	Underground	37.05575	116.03825	Nevada Test Site	1964-04-29
1699	5.2	USA	24/04/1964	TURF	Nevada Test Site	Underground	37.05575	116.03825	Nevada Test Site	1964-04-24
1700	5.125568513119533	USA	17/04/1964	BOGEY	Nevada Test Site	Underground	37.05575	116.03825	Nevada Test Site	1964-04-17
1701	5.125568513119533	USA	15/04/1964	STURGEON	Nevada Test Site	Underground	37.05575	116.03825	Nevada Test Site	1964-04-15
1702	5.125568513119533	USA	14/04/1964	HOOK	Nevada Test Site	Underground	37.05575	116.03825	Nevada Test Site	1964-04-14
1703	5.125568513119533	USA	13/03/1964	PIKE	Nevada Test Site	Underground	37.05575	116.03825	Nevada Test Site	1964-03-13
1704	5.125568513119533	USA	12/03/1964	HANDICAP	Nevada Test Site	Underground	37.05575	116.03825	Nevada Test Site	1964-12-03
1705	5.1	USA	20/02/1964	KLICKITAT	Nevada Test Site	Underground	37.05575	116.03825	Nevada Test Site	1964-02-20
1706	5.125568513119533	USA	18/02/1964	MACKEREL	Nevada Test Site	Underground	37.05575	116.03825	Nevada Test Site	1964-02-18
1707	5.125568513119533	USA	18/02/1964	BONEFISH	Nevada Test Site	Underground	37.05575	116.03825	Nevada Test Site	1964-02-18
1708	5.125568513119533	USA	13/02/1964	BUNKER	Nevada Test Site	Underground	37.05575	116.03825	Nevada Test Site	1964-02-13
1709	5.125568513119533	USA	12/02/1964	SOLENDON	Nevada Test Site	Underground	37.05575	116.03825	Nevada Test Site	1964-12-02
1710	5.125568513119533	USA	30/01/1964	CLUB	Nevada Test Site	Underground	37.05575	116.03825	Nevada Test Site	1964-01-30
1711	4.2	USA	23/01/1964	OCONTO	Nevada Test Site	Underground	37.05575	116.03825	Nevada Test Site	1964-01-23
1712	5.2	USA	16/01/1964	FORE	Nevada Test Site	Underground	37.05575	116.03825	Nevada Test Site	1964-01-16
1713	5.125568513119533	USA	20/12/1963	TUNA	Nevada Test Site	Underground	37.05575	116.03825	Nevada Test Site	1963-12-20
1714	5.125568513119533	USA	12/12/1963	EAGLE	Nevada Test Site	Underground	37.05575	116.03825	Nevada Test Site	1963-12-12
1715	5.125568513119533	USA	04/12/1963	BARRACUDA	Nevada Test Site	Underground	37.05575	116.03825	Nevada Test Site	1963-04-12
1716	5.125568513119533	USA	22/11/1963	GREYS	Nevada Test Site	Underground	37.05575	116.03825	Nevada Test Site	1963-11-22
1717	5.125568513119533	USA	15/11/1963	MUSTANG	Nevada Test Site	Underground	37.05575	116.03825	Nevada Test Site	1963-11-15
1718	5.125568513119533	USA	14/11/1963	ANCHOVY	Nevada Test Site	Underground	37.05575	116.03825	Nevada Test Site	1963-11-14
1719	4.9	USA	26/10/1963	SHOAL	Fallon, Nevada	Underground	39.474869	-118.777041	Fallon, Nevada	1963-10-26
1720	5.125568513119533	USA	17/10/1963	MULLET	Nevada Test Site	Underground	37.05575	116.03825	Nevada Test Site	1963-10-17
1721	5.3	USA	16/10/1963	CLEARWATER	Nevada Test Site	Underground	37.05575	116.03825	Nevada Test Site	1963-10-16
1722	5.125568513119533	USA	11/10/1963	TORNILLO	Nevada Test Site	Underground	37.05575	116.03825	Nevada Test Site	1963-11-10
1723	5.125568513119533	USA	11/10/1963	GRUNION	Nevada Test Site	Underground	37.05575	116.03825	Nevada Test Site	1963-11-10
1724	5.125568513119533	USA	27/09/1963	NARRAGUAGUS	Nevada Test Site	Underground	37.05575	116.03825	Nevada Test Site	1963-09-27
1725	5.125568513119533	USA	27/09/1963	CARP	Nevada Test Site	Underground	37.05575	116.03825	Nevada Test Site	1963-09-27
1726	5.8	USA	13/09/1963	BILBY	Nevada Test Site	Underground	37.05575	116.03825	Nevada Test Site	1963-09-13
1727	5.125568513119533	USA	13/09/1963	AHTANUM	Nevada Test Site	Underground	37.05575	116.03825	Nevada Test Site	1963-09-13
1728	5.125568513119533	USA	23/08/1963	KOHOCTON	Nevada Test Site	Underground	37.05575	116.03825	Nevada Test Site	1963-08-23
1729	5.125568513119533	USA	15/08/1963	SATSOP	Nevada Test Site	Underground	37.05575	116.03825	Nevada Test Site	1963-08-15
1730	5.125568513119533	USA	12/08/1963	PEKAN	Nevada Test Site	Underground	37.05575	116.03825	Nevada Test Site	1963-12-08
1731	5.125568513119533	USA	25/06/1963	KENNEBEC	Nevada Test Site	Underground	37.05575	116.03825	Nevada Test Site	1963-06-25
1732	5.125568513119533	USA	14/06/1963	MATACO	Nevada Test Site	Underground	37.05575	116.03825	Nevada Test Site	1963-06-14
1733	5.125568513119533	USA	09/06/1963	Clean Slate III	Nellis Air Force Range	Atmospheric	36.308119	-115.049367	Nellis Air Force Range	1963-09-06
1734	5.125568513119533	USA	06/06/1963	APSHAPA	Nevada Test Site	Underground	37.05575	116.03825	Nevada Test Site	1963-06-06
1735	5.125568513119533	USA	06/06/1963	HUTIA	Nevada Test Site	Underground	37.05575	116.03825	Nevada Test Site	1963-06-06
1736	4.36	USA	05/06/1963	YUBA	Nevada Test Site	Underground	37.05575	116.03825	Nevada Test Site	1963-05-06
1737	5.125568513119533	USA	31/05/1963	Clean Slate II	Nellis Air Force Range	Atmospheric	36.308119	-115.049367	Nellis Air Force Range	1963-05-31
1738	5.125568513119533	USA	29/05/1963	PLEASANT	Nevada Test Site	Underground	37.05575	116.03825	Nevada Test Site	1963-05-29
1739	5.125568513119533	USA	25/05/1963	Clean Slate I	Nellis Air Force Range	Atmospheric	36.308119	-115.049367	Nellis Air Force Range	1963-05-25
1740	4.84	USA	22/05/1963	STONES	Nevada Test Site	Underground	37.05575	116.03825	Nevada Test Site	1963-05-22
1741	5.125568513119533	USA	17/05/1963	HARKEE	Nevada Test Site	Underground	37.05575	116.03825	Nevada Test Site	1963-05-17
1742	5.125568513119533	USA	17/05/1963	TEJON	Nevada Test Site	Underground	37.05575	116.03825	Nevada Test Site	1963-05-17
1743	5.125568513119533	USA	15/05/1963	Double Tracks	Nellis Air Force Range	Atmospheric	36.308119	-115.049367	Nellis Air Force Range	1963-05-15
1744	5.125568513119533	USA	09/05/1963	GUNDI PRIME	Nevada Test Site	Underground	37.05575	116.03825	Nevada Test Site	1963-09-05
1745	5.125568513119533	USA	24/04/1963	PAISANO	Nevada Test Site	Underground	37.05575	116.03825	Nevada Test Site	1963-04-24
1746	5.125568513119533	USA	24/04/1963	KOOTANAI	Nevada Test Site	Underground	37.05575	116.03825	Nevada Test Site	1963-04-24
1747	5.125568513119533	USA	11/04/1963	CUMBERLAND	Nevada Test Site	Underground	37.05575	116.03825	Nevada Test Site	1963-11-04
1748	5.125568513119533	USA	10/04/1963	COYPU	Nevada Test Site	Underground	37.05575	116.03825	Nevada Test Site	1963-10-04
1749	5.125568513119533	USA	05/04/1963	FERRET PRIME	Nevada Test Site	Underground	37.05575	116.03825	Nevada Test Site	1963-05-04
1750	5.125568513119533	USA	29/03/1963	GERBIL	Nevada Test Site	Underground	37.05575	116.03825	Nevada Test Site	1963-03-29
1751	5.125568513119533	USA	15/03/1963	TOYAH	Nevada Test Site	Underground	37.05575	116.03825	Nevada Test Site	1963-03-15
1752	5.125568513119533	USA	01/03/1963	JERBOA	Nevada Test Site	Underground	37.05575	116.03825	Nevada Test Site	1963-01-03
1753	5.125568513119533	USA	21/02/1963	CARMEL	Nevada Test Site	Underground	37.05575	116.03825	Nevada Test Site	1963-02-21
1754	5.125568513119533	USA	21/02/1963	KAWEAH	Nevada Test Site	Underground	37.05575	116.03825	Nevada Test Site	1963-02-21
1755	5.125568513119533	USA	15/02/1963	CHIPMUNK	Nevada Test Site	Underground	37.05575	116.03825	Nevada Test Site	1963-02-15
1756	5.125568513119533	USA	08/02/1963	FERRET	Nevada Test Site	Underground	37.05575	116.03825	Nevada Test Site	1963-08-02
1757	5.125568513119533	USA	08/02/1963	ACUSHI	Nevada Test Site	Underground	37.05575	116.03825	Nevada Test Site	1963-08-02
1758	5.125568513119533	USA	08/02/1963	HATCHIE	Nevada Test Site	Underground	37.05575	116.03825	Nevada Test Site	1963-08-02
1759	5.125568513119533	USA	08/02/1963	CASSELMAN	Nevada Test Site	Underground	37.05575	116.03825	Nevada Test Site	1963-08-02
1760	5.125568513119533	USA	14/12/1962	MANATEE	Nevada Test Site	Underground	37.05575	116.03825	Nevada Test Site	1962-12-14
1761	5.125568513119533	USA	12/12/1962	NUMBAT	Nevada Test Site	Underground	37.05575	116.03825	Nevada Test Site	1962-12-12
1762	5.125568513119533	USA	12/12/1962	MADISON	Nevada Test Site	Underground	37.05575	116.03825	Nevada Test Site	1962-12-12
1763	5.125568513119533	USA	07/12/1962	TENDRAC	Nevada Test Site	Underground	37.05575	116.03825	Nevada Test Site	1962-07-12
1764	5.125568513119533	USA	04/12/1962	TAUNTON	Nevada Test Site	Underground	37.05575	116.03825	Nevada Test Site	1962-04-12
1765	5.125568513119533	USA	27/11/1962	ANACOSTIA	Nevada Test Site	Underground	37.05575	116.03825	Nevada Test Site	1962-11-27
1766	5.125568513119533	USA	15/11/1962	GUNDI	Nevada Test Site	Underground	37.05575	116.03825	Nevada Test Site	1962-11-15
1767	5.125568513119533	USA	09/11/1962	ST. LAWRENCE	Nevada Test Site	Underground	37.05575	116.03825	Nevada Test Site	1962-09-11
1768	5.125568513119533	USA	04/11/1962	Tightrope	Johnston Island	Atmospheric	16.729503	-169.533648	Johnston Island	1962-04-11
1769	5.125568513119533	USA	01/11/1962	Kingfish	Johnston Island	Atmospheric	16.729503	-169.533648	Johnston Island	1962-01-11
1770	5.125568513119533	USA	30/10/1962	Housatonic	Johnston Island	Atmospheric	16.729503	-169.533648	Johnston Island	1962-10-30
1771	5.125568513119533	USA	27/10/1962	SANTEE	Nevada Test Site	Underground	37.05575	116.03825	Nevada Test Site	1962-10-27
1772	5.125568513119533	USA	27/10/1962	Calamity	Johnston Island	Atmospheric	16.729503	-169.533648	Johnston Island	1962-10-27
1773	5.125568513119533	USA	26/10/1962	Bluegill 3 Prim	Johnston Island	Atmospheric	16.729503	-169.533648	Johnston Island	1962-10-26
1774	5.125568513119533	USA	20/10/1962	Checkmate	Johnston Island	Atmospheric	16.729503	-169.533648	Johnston Island	1962-10-20
1775	5.125568513119533	USA	19/10/1962	BANDICOOT	Nevada Test Site	Underground	37.05575	116.03825	Nevada Test Site	1962-10-19
1776	5.125568513119533	USA	18/10/1962	TIOGA	Nevada Test Site	Underground	37.05575	116.03825	Nevada Test Site	1962-10-18
1777	5.125568513119533	USA	18/10/1962	Chama	Johnston Island	Atmospheric	16.729503	-169.533648	Johnston Island	1962-10-18
1778	5.125568513119533	USA	12/10/1962	WOLVERINE	Nevada Test Site	Underground	37.05575	116.03825	Nevada Test Site	1962-12-10
1779	5.125568513119533	USA	12/10/1962	ROANOKE	Nevada Test Site	Underground	37.05575	116.03825	Nevada Test Site	1962-12-10
1780	5.125568513119533	USA	06/10/1962	Bumping	Johnston Island	Atmospheric	16.729503	-169.533648	Johnston Island	1962-06-10
1781	5.06	USA	05/10/1962	MISSISSIPPI	Nevada Test Site	Underground	37.05575	116.03825	Nevada Test Site	1962-05-10
1782	5.125568513119533	USA	02/10/1962	Androscoggin	Johnston Island	Atmospheric	16.729503	-169.533648	Johnston Island	1962-02-10
1783	5.125568513119533	USA	29/09/1962	ALLEGHENY	Nevada Test Site	Underground	37.05575	116.03825	Nevada Test Site	1962-09-29
1784	5.125568513119533	USA	20/09/1962	PEBA	Nevada Test Site	Underground	37.05575	116.03825	Nevada Test Site	1962-09-20
1785	4.4	USA	14/09/1962	HYRAX	Nevada Test Site	Underground	37.05575	116.03825	Nevada Test Site	1962-09-14
1786	5.125568513119533	USA	06/09/1962	RARITAN	Nevada Test Site	Underground	37.05575	116.03825	Nevada Test Site	1962-06-09
1787	4.2	USA	24/08/1962	BOBAC	Nevada Test Site	Underground	37.05575	116.03825	Nevada Test Site	1962-08-24
1788	4.4	USA	24/08/1962	YORK	Nevada Test Site	Underground	37.05575	116.03825	Nevada Test Site	1962-08-24
1789	4.3	USA	27/07/1962	WICHITA	Nevada Test Site	Underground	37.05575	116.03825	Nevada Test Site	1962-07-27
1790	5.125568513119533	USA	17/07/1962	Little Feller I	Nevada Test Site	Atmospheric	37.05575	116.03825	Nevada Test Site	1962-07-17
1791	3.7	USA	14/07/1962	Small Boy	Nevada Test Site	Atmospheric	37.05575	116.03825	Nevada Test Site	1962-07-14
1792	4.4	USA	13/07/1962	MERRIMAC	Nevada Test Site	Underground	37.05575	116.03825	Nevada Test Site	1962-07-13
1793	5.125568513119533	USA	11/07/1962	JOHNNIE BOY	Nevada Test Site	Underground	37.05575	116.03825	Nevada Test Site	1962-11-07
1794	5.125568513119533	USA	11/07/1962	Pamlico	Christmas Island (USA)	Atmospheric	-10.451208	105.688545	Christmas Island (USA)	1962-11-07
1795	5.125568513119533	USA	10/07/1962	Sunset	Christmas Island (USA)	Atmospheric	-10.451208	105.688545	Christmas Island (USA)	1962-10-07
1796	5.125568513119533	USA	09/07/1962	Starfish Prime	Johnston Island	Atmospheric	16.729503	-169.533648	Johnston Island	1962-09-07
1797	5.125568513119533	USA	07/07/1962	Little Feller II	Nevada Test Site	Atmospheric	37.05575	116.03825	Nevada Test Site	1962-07-07
1798	4.4	USA	06/07/1962	SEDAN	Nevada Test Site	Underground	37.05575	116.03825	Nevada Test Site	1962-06-07
1799	5.125568513119533	USA	30/06/1962	SACRAMENTO	Nevada Test Site	Underground	37.05575	116.03825	Nevada Test Site	1962-06-30
1800	5.125568513119533	USA	30/06/1962	Bluestone	Christmas Island (USA)	Atmospheric	-10.451208	105.688545	Christmas Island (USA)	1962-06-30
1801	5.125568513119533	USA	28/06/1962	MARSHMALLOW	Nevada Test Site	Underground	37.05575	116.03825	Nevada Test Site	1962-06-28
1802	4.9	USA	27/06/1962	HAYMAKER	Nevada Test Site	Underground	37.05575	116.03825	Nevada Test Site	1962-06-27
1803	5.125568513119533	USA	27/06/1962	Bighorn	Christmas Island (USA)	Atmospheric	-10.451208	105.688545	Christmas Island (USA)	1962-06-27
1804	5.125568513119533	USA	22/06/1962	Otowi	Christmas Island (USA)	Atmospheric	-10.451208	105.688545	Christmas Island (USA)	1962-06-22
1805	5.125568513119533	USA	21/06/1962	DAMAN I	Nevada Test Site	Underground	37.05575	116.03825	Nevada Test Site	1962-06-21
1806	5.125568513119533	USA	19/06/1962	Petit	Christmas Island (USA)	Atmospheric	-10.451208	105.688545	Christmas Island (USA)	1962-06-19
1807	5.125568513119533	USA	17/06/1962	Dulce	Christmas Island (USA)	Atmospheric	-10.451208	105.688545	Christmas Island (USA)	1962-06-17
1808	5.125568513119533	USA	15/06/1962	Rinconada	Christmas Island (USA)	Atmospheric	-10.451208	105.688545	Christmas Island (USA)	1962-06-15
1809	5.125568513119533	USA	13/06/1962	DES MOINES	Nevada Test Site	Underground	37.05575	116.03825	Nevada Test Site	1962-06-13
1810	5.125568513119533	USA	12/06/1962	Harlem	Christmas Island (USA)	Atmospheric	-10.451208	105.688545	Christmas Island (USA)	1962-12-06
1811	5.125568513119533	USA	10/06/1962	Yeso	Christmas Island (USA)	Atmospheric	-10.451208	105.688545	Christmas Island (USA)	1962-10-06
1812	5.125568513119533	USA	09/06/1962	Truckee	Christmas Island (USA)	Atmospheric	-10.451208	105.688545	Christmas Island (USA)	1962-09-06
1813	5.125568513119533	USA	08/06/1962	Alma	Christmas Island (USA)	Atmospheric	-10.451208	105.688545	Christmas Island (USA)	1962-08-06
1814	5.125568513119533	USA	06/06/1962	PACKRAT	Nevada Test Site	Underground	37.05575	116.03825	Nevada Test Site	1962-06-06
1815	5.125568513119533	USA	01/06/1962	RACCOON	Nevada Test Site	Underground	37.05575	116.03825	Nevada Test Site	1962-01-06
1816	5.125568513119533	USA	27/05/1962	Nambe	Christmas Island (USA)	Atmospheric	-10.451208	105.688545	Christmas Island (USA)	1962-05-27
1817	5.125568513119533	USA	25/05/1962	WHITE	Nevada Test Site	Underground	37.05575	116.03825	Nevada Test Site	1962-05-25
1818	5.125568513119533	USA	25/05/1962	Tanana	Christmas Island (USA)	Atmospheric	-10.451208	105.688545	Christmas Island (USA)	1962-05-25
1819	5.125568513119533	USA	19/05/1962	EEL	Nevada Test Site	Underground	37.05575	116.03825	Nevada Test Site	1962-05-19
1820	5.125568513119533	USA	19/05/1962	Chetco	Christmas Island (USA)	Atmospheric	-10.451208	105.688545	Christmas Island (USA)	1962-05-19
1821	5.125568513119533	USA	14/05/1962	Swanee	Christmas Island (USA)	Atmospheric	-10.451208	105.688545	Christmas Island (USA)	1962-05-14
1822	4.6	USA	12/05/1962	AARDVARK	Nevada Test Site	Underground	37.05575	116.03825	Nevada Test Site	1962-12-05
1823	5.125568513119533	USA	12/05/1962	Encino	Christmas Island (USA)	Atmospheric	-10.451208	105.688545	Christmas Island (USA)	1962-12-05
1824	5.125568513119533	USA	11/05/1962	SWORDFISH	Pacific	Underwater	12.6167	168.025	Pacific	1962-11-05
1825	5.125568513119533	USA	11/05/1962	Muskegon	Christmas Island (USA)	Atmospheric	-10.451208	105.688545	Christmas Island (USA)	1962-11-05
1826	5.125568513119533	USA	10/05/1962	ARIKAREE	Nevada Test Site	Underground	37.05575	116.03825	Nevada Test Site	1962-10-05
1827	5.125568513119533	USA	09/05/1962	Mesilla	Christmas Island (USA)	Atmospheric	-10.451208	105.688545	Christmas Island (USA)	1962-09-05
1828	5.125568513119533	USA	08/05/1962	Yukon	Christmas Island (USA)	Atmospheric	-10.451208	105.688545	Christmas Island (USA)	1962-08-05
1829	5.125568513119533	USA	07/05/1962	PACA	Nevada Test Site	Underground	37.05575	116.03825	Nevada Test Site	1962-07-05
1830	5.125568513119533	USA	06/05/1962	Frigate Bird	Pacific	Atmospheric	12.6167	168.025	Pacific	1962-06-05
1831	5.125568513119533	USA	04/05/1962	Questa	Christmas Island (USA)	Atmospheric	-10.451208	105.688545	Christmas Island (USA)	1962-04-05
1832	5.125568513119533	USA	02/05/1962	Arkansas	Christmas Island (USA)	Atmospheric	-10.451208	105.688545	Christmas Island (USA)	1962-02-05
1833	5.125568513119533	USA	27/04/1962	BLACK	Nevada Test Site	Underground	37.05575	116.03825	Nevada Test Site	1962-04-27
1834	5.125568513119533	USA	27/04/1962	Aztec	Christmas Island (USA)	Atmospheric	-10.451208	105.688545	Christmas Island (USA)	1962-04-27
1835	5.125568513119533	USA	25/04/1962	Adobe	Christmas Island (USA)	Atmospheric	-10.451208	105.688545	Christmas Island (USA)	1962-04-25
1836	5.125568513119533	USA	21/04/1962	DEAD	Nevada Test Site	Underground	37.05575	116.03825	Nevada Test Site	1962-04-21
1837	5.125568513119533	USA	14/04/1962	PLATTE	Nevada Test Site	Underground	37.05575	116.03825	Nevada Test Site	1962-04-14
1838	5.125568513119533	USA	12/04/1962	HUDSON	Nevada Test Site	Underground	37.05575	116.03825	Nevada Test Site	1962-12-04
1839	5.125568513119533	USA	06/04/1962	PASSAIC	Nevada Test Site	Underground	37.05575	116.03825	Nevada Test Site	1962-06-04
1840	4.3	USA	05/04/1962	DORMOUSE PRIME	Nevada Test Site	Underground	37.05575	116.03825	Nevada Test Site	1962-05-04
1841	5.125568513119533	USA	31/03/1962	CHINCHILLA II	Nevada Test Site	Underground	37.05575	116.03825	Nevada Test Site	1962-03-31
1842	5.125568513119533	USA	28/03/1962	HOOSIC	Nevada Test Site	Underground	37.05575	116.03825	Nevada Test Site	1962-03-28
1843	5.125568513119533	USA	15/03/1962	HOGNOSE	Nevada Test Site	Underground	37.05575	116.03825	Nevada Test Site	1962-03-15
1844	5.125568513119533	USA	08/03/1962	BRAZOS	Nevada Test Site	Underground	37.05575	116.03825	Nevada Test Site	1962-08-03
1845	5.125568513119533	USA	06/03/1962	ERMINE	Nevada Test Site	Underground	37.05575	116.03825	Nevada Test Site	1962-06-03
1846	3.6	USA	05/03/1962	DANNY BOY	Nevada Test Site	Underground	37.05575	116.03825	Nevada Test Site	1962-05-03
1847	5.125568513119533	USA	01/03/1962	PAMPAS	Nevada Test Site	Underground	37.05575	116.03825	Nevada Test Site	1962-01-03
1848	5.125568513119533	USA	24/02/1962	PLATYPUS	Nevada Test Site	Underground	37.05575	116.03825	Nevada Test Site	1962-02-24
1849	5.125568513119533	USA	23/02/1962	CIMARRON	Nevada Test Site	Underground	37.05575	116.03825	Nevada Test Site	1962-02-23
1850	5.125568513119533	USA	19/02/1962	CODSAW	Nevada Test Site	Underground	37.05575	116.03825	Nevada Test Site	1962-02-19
1851	4.2	USA	19/02/1962	CHINCHILLA	Nevada Test Site	Underground	37.05575	116.03825	Nevada Test Site	1962-02-19
1852	5.125568513119533	USA	15/02/1962	HARD HAT	Nevada Test Site	Underground	37.05575	116.03825	Nevada Test Site	1962-02-15
1853	5.125568513119533	USA	09/02/1962	ARMADILLO	Nevada Test Site	Underground	37.05575	116.03825	Nevada Test Site	1962-09-02
1854	5.125568513119533	USA	08/02/1962	STILLWATER	Nevada Test Site	Underground	37.05575	116.03825	Nevada Test Site	1962-08-02
1855	5.125568513119533	USA	30/01/1962	DORMOUSE	Nevada Test Site	Underground	37.05575	116.03825	Nevada Test Site	1962-01-30
1856	4.5	USA	18/01/1962	AGOUTI	Nevada Test Site	Underground	37.05575	116.03825	Nevada Test Site	1962-01-18
1857	4.2	USA	09/01/1962	STOAT	Nevada Test Site	Underground	37.05575	116.03825	Nevada Test Site	1962-09-01
1858	5.125568513119533	USA	22/12/1961	FEATHER	Nevada Test Site	Underground	37.05575	116.03825	Nevada Test Site	1961-12-22
1859	5.125568513119533	USA	17/12/1961	RINGTAIL	Nevada Test Site	Underground	37.05575	116.03825	Nevada Test Site	1961-12-17
1860	3.4	USA	13/12/1961	MAD	Nevada Test Site	Underground	37.05575	116.03825	Nevada Test Site	1961-12-13
1861	5.125568513119533	USA	10/12/1961	GNOME	Carlsnad, New Mexico (USA)	Underground	32.420674	-104.228837	Carlsnad, New Mexico (USA)	1961-10-12
1862	5.125568513119533	USA	03/12/1961	FISHER	Nevada Test Site	Underground	37.05575	116.03825	Nevada Test Site	1961-03-12
1863	5.125568513119533	USA	29/10/1961	MINK	Nevada Test Site	Underground	37.05575	116.03825	Nevada Test Site	1961-10-29
1864	5.125568513119533	USA	10/10/1961	CHENA	Nevada Test Site	Underground	37.05575	116.03825	Nevada Test Site	1961-10-10
1865	5.125568513119533	USA	01/10/1961	BOOMER	Nevada Test Site	Underground	37.05575	116.03825	Nevada Test Site	1961-01-10
1866	5.125568513119533	USA	16/09/1961	SHREW	Nevada Test Site	Underground	37.05575	116.03825	Nevada Test Site	1961-09-16
1867	4.7	USA	15/09/1961	ANTLER	Nevada Test Site	Underground	37.05575	116.03825	Nevada Test Site	1961-09-15
1868	5.125568513119533	USA	30/10/1958	Titania	Nevada Test Site	Atmospheric	37.05575	116.03825	Nevada Test Site	1958-10-30
1869	5.125568513119533	USA	30/10/1958	BLANCA	Nevada Test Site	Underground	37.05575	116.03825	Nevada Test Site	1958-10-30
1870	5.125568513119533	USA	30/10/1958	Santa Fe	Nevada Test Site	Atmospheric	37.05575	116.03825	Nevada Test Site	1958-10-30
1871	5.125568513119533	USA	30/10/1958	Ganymede	Nevada Test Site	Atmospheric	37.05575	116.03825	Nevada Test Site	1958-10-30
1872	5.125568513119533	USA	29/10/1958	Humboldt	Nevada Test Site	Atmospheric	37.05575	116.03825	Nevada Test Site	1958-10-29
1873	5.125568513119533	USA	29/10/1958	Mazama	Nevada Test Site	Atmospheric	37.05575	116.03825	Nevada Test Site	1958-10-29
1874	5.125568513119533	USA	29/10/1958	EVANS	Nevada Test Site	Underground	37.05575	116.03825	Nevada Test Site	1958-10-29
1875	5.125568513119533	USA	27/10/1958	Chavez	Nevada Test Site	Atmospheric	37.05575	116.03825	Nevada Test Site	1958-10-27
1876	5.125568513119533	USA	26/10/1958	De Baca	Nevada Test Site	Atmospheric	37.05575	116.03825	Nevada Test Site	1958-10-26
1877	5.125568513119533	USA	26/10/1958	Sanford	Nevada Test Site	Atmospheric	37.05575	116.03825	Nevada Test Site	1958-10-26
1878	5.125568513119533	USA	26/10/1958	Ceres	Nevada Test Site	Atmospheric	37.05575	116.03825	Nevada Test Site	1958-10-26
1879	5.125568513119533	USA	24/10/1958	Juno	Nevada Test Site	Atmospheric	37.05575	116.03825	Nevada Test Site	1958-10-24
1880	5.125568513119533	USA	24/10/1958	Catron	Nevada Test Site	Atmospheric	37.05575	116.03825	Nevada Test Site	1958-10-24
1881	5.125568513119533	USA	22/10/1958	Rushmore	Nevada Test Site	Atmospheric	37.05575	116.03825	Nevada Test Site	1958-10-22
1882	5.125568513119533	USA	22/10/1958	Wrangell	Nevada Test Site	Atmospheric	37.05575	116.03825	Nevada Test Site	1958-10-22
1883	5.125568513119533	USA	22/10/1958	Socorro	Nevada Test Site	Atmospheric	37.05575	116.03825	Nevada Test Site	1958-10-22
1884	5.125568513119533	USA	22/10/1958	Oberon	Nevada Test Site	Atmospheric	37.05575	116.03825	Nevada Test Site	1958-10-22
1885	5.125568513119533	USA	20/10/1958	SAN JUAN	Nevada Test Site	Underground	37.05575	116.03825	Nevada Test Site	1958-10-20
1886	5.125568513119533	USA	18/10/1958	Rio Arriba	Nevada Test Site	Atmospheric	37.05575	116.03825	Nevada Test Site	1958-10-18
1887	5.125568513119533	USA	17/10/1958	Vesta	Nevada Test Site	Atmospheric	37.05575	116.03825	Nevada Test Site	1958-10-17
1888	5.125568513119533	USA	16/10/1958	Dona Ana	Nevada Test Site	Atmospheric	37.05575	116.03825	Nevada Test Site	1958-10-16
1889	5.125568513119533	USA	16/10/1958	LOGAN	Nevada Test Site	Underground	37.05575	116.03825	Nevada Test Site	1958-10-16
1890	5.125568513119533	USA	15/10/1958	Hamilton	Nevada Test Site	Atmospheric	37.05575	116.03825	Nevada Test Site	1958-10-15
1891	5.125568513119533	USA	14/10/1958	NEPTUNE	Nevada Test Site	Underground	37.05575	116.03825	Nevada Test Site	1958-10-14
1892	5.125568513119533	USA	13/10/1958	Lea	Nevada Test Site	Atmospheric	37.05575	116.03825	Nevada Test Site	1958-10-13
1893	5.125568513119533	USA	10/10/1958	Quay	Nevada Test Site	Atmospheric	37.05575	116.03825	Nevada Test Site	1958-10-10
1894	5.125568513119533	USA	08/10/1958	TAMALPAIS	Nevada Test Site	Underground	37.05575	116.03825	Nevada Test Site	1958-08-10
1895	5.125568513119533	USA	05/10/1958	COLFAX	Nevada Test Site	Underground	37.05575	116.03825	Nevada Test Site	1958-05-10
1896	5.125568513119533	USA	05/10/1958	Hidalgo	Nevada Test Site	Atmospheric	37.05575	116.03825	Nevada Test Site	1958-05-10
1897	5.125568513119533	USA	29/09/1958	Mora	Nevada Test Site	Atmospheric	37.05575	116.03825	Nevada Test Site	1958-09-29
1898	5.125568513119533	USA	28/09/1958	MARS	Nevada Test Site	Underground	37.05575	116.03825	Nevada Test Site	1958-09-28
1899	5.125568513119533	USA	26/09/1958	VALENCIA	Nevada Test Site	Underground	37.05575	116.03825	Nevada Test Site	1958-09-26
1900	5.125568513119533	USA	23/09/1958	MERCURY	Nevada Test Site	Underground	37.05575	116.03825	Nevada Test Site	1958-09-23
1901	5.125568513119533	USA	21/09/1958	LUNA	Nevada Test Site	Underground	37.05575	116.03825	Nevada Test Site	1958-09-21
1902	5.125568513119533	USA	19/09/1958	Eddy	Nevada Test Site	Atmospheric	37.05575	116.03825	Nevada Test Site	1958-09-19
1903	5.125568513119533	USA	17/09/1958	BERNALILLO	Nevada Test Site	Underground	37.05575	116.03825	Nevada Test Site	1958-09-17
1904	5.125568513119533	USA	12/09/1958	OTERO	Nevada Test Site	Underground	37.05575	116.03825	Nevada Test Site	1958-12-09
1905	5.125568513119533	USA	06/09/1958	Argus III	South Atlantic	Atmospheric	-47	40	South Atlantic	1958-06-09
1906	5.125568513119533	USA	30/08/1958	Argus II	South Atlantic	Atmospheric	-47	40	South Atlantic	1958-08-30
1907	5.125568513119533	USA	27/08/1958	Argus I	South Atlantic	Atmospheric	-47	40	South Atlantic	1958-08-27
1908	5.125568513119533	USA	18/08/1958	Fig	Enewetak (USA)	Atmospheric	11	162	Enewetak (USA)	1958-08-18
1909	5.125568513119533	USA	12/08/1958	Orange	Johnston Island	Atmospheric	16.729503	-169.533648	Johnston Island	1958-12-08
1910	5.125568513119533	USA	06/08/1958	Quince	Enewetak (USA)	Atmospheric	11	162	Enewetak (USA)	1958-06-08
1911	5.125568513119533	USA	01/08/1958	Teak	Johnston Island	Atmospheric	16.729503	-169.533648	Johnston Island	1958-01-08
1912	5.125568513119533	USA	26/07/1958	Pine	Enewetak (USA)	Atmospheric	11.6561	162.2197	Enewetak (USA)	1958-07-26
1913	5.125568513119533	USA	22/07/1958	Olive	Enewetak (USA)	Atmospheric	11.6633	162.23	Enewetak (USA)	1958-07-22
1914	5.125568513119533	USA	22/07/1958	Juniper	Bikini Is (USA)	Atmospheric	11.4961	165.3708	Bikini Is (USA)	1958-07-22
1915	5.125568513119533	USA	17/07/1958	Pisonia	Enewetak (USA)	Atmospheric	11	162	Enewetak (USA)	1958-07-17
1916	5.125568513119533	USA	14/07/1958	Scaevola	Enewetak (USA)	Atmospheric	11	162	Enewetak (USA)	1958-07-14
1917	5.125568513119533	USA	12/07/1958	Poplar	Bikini Is (USA)	Atmospheric	11.6881	165.2644	Bikini Is (USA)	1958-12-07
1918	5.125568513119533	USA	05/07/1958	Dogwood	Enewetak (USA)	Atmospheric	11.6633	162.23	Enewetak (USA)	1958-05-07
1919	5.125568513119533	USA	02/07/1958	Cedar	Bikini Is (USA)	Atmospheric	11.6908	165.2736	Bikini Is (USA)	1958-02-07
1920	5.125568513119533	USA	01/07/1958	Sequoia	Enewetak (USA)	Atmospheric	11.5442	162.3564	Enewetak (USA)	1958-01-07
1921	5.125568513119533	USA	29/06/1958	Hickory	Bikini Is (USA)	Atmospheric	11.4961	162.3708	Bikini Is (USA)	1958-06-29
1922	5.125568513119533	USA	28/06/1958	Oak	Enewetak (USA)	Atmospheric	11.6078	162.1078	Enewetak (USA)	1958-06-28
1923	5.125568513119533	USA	27/06/1958	Elder	Enewetak (USA)	Atmospheric	11.6633	162.23	Enewetak (USA)	1958-06-27
1924	5.125568513119533	USA	27/06/1958	Redwood	Bikini Is (USA)	Atmospheric	11.6872	165.415	Bikini Is (USA)	1958-06-27
1925	5.125568513119533	USA	18/06/1958	Linden	Enewetak (USA)	Atmospheric	11.5442	162.3564	Enewetak (USA)	1958-06-18
1926	5.125568513119533	USA	14/06/1958	Walnut	Enewetak (USA)	Atmospheric	11.6603	162.2253	Enewetak (USA)	1958-06-14
1927	5.125568513119533	USA	14/06/1958	Aspen	Bikini Is (USA)	Atmospheric	11.6908	165.2733	Bikini Is (USA)	1958-06-14
1928	5.125568513119533	USA	10/06/1958	Maple	Bikini Is (USA)	Atmospheric	11.6872	165.415	Bikini Is (USA)	1958-10-06
1929	5.125568513119533	USA	08/06/1958	UMBRELLA	Enewetak (USA)	Underground	11.38	162.218	Enewetak (USA)	1958-08-06
1930	5.125568513119533	USA	02/06/1958	Rose	Enewetak (USA)	Atmospheric	11.5411	162.3517	Enewetak (USA)	1958-02-06
1931	5.125568513119533	USA	31/05/1958	Sycamore	Bikini Is (USA)	Atmospheric	11.6908	165.2736	Bikini Is (USA)	1958-05-31
1932	5.125568513119533	USA	30/05/1958	Tobacco	Enewetak (USA)	Atmospheric	11.6633	162.23	Enewetak (USA)	1958-05-30
1933	5.125568513119533	USA	26/05/1958	Magnolia	Enewetak (USA)	Atmospheric	11.5428	162.3539	Enewetak (USA)	1958-05-26
1934	5.125568513119533	USA	26/05/1958	Yellowwood	Enewetak (USA)	Atmospheric	11.6603	162.2253	Enewetak (USA)	1958-05-26
1935	5.125568513119533	USA	21/05/1958	Nutmeg	Bikini Is (USA)	Atmospheric	11.4961	165.3708	Bikini Is (USA)	1958-05-21
1936	5.125568513119533	USA	20/05/1958	Holly	Enewetak (USA)	Atmospheric	11.5439	162.3561	Enewetak (USA)	1958-05-20
1937	5.125568513119533	USA	16/05/1958	WAHOO	Enewetak (USA)	Underground	11.344	162.178	Enewetak (USA)	1958-05-16
1938	5.125568513119533	USA	12/05/1958	Koa	Enewetak (USA)	Atmospheric	11.675	162.2056	Enewetak (USA)	1958-12-05
1939	5.125568513119533	USA	11/05/1958	Butternut	Enewetak (USA)	Atmospheric	11.5411	162.3506	Enewetak (USA)	1958-11-05
1940	5.125568513119533	USA	11/05/1958	Fir	Bikini Is (USA)	Atmospheric	11.6908	165.2736	Bikini Is (USA)	1958-11-05
1941	5.125568513119533	USA	05/05/1958	Cactus	Enewetak (USA)	Atmospheric	11.5564	162.3542	Enewetak (USA)	1958-05-05
1942	5.125568513119533	USA	28/04/1958	Yucca	Pacific	Atmospheric	12.6167	168.025	Pacific	1958-04-28
1943	5.125568513119533	USA	14/03/1958	URANUS	Nevada Test Site	Underground	37.05575	116.03825	Nevada Test Site	1958-03-14
1944	5.125568513119533	USA	22/02/1958	VENUS	Nevada Test Site	Underground	37.05575	116.03825	Nevada Test Site	1958-02-22
1945	5.125568513119533	USA	09/12/1957	Coulomb-C	Nevada Test Site	Atmospheric	37.05575	116.03825	Nevada Test Site	1957-09-12
1946	5.125568513119533	USA	06/12/1957	PASCAL-C	Nevada Test Site	Underground	37.05575	116.03825	Nevada Test Site	1957-06-12
1947	5.125568513119533	USA	07/10/1957	Morgan	Nevada Test Site	Atmospheric	37.05575	116.03825	Nevada Test Site	1957-07-10
1948	5.125568513119533	USA	28/09/1957	Charleston	Nevada Test Site	Atmospheric	37.05575	116.03825	Nevada Test Site	1957-09-28
1949	5.125568513119533	USA	23/09/1957	Whitney	Nevada Test Site	Atmospheric	37.05575	116.03825	Nevada Test Site	1957-09-23
1950	5.125568513119533	USA	19/09/1957	RAINIER	Nevada Test Site	Underground	37.05575	116.03825	Nevada Test Site	1957-09-19
1951	5.125568513119533	USA	16/09/1957	Newton	Nevada Test Site	Atmospheric	37.05575	116.03825	Nevada Test Site	1957-09-16
1952	5.125568513119533	USA	14/09/1957	Fizeau	Nevada Test Site	Atmospheric	37.05575	116.03825	Nevada Test Site	1957-09-14
1953	5.125568513119533	USA	08/09/1957	Laplace	Nevada Test Site	Atmospheric	37.05575	116.03825	Nevada Test Site	1957-08-09
1954	5.125568513119533	USA	06/09/1957	Coulomb-B	Nevada Test Site	Atmospheric	37.05575	116.03825	Nevada Test Site	1957-06-09
1955	5.125568513119533	USA	06/09/1957	Wheeler	Nevada Test Site	Atmospheric	37.05575	116.03825	Nevada Test Site	1957-06-09
1956	5.125568513119533	USA	02/09/1957	Galileo	Nevada Test Site	Atmospheric	37.05575	116.03825	Nevada Test Site	1957-02-09
1957	5.125568513119533	USA	31/08/1957	Smoky	Nevada Test Site	Atmospheric	37.05575	116.03825	Nevada Test Site	1957-08-31
1958	5.125568513119533	USA	30/08/1957	Franklin Prime	Nevada Test Site	Atmospheric	37.05575	116.03825	Nevada Test Site	1957-08-30
1959	5.125568513119533	USA	27/08/1957	PASCAL-B	Nevada Test Site	Underground	37.05575	116.03825	Nevada Test Site	1957-08-27
1960	5.125568513119533	USA	23/08/1957	Doppler	Nevada Test Site	Atmospheric	37.05575	116.03825	Nevada Test Site	1957-08-23
1961	5.125568513119533	USA	18/08/1957	Shasta	Nevada Test Site	Atmospheric	37.05575	116.03825	Nevada Test Site	1957-08-18
1962	5.125568513119533	USA	10/08/1957	SATURN	Nevada Test Site	Underground	37.05575	116.03825	Nevada Test Site	1957-10-08
1963	5.125568513119533	USA	07/08/1957	Stokes	Nevada Test Site	Atmospheric	37.05575	116.03825	Nevada Test Site	1957-07-08
1964	5.125568513119533	USA	26/07/1957	PASCAL-A	Nevada Test Site	Underground	37.05575	116.03825	Nevada Test Site	1957-07-26
1965	5.125568513119533	USA	25/07/1957	Owens	Nevada Test Site	Atmospheric	37.05575	116.03825	Nevada Test Site	1957-07-25
1966	5.125568513119533	USA	24/07/1957	Kepler	Nevada Test Site	Atmospheric	37.05575	116.03825	Nevada Test Site	1957-07-24
1967	5.125568513119533	USA	19/07/1957	John	Nevada Test Site	Atmospheric	37.05575	116.03825	Nevada Test Site	1957-07-19
1968	5.125568513119533	USA	15/07/1957	Diablo	Nevada Test Site	Atmospheric	37.05575	116.03825	Nevada Test Site	1957-07-15
1969	5.125568513119533	USA	05/07/1957	Hood	Nevada Test Site	Atmospheric	37.05575	116.03825	Nevada Test Site	1957-05-07
1970	5.125568513119533	USA	01/07/1957	Coulomb-A	Nevada Test Site	Atmospheric	37.05575	116.03825	Nevada Test Site	1957-01-07
1971	5.125568513119533	USA	24/06/1957	Priscilla	Nevada Test Site	Atmospheric	37.05575	116.03825	Nevada Test Site	1957-06-24
1972	5.125568513119533	USA	18/06/1957	Wilson	Nevada Test Site	Atmospheric	37.05575	116.03825	Nevada Test Site	1957-06-18
1973	5.125568513119533	USA	05/06/1957	Lassen	Nevada Test Site	Atmospheric	37.05575	116.03825	Nevada Test Site	1957-05-06
1974	5.125568513119533	USA	02/06/1957	Franklin	Nevada Test Site	Atmospheric	37.05575	116.03825	Nevada Test Site	1957-02-06
1975	5.125568513119533	USA	28/05/1957	Boltzmann	Nevada Test Site	Atmospheric	37.05575	116.03825	Nevada Test Site	1957-05-28
1976	5.125568513119533	USA	24/04/1957	Project 57 No.	Nellis Air Force Range	Atmospheric	36.308119	-115.049367	Nellis Air Force Range	1957-04-24
1977	5.125568513119533	USA	21/07/1956	Huron	Enewetak (USA)	Atmospheric	11.6719	162.3692	Enewetak (USA)	1956-07-21
1978	5.125568513119533	USA	20/07/1956	Tewa	Bikini Is (USA)	Atmospheric	11.6739	165.3394	Bikini Is (USA)	1956-07-20
1979	5.125568513119533	USA	10/07/1956	Navajo	Bikini Is (USA)	Atmospheric	11.6633	165.3872	Bikini Is (USA)	1956-10-07
1980	5.125568513119533	USA	08/07/1956	Apache	Enewetak (USA)	Atmospheric	11.6714	162.2003	Enewetak (USA)	1956-08-07
1981	5.125568513119533	USA	02/07/1956	Mohawk	Enewetak (USA)	Atmospheric	11	162	Enewetak (USA)	1956-02-07
1982	5.125568513119533	USA	25/06/1956	Dakota	Bikini Is (USA)	Atmospheric	11.6028	165.4514	Bikini Is (USA)	1956-06-25
1983	5.125568513119533	USA	21/06/1956	Inca	Enewetak (USA)	Atmospheric	11	162	Enewetak (USA)	1956-06-21
1984	5.125568513119533	USA	16/06/1956	Osage	Enewetak (USA)	Atmospheric	11.5467	162.3608	Enewetak (USA)	1956-06-16
1985	5.125568513119533	USA	13/06/1956	Kickapoo	Enewetak (USA)	Atmospheric	11	162	Enewetak (USA)	1956-06-13
1986	5.125568513119533	USA	11/06/1956	Blackfoot	Enewetak (USA)	Atmospheric	11.5511	162.3586	Enewetak (USA)	1956-11-06
1987	5.125568513119533	USA	11/06/1956	Flathead	Bikini Is (USA)	Atmospheric	11.6	165.4514	Bikini Is (USA)	1956-11-06
1988	5.125568513119533	USA	06/06/1956	Seminole	Enewetak (USA)	Atmospheric	11.6764	162.2222	Enewetak (USA)	1956-06-06
1989	5.125568513119533	USA	30/05/1956	Erie	Enewetak (USA)	Atmospheric	11.5444	162.3644	Enewetak (USA)	1956-05-30
1990	5.125568513119533	USA	27/05/1956	Zuni	Bikini Is (USA)	Atmospheric	11.4967	165.3692	Bikini Is (USA)	1956-05-27
1991	5.125568513119533	USA	27/05/1956	Yuma	Enewetak (USA)	Atmospheric	11	162	Enewetak (USA)	1956-05-27
1992	5.125568513119533	USA	20/05/1956	Cherokee	Bikini Is (USA)	Atmospheric	11.6683	165.3942	Bikini Is (USA)	1956-05-20
1993	5.125568513119533	USA	04/05/1956	Lacrosse	Enewetak (USA)	Atmospheric	11.5578	162.355	Enewetak (USA)	1956-04-05
1994	5.125568513119533	USA	18/01/1956	Project 56 No. 4	Nevada Test Site	Atmospheric	37.05575	116.03825	Nevada Test Site	1956-01-18
1995	5.125568513119533	USA	05/11/1955	Project 56 No. 3	Nevada Test Site	Atmospheric	37.05575	116.03825	Nevada Test Site	1955-05-11
1996	5.125568513119533	USA	03/11/1955	Project 56 No. 2	Nevada Test Site	Atmospheric	37.05575	116.03825	Nevada Test Site	1955-03-11
1997	5.125568513119533	USA	01/11/1955	Project 56 No. 1	Nevada Test Site	Atmospheric	37.05575	116.03825	Nevada Test Site	1955-01-11
1998	5.125568513119533	USA	15/05/1955	Zucchini	Nevada Test Site	Atmospheric	37.05575	116.03825	Nevada Test Site	1955-05-15
1999	5.125568513119533	USA	14/05/1955	WIGWAM	Pacific	Underwater	12.6167	168.025	Pacific	1955-05-14
2000	5.125568513119533	USA	05/05/1955	Apple-2	Nevada Test Site	Atmospheric	37.05575	116.03825	Nevada Test Site	1955-05-05
2001	5.125568513119533	USA	15/04/1955	Met	Nevada Test Site	Atmospheric	37.05575	116.03825	Nevada Test Site	1955-04-15
2002	5.125568513119533	USA	09/04/1955	Post	Nevada Test Site	Atmospheric	37.05575	116.03825	Nevada Test Site	1955-09-04
2003	5.125568513119533	USA	06/04/1955	HA (High Altitu	Nevada Test Site	Atmospheric	37.05575	116.03825	Nevada Test Site	1955-06-04
2004	5.125568513119533	USA	29/03/1955	Wasp Prime	Nevada Test Site	Atmospheric	37.05575	116.03825	Nevada Test Site	1955-03-29
2005	5.125568513119533	USA	29/03/1955	Apple-1	Nevada Test Site	Atmospheric	37.05575	116.03825	Nevada Test Site	1955-03-29
2006	5.125568513119533	USA	23/03/1955	ESS	Nevada Test Site	Atmospheric	37.05575	116.03825	Nevada Test Site	1955-03-23
2007	5.125568513119533	USA	22/03/1955	Bee	Nevada Test Site	Atmospheric	37.05575	116.03825	Nevada Test Site	1955-03-22
2008	5.125568513119533	USA	12/03/1955	Hornet	Nevada Test Site	Atmospheric	37.05575	116.03825	Nevada Test Site	1955-12-03
2009	5.125568513119533	USA	07/03/1955	Turk	Nevada Test Site	Atmospheric	37.05575	116.03825	Nevada Test Site	1955-07-03
2010	5.125568513119533	USA	01/03/1955	Tesla	Nevada Test Site	Atmospheric	37.05575	116.03825	Nevada Test Site	1955-01-03
2011	5.125568513119533	USA	22/02/1955	Moth	Nevada Test Site	Atmospheric	37.05575	116.03825	Nevada Test Site	1955-02-22
2012	5.125568513119533	USA	18/02/1955	Wasp	Nevada Test Site	Atmospheric	37.05575	116.03825	Nevada Test Site	1955-02-18
2013	5.125568513119533	USA	13/05/1954	Nectar	Enewetak (USA)	Atmospheric	11.6705	162.1964	Enewetak (USA)	1954-05-13
2014	5.125568513119533	USA	04/05/1954	Yankee	Bikini Is (USA)	Atmospheric	11.6656	165.3869	Bikini Is (USA)	1954-04-05
2015	5.125568513119533	USA	25/04/1954	Union	Bikini Is (USA)	Atmospheric	11.6664	165.3872	Bikini Is (USA)	1954-04-25
2016	5.125568513119533	USA	06/04/1954	Koon	Bikini Is (USA)	Atmospheric	11.4967	165.3675	Bikini Is (USA)	1954-06-04
2017	5.125568513119533	USA	26/03/1954	Romeo	Bikini Is (USA)	Atmospheric	11.6908	165.273	Bikini Is (USA)	1954-03-26
2018	5.125568513119533	USA	28/02/1954	Bravo	Bikini Is (USA)	Atmospheric	11.6908	165.2736	Bikini Is (USA)	1954-02-28
2019	5.125568513119533	USA	04/06/1953	Climax	Nevada Test Site	Atmospheric	37.05575	116.03825	Nevada Test Site	1953-04-06
2020	5.125568513119533	USA	25/05/1953	Grable	Nevada Test Site	Atmospheric	37.05575	116.03825	Nevada Test Site	1953-05-25
2021	5.125568513119533	USA	19/05/1953	Harry	Nevada Test Site	Atmospheric	37.05575	116.03825	Nevada Test Site	1953-05-19
2022	5.125568513119533	USA	08/05/1953	Encore	Nevada Test Site	Atmospheric	37.05575	116.03825	Nevada Test Site	1953-08-05
2023	5.125568513119533	USA	25/04/1953	Simon	Nevada Test Site	Atmospheric	37.05575	116.03825	Nevada Test Site	1953-04-25
2024	5.125568513119533	USA	18/04/1953	Badger	Nevada Test Site	Atmospheric	37.05575	116.03825	Nevada Test Site	1953-04-18
2025	5.125568513119533	USA	11/04/1953	Ray	Nevada Test Site	Atmospheric	37.05575	116.03825	Nevada Test Site	1953-11-04
2026	5.125568513119533	USA	06/04/1953	Dixie	Nevada Test Site	Atmospheric	37.05575	116.03825	Nevada Test Site	1953-06-04
2027	5.125568513119533	USA	31/03/1953	Ruth	Nevada Test Site	Atmospheric	37.05575	116.03825	Nevada Test Site	1953-03-31
2028	5.125568513119533	USA	24/03/1953	Nancy	Nevada Test Site	Atmospheric	37.05575	116.03825	Nevada Test Site	1953-03-24
2029	5.125568513119533	USA	17/03/1953	Annie	Nevada Test Site	Atmospheric	37.05575	116.03825	Nevada Test Site	1953-03-17
2030	5.125568513119533	USA	15/11/1952	King	Enewetak (USA)	Atmospheric	11.5622	162.3525	Enewetak (USA)	1952-11-15
2031	5.125568513119533	USA	31/10/1952	Mike	Enewetak (USA)	Atmospheric	11.2372	162.1964	Enewetak (USA)	1952-10-31
2032	5.125568513119533	USA	05/06/1952	How	Nevada Test Site	Atmospheric	37.05575	116.03825	Nevada Test Site	1952-05-06
2033	5.125568513119533	USA	01/06/1952	George	Nevada Test Site	Atmospheric	37.05575	116.03825	Nevada Test Site	1952-01-06
2034	5.125568513119533	USA	25/05/1952	Fox	Nevada Test Site	Atmospheric	37.05575	116.03825	Nevada Test Site	1952-05-25
2035	5.125568513119533	USA	07/05/1952	Easy	Nevada Test Site	Atmospheric	37.05575	116.03825	Nevada Test Site	1952-07-05
2036	5.125568513119533	USA	01/05/1952	Dog	Nevada Test Site	Atmospheric	37.05575	116.03825	Nevada Test Site	1952-01-05
2037	5.125568513119533	USA	22/04/1952	Charlie	Nevada Test Site	Atmospheric	37.05575	116.03825	Nevada Test Site	1952-04-22
2038	5.125568513119533	USA	15/04/1952	Baker	Nevada Test Site	Atmospheric	37.05575	116.03825	Nevada Test Site	1952-04-15
2039	5.125568513119533	USA	01/04/1952	Able	Nevada Test Site	Atmospheric	37.05575	116.03825	Nevada Test Site	1952-01-04
2040	5.125568513119533	USA	29/11/1951	UNCLE	Nevada Test Site	Atmospheric	37.05575	116.03825	Nevada Test Site	1951-11-29
2041	5.125568513119533	USA	19/11/1951	Sugar	Nevada Test Site	Atmospheric	37.05575	116.03825	Nevada Test Site	1951-11-19
2042	5.125568513119533	USA	05/11/1951	Easy	Nevada Test Site	Atmospheric	37.05575	116.03825	Nevada Test Site	1951-05-11
2043	5.125568513119533	USA	01/11/1951	Dog	Nevada Test Site	Atmospheric	37.05575	116.03825	Nevada Test Site	1951-01-11
2044	5.125568513119533	USA	30/10/1951	Charlie	Nevada Test Site	Atmospheric	37.05575	116.03825	Nevada Test Site	1951-10-30
2045	5.125568513119533	USA	28/10/1951	Baker	Nevada Test Site	Atmospheric	37.05575	116.03825	Nevada Test Site	1951-10-28
2046	5.125568513119533	USA	22/10/1951	Able	Nevada Test Site	Atmospheric	37.05575	116.03825	Nevada Test Site	1951-10-22
2047	5.125568513119533	USA	24/05/1951	Item	Enewetak (USA)	Atmospheric	11.673	162.2486	Enewetak (USA)	1951-05-24
2048	5.125568513119533	USA	08/05/1951	George	Enewetak (USA)	Atmospheric	11.6269	162.3147	Enewetak (USA)	1951-08-05
2049	5.125568513119533	USA	20/04/1951	Easy	Enewetak (USA)	Atmospheric	11.6689	162.2403	Enewetak (USA)	1951-04-20
2050	5.125568513119533	USA	07/04/1951	Dog	Enewetak (USA)	Atmospheric	11.5558	162.3544	Enewetak (USA)	1951-07-04
2051	5.125568513119533	USA	06/02/1951	Fox	Nevada Test Site	Atmospheric	37.05575	116.03825	Nevada Test Site	1951-06-02
2052	5.125568513119533	USA	02/02/1951	Baker-2	Nevada Test Site	Atmospheric	37.05575	116.03825	Nevada Test Site	1951-02-02
2053	5.125568513119533	USA	01/02/1951	Easy	Nevada Test Site	Atmospheric	37.05575	116.03825	Nevada Test Site	1951-01-02
2054	5.125568513119533	USA	28/01/1951	Baker	Nevada Test Site	Atmospheric	37.05575	116.03825	Nevada Test Site	1951-01-28
2055	5.125568513119533	USA	27/01/1951	Able	Nevada Test Site	Atmospheric	37.05575	116.03825	Nevada Test Site	1951-01-27
2056	5.125568513119533	USA	14/05/1948	Zebra	Enewetak (USA)	Atmospheric	11	162	Enewetak (USA)	1948-05-14
2057	5.125568513119533	USA	30/04/1948	Yoke	Enewetak (USA)	Atmospheric	11	162	Enewetak (USA)	1948-04-30
2058	5.125568513119533	USA	14/04/1948	X-ray	Enewetak (USA)	Atmospheric	11	162	Enewetak (USA)	1948-04-14
2059	5.125568513119533	USA	24/07/1946	BAKER-CROSSROADS	Bikini Is (USA)	Underwater	11.62	165.49	Bikini Is (USA)	1946-07-24
2060	5.125568513119533	USA	30/06/1946	Able	Bikini Is (USA)	Atmospheric	11	165	Bikini Is (USA)	1946-06-30
2061	5.125568513119533	USA	09/08/1945	fatman	Nagasaki, Japan	Atmospheric	32.48	129.53	Nagasaki, Japan	1945-09-08
2062	5.125568513119533	USA	05/08/1945	littleboy	Hiroshima, Japan	Atmospheric	34.22	132.25	Hiroshima, Japan	1945-05-08
2063	5.125568513119533	USA	16/07/1945	Trinity	New Mexico (USA)	Atmospheric	34.519940	-105.870090	New Mexico (USA)	1945-07-16
